index,title,authors,abstract,summary,source,venue_type,journal,publication_status,publication_date,doi,categories,score,matched_keywords,cited_by_count,article_url,pdf_url,open_access_status,local_pdf,pdf_download_status
24,"Decoding Scientific Experimental Images: The SPUR Benchmark for Perception, Understanding, and Reasoning",Junpeng Ding; Zichen Tang; Haihong E; Mengyuan Ji; Yang Liu; Haolin Tian; Haiyang Sun; Pengqi Sun; Yang Xu; Yichen Liu; Haocheng Gao; Zijie Xi; Ruomeng Jiang; Peizhi Zhao; Rongjin Li; Yuanze Li; Jiacheng Liu; Zhongjun Yang; Jintong Chen; Siying Lin,"We introduce SPUR, a comprehensive benchmark for scientific experimental image perception, understanding, and reasoning, comprising 4,264 question-answering (QA) pairs derived from 1,084 expert-curated images. SPUR features three key innovations: (1) Panel-Level Fine-Grained Perception: evaluating the visual perception of multimodal large language models (MLLMs) across three dimensions (numerical, morphological, and information localization) on six fine-grained panel types; (2) Cross-Panel Relation Understanding: utilizing complex images with an average of 14.3 panels per sample to evaluate MLLMs’ ability to decipher intricate cross-panel relations; (3) Expert-Level Reasoning: assessment of qualitative and quantitative reasoning across five experimental paradigms to determine if models can infer conclusions from evidence as human experts do. Comprehensive evaluation of 20 MLLMs and four multimodal Chain-of-Thought (MCoT) methods reveals that current models fall significantly short of the expert-level requirements for scientific image interpretation, underscoring a critical bottleneck in AI for Science (AI4S) research.","We introduce SPUR, a comprehensive benchmark for scientific experimental image perception, understanding, and reasoning, comprising 4,264 question-answering (QA) pairs derived from 1,084 expert-curated images. SPUR features three key innovations: (1) Panel-Level Fine-Grained Perception: evaluating the visual perception of multimodal large language models (MLLMs) across three dimensions (numerical, morphological, and information localization) on six fine-grained panel types; (2) Cross-Panel Relation Understanding: utilizing complex images with an average of 14.3 panels per sample to evaluate MLLMs’ ability to decipher intricate cross-panel relations; (3) Expert-Level Reasoning: assessment of qualitative and quantitative reasoning across five experimental paradigms to determine if models can infer conclusions from evidence as human experts do. Comprehensive evaluation of 20 MLLMs and four multimodal Chain-of-Thought (MCoT) methods reveals that current models fall significantly short of the expert-level requirements for scientific image interpretation, underscoring a critical bottleneck in AI for Science (AI4S) research.",acl_anthology,conference,ACL,formally_published,2026-01-01,,,3.124151302638809,large language model; multimodal large language model,,https://aclanthology.org/2026.acl-long.585/,https://aclanthology.org/2026.acl-long.585.pdf,open,"pdf/2026-06-26_24_Decoding Scientific Experimental Images_ The SPUR Benchmark for Perception, Understanding, and Reasoning.pdf",downloaded
25,On the Role of Discriminative Models in Generative Relation Extraction,Guozheng Li; Peng Wang; Zijie Xu; Jing Zhou; Jiajun Liu; Ziyu Shang,"Relation extraction (RE) identifies semantic relations between entities in text, with existing methods falling into two main paradigms: discriminative and generative. Discriminative models encode sentences and entities into relation representations and classify the most likely relation, whereas generative models directly produce relation labels through sequence generation. Although the latter have benefited from recent advances in large language models (LLMs), their performance remains limited by bottlenecks. In this work, we present the systematic investigation of how discriminative models can support generative RE. We propose the Discriminative-to-Generative (D2G) framework, which first leverages discriminative models to produce a top-k set of candidate relations, and then integrates this knowledge into generative models via in-context or prompt learning. Extensive experiments on five widely used RE benchmarks demonstrate that D2G consistently achieves state-of-the-art performance, with notable gains on long-tailed relation classes.","Relation extraction (RE) identifies semantic relations between entities in text, with existing methods falling into two main paradigms: discriminative and generative. Discriminative models encode sentences and entities into relation representations and classify the most likely relation, whereas generative models directly produce relation labels through sequence generation. Although the latter have benefited from recent advances in large language models (LLMs), their performance remains limited by bottlenecks. In this work, we present the systematic investigation of how discriminative models can support generative RE. We propose the Discriminative-to-Generative (D2G) framework, which first leverages discriminative models to produce a top-k set of candidate relations, and then integrates this knowledge into generative models via in-context or prompt learning. Extensive experiments on five widely used RE benchmarks demonstrate that D2G consistently achieves state-of-the-art performance, with notable gains on long-tailed relation classes.",acl_anthology,conference,ACL,formally_published,2026-01-01,,,3.1232611285082,large language model,,https://aclanthology.org/2026.acl-long.2093/,https://aclanthology.org/2026.acl-long.2093.pdf,open,pdf/2026-06-26_25_On the Role of Discriminative Models in Generative Relation Extraction.pdf,downloaded
26,SeLaR: Selective Latent Reasoning in Large Language Models,Renyu Fu; Guibo Luo,"Chain-of-Thought (CoT) has become a cornerstone of reasoning in large language models, yet its effectiveness is constrained by the limited expressiveness of discrete token sampling. Recent latent reasoning approaches attempt to alleviate this limitation by replacing discrete tokens with soft embeddings (probability-weighted mixtures of token embeddings) or hidden states, but they commonly suffer from two issues: (1) global activation injects perturbations into high-confidence steps, impairing reasoning stability; and (2) soft embeddings quickly collapse toward the highest-probability token, limiting exploration of alternative trajectories. To address these challenges, we propose SeLaR (Selective Latent Reasoning), a lightweight and training-free framework. SeLaR introduces an entropy-gated mechanism that activates soft embeddings only at low-confidence steps, while preserving discrete decoding at high-confidence steps. Additionally, we propose an entropy-aware contrastive regularization that pushes soft embeddings away from the highest-probability token’s direction, encouraging sustained exploration of multiple latent reasoning paths. Experiments on five reasoning benchmarks demonstrate that SeLaR consistently outperforms standard CoT and state-of-the-art training-free methods.","Chain-of-Thought (CoT) has become a cornerstone of reasoning in large language models, yet its effectiveness is constrained by the limited expressiveness of discrete token sampling. Recent latent reasoning approaches attempt to alleviate this limitation by replacing discrete tokens with soft embeddings (probability-weighted mixtures of token embeddings) or hidden states, but they commonly suffer from two issues: (1) global activation injects perturbations into high-confidence steps, impairing reasoning stability; and (2) soft embeddings quickly collapse toward the highest-probability token, limiting exploration of alternative trajectories. To address these challenges, we propose SeLaR (Selective Latent Reasoning), a lightweight and training-free framework. SeLaR introduces an entropy-gated mechanism that activates soft embeddings only at low-confidence steps, while preserving discrete decoding at high-confidence steps. Additionally, we propose an entropy-aware contrastive regularization that pushes soft embeddings away from the highest-probability token’s direction, encouraging sustained exploration of multiple latent reasoning paths. Experiments on five reasoning benchmarks demonstrate that SeLaR consistently outperforms standard CoT and state-of-the-art training-free methods.",acl_anthology,conference,ACL,formally_published,2026-01-01,,,3.1231487604994608,large language model,,https://aclanthology.org/2026.acl-long.320/,https://aclanthology.org/2026.acl-long.320.pdf,open,pdf/2026-06-26_26_SeLaR_ Selective Latent Reasoning in Large Language Models.pdf,downloaded
27,Beyond the Panorama: Training-Free Hierarchical Perception-Reasoning for Fine-Grained Vision in MLLMs,Xiaoyang Yi; Jing Chen; Li Peng; Yuru Bao; Jian Zhang,"Multimodal large language models (MLLMs) enable cross-modal semantic understanding and generation by learning semantic alignment and fusion across modalities. However, existing MLLMs still face challenges in fine-grained visual tasks. Their uniform encoding for global understanding tends to blur or lose local details, while the lack of explicit modeling of intermediate visual evidence leads them to rely on semantic priors or the statistical patterns of language models rather than grounded visual information, resulting in potential hallucinations. To address these issues, we propose HiPerson, a training-free hierarchical perception-reasoning framework that enhances fine-grained visual understanding by simulating human perception mechanisms. Specifically, HiPerson fuses internal relative attention and gradient activation signals to generate a task-aware semantic heatmap, providing explicit perceptual anchors for precise localization. Then, it employs a dual-scale adaptive cropping strategy to extract visual cues for interactive reasoning, simulating the process of human visual focus shifting and detail attention. Finally, by combining local-global dual-image cooperative input with a multi-step reasoning prompting mechanism, HiPerson guides the model to complete a full perception loop from detail observation to contextual verification. Experiments show that HiPerson achieves competitive results on multiple datasets, demonstrating its generalizability and scalability.","Multimodal large language models (MLLMs) enable cross-modal semantic understanding and generation by learning semantic alignment and fusion across modalities. However, existing MLLMs still face challenges in fine-grained visual tasks. Their uniform encoding for global understanding tends to blur or lose local details, while the lack of explicit modeling of intermediate visual evidence leads them to rely on semantic priors or the statistical patterns of language models rather than grounded visual information, resulting in potential hallucinations. To address these issues, we propose HiPerson, a training-free hierarchical perception-reasoning framework that enhances fine-grained visual understanding by simulating human perception mechanisms. Specifically, HiPerson fuses internal relative attention and gradient activation signals to generate a task-aware semantic heatmap, providing explicit perceptual anchors for precise localization. Then, it employs a dual-scale adaptive cropping strategy to extract visual cues for interactive reasoning, simulating the process of human visual focus shifting and detail attention. Finally, by combining local-global dual-image cooperative input with a multi-step reasoning prompting mechanism, HiPerson guides the model to complete a full perception loop from detail observation to contextual verification. Experiments show that HiPerson achieves competitive results on multiple datasets, demonstrating its generalizability and scalability.",acl_anthology,conference,ACL,formally_published,2026-01-01,,,3.1225390840389,large language model; multimodal large language model,,https://aclanthology.org/2026.acl-long.1409/,https://aclanthology.org/2026.acl-long.1409.pdf,open,pdf/2026-06-26_27_Beyond the Panorama_ Training-Free Hierarchical Perception-Reasoning for Fine-Grained Vision in MLLMs.pdf,downloaded
28,LOTUS: Evolving Multimodal Unlearning via Hyperbolic Entailment and Lorentz Transport,Zekun Wang; Jingjie Zeng; Yingxu Li; Hongfei Lin; Liang Yang,"Multimodal Large Language Models (MLLMs) face critical privacy challenges due to the indiscriminate memorization of sensitive data. Existing unlearning methods, largely adapted from Euclidean paradigms, suffer from a geometric mismatch: they fail to disentangle specific instances from general concepts, causing catastrophic forgetting or unsafe substitution. We introduce LOTUS (Lorentz Transport for Unlearning Strategies), a framework for surgical semantic pruning within the Lorentz manifold. Leveraging hyperbolic geometry’s hierarchical nature, LOTUS employs an Inverted Entailment Cone Loss to sever the inheritance of sensitive concepts and a Lorentz Transport mechanism to align pruned features within the tangent space, ensuring compatibility with Euclidean backbones via a safety refusal prior. Experiments on MLLMU-Bench with LLaVA and Qwen show that LOTUS significantly outperforms baselines, effectively erasing targeted visual data while preserving general utility.","Multimodal Large Language Models (MLLMs) face critical privacy challenges due to the indiscriminate memorization of sensitive data. Existing unlearning methods, largely adapted from Euclidean paradigms, suffer from a geometric mismatch: they fail to disentangle specific instances from general concepts, causing catastrophic forgetting or unsafe substitution. We introduce LOTUS (Lorentz Transport for Unlearning Strategies), a framework for surgical semantic pruning within the Lorentz manifold. Leveraging hyperbolic geometry’s hierarchical nature, LOTUS employs an Inverted Entailment Cone Loss to sever the inheritance of sensitive concepts and a Lorentz Transport mechanism to align pruned features within the tangent space, ensuring compatibility with Euclidean backbones via a safety refusal prior. Experiments on MLLMU-Bench with LLaVA and Qwen show that LOTUS significantly outperforms baselines, effectively erasing targeted visual data while preserving general utility.",acl_anthology,conference,ACL,formally_published,2026-01-01,,,3.1222554725726415,large language model; multimodal large language model,,https://aclanthology.org/2026.acl-long.2195/,https://aclanthology.org/2026.acl-long.2195.pdf,open,pdf/2026-06-26_28_LOTUS_ Evolving Multimodal Unlearning via Hyperbolic Entailment and Lorentz Transport.pdf,downloaded
29,Spectral Disentanglement: Rank-Aware Task Adaptation for Rehearsal-free Continual Learning in LLMs,Huanxuan Liao; Shizhu He; Yupu Hao; Yequan Wang; Wenhao Teng; Xiangwen Liao; Jun Zhao; Kang Liu,"Continual Learning (CL) for Large Language Models (LLMs) faces a fundamental Stability-Plasticity Dilemma: balancing the plasticity to acquire new capabilities with the stability to preserve prior knowledge. While Parameter-Efficient Fine-Tuning methods, such as LoRA, enable efficient adaptation, we identify a critical flaw in current approaches termed Rank-Blindness: the enforcement of a single rank constraint across diverse tasks, which entangles task-shared and task-specific knowledge, leading to catastrophic forgetting of earlier tasks and underfitting on complex new ones. To address this, we propose SpaRTA, a novel rehearsal-free framework guided by a rank-spectrum perspective that explicitly disentangles knowledge into two orthogonal subspaces. Specifically, SpaRTA employs a low-rank branch to capture task-shared representations and a high-rank branch to model task-specific features. To integrate these complementary representations, we introduce a context-aware dynamic router that adaptively fuses the two branches based on input semantics, while an explicit orthogonality constraint minimizes interference between shared and specific parameter subspaces. This design effectively isolates task-specific updates from shared knowledge, preventing the overwriting of prior capabilities while preserving strong adaptation capacity. Extensive experiments demonstrate that SpaRTA achieves a superior stability-plasticity balance compared to single-rank baselines. Notably, the proposed spectral disentanglement strategy substantially reduces inter-task interference and yields strong zero-shot generalization on unseen tasks. Our code will be available at https://github.com/Xnhyacinth/SpaRTA.","Continual Learning (CL) for Large Language Models (LLMs) faces a fundamental Stability-Plasticity Dilemma: balancing the plasticity to acquire new capabilities with the stability to preserve prior knowledge. While Parameter-Efficient Fine-Tuning methods, such as LoRA, enable efficient adaptation, we identify a critical flaw in current approaches termed Rank-Blindness: the enforcement of a single rank constraint across diverse tasks, which entangles task-shared and task-specific knowledge, leading to catastrophic forgetting of earlier tasks and underfitting on complex new ones. To address this, we propose SpaRTA, a novel rehearsal-free framework guided by a rank-spectrum perspective that explicitly disentangles knowledge into two orthogonal subspaces. Specifically, SpaRTA employs a low-rank branch to capture task-shared representations and a high-rank branch to model task-specific features. To integrate these complementary representations, we introduce a context-aware dynamic router that adaptively fuses the two branches based on input semantics, while an explicit orthogonality constraint minimizes interference between shared and specific parameter subspaces. This design effectively isolates task-specific updates from shared knowledge, preventing the overwriting of prior capabilities while preserving strong adaptation capacity. Extensive experiments demonstrate that SpaRTA achieves a superior stability-plasticity balance compared to single-rank baselines. Notably, the proposed spectral disentanglement strategy substantially reduces inter-task interference and yields strong zero-shot generalization on unseen tasks. Our code will be available at https://github.com/Xnhyacinth/SpaRTA.",acl_anthology,conference,ACL,formally_published,2026-01-01,,,3.117658699080498,large language model,,https://aclanthology.org/2026.acl-long.334/,https://aclanthology.org/2026.acl-long.334.pdf,open,pdf/2026-06-26_29_Spectral Disentanglement_ Rank-Aware Task Adaptation for Rehearsal-free Continual Learning in LLMs.pdf,downloaded
30,Adaptive Spatial and Temporal Redundancy Optimization for Efficient Reasoning in Large Language Models,Tianle Chen; Pengyu Cheng; Qiyuan Zhu; Jiacheng Wang; Bei Liu; Hao Gu; Ruijie Shen; Xiaofeng Hou; Sirui Han; Jiacheng Liu,"Large Language Models (LLMs) have achieved exceptional performance in complex reasoning via Chain-of-Thought (CoT), yet the associated computational costs remain prohibitive. CoT reasoning contains significant untapped efficiency potential across two dimensions: temporal redundancy , where reasoning steps may be unnecessary, and spatial redundancy , where computations can be performed at reduced precision. While current optimization techniques often necessitate resource-intensive fine-tuning or data curation, we introduce ASTRO (Adaptive Spatial and Temporal Redundancy Optimization), a training-free framework that simultaneously addresses both dimensions. ASTRO leverages Dewey’s reflective thinking model to segment reasoning phases, applying a progressive precision reduction strategy coupled with an entropy-based confidence mechanism for adaptive termination. Empirical results across diverse reasoning benchmarks demonstrate that ASTRO achieves up to an 11.3 × efficiency gain without compromising accuracy, highlighting the advantages of holistic multi-dimensional redundancy management over isolated optimization methods.","Large Language Models (LLMs) have achieved exceptional performance in complex reasoning via Chain-of-Thought (CoT), yet the associated computational costs remain prohibitive. CoT reasoning contains significant untapped efficiency potential across two dimensions: temporal redundancy , where reasoning steps may be unnecessary, and spatial redundancy , where computations can be performed at reduced precision. While current optimization techniques often necessitate resource-intensive fine-tuning or data curation, we introduce ASTRO (Adaptive Spatial and Temporal Redundancy Optimization), a training-free framework that simultaneously addresses both dimensions. ASTRO leverages Dewey’s reflective thinking model to segment reasoning phases, applying a progressive precision reduction strategy coupled with an entropy-based confidence mechanism for adaptive termination. Empirical results across diverse reasoning benchmarks demonstrate that ASTRO achieves up to an 11.3 × efficiency gain without compromising accuracy, highlighting the advantages of holistic multi-dimensional redundancy management over isolated optimization methods.",acl_anthology,conference,ACL,formally_published,2026-01-01,,,3.117328943908136,large language model,,https://aclanthology.org/2026.acl-long.1130/,https://aclanthology.org/2026.acl-long.1130.pdf,open,pdf/2026-06-26_30_Adaptive Spatial and Temporal Redundancy Optimization for Efficient Reasoning in Large Language Models.pdf,downloaded
