index,title,authors,abstract,summary,source,venue_type,journal,publication_status,publication_date,doi,categories,score,matched_keywords,cited_by_count,article_url,pdf_url,open_access_status,local_pdf,pdf_download_status
8,Nirvana: A Specialized Generalist Model With Task-Aware Memory Mechanism,Yuhua Jiang; Shuang Cheng; Yihao Liu; Ermo Hua; Che Jiang; Weigao Sun; Yu Cheng; Feifei Gao; Biqing Qi; Bowen Zhou,"Large Language Models (LLMs) excel at general language tasks but struggle in specialized domains. Specialized Generalist Models (SGMs) address this by preserving broad capabilities while adapting to target domains. However, existing architectures provide limited support for task-guided specialized memory mechanisms. In this work, we introduce Nirvana, an SGM featuring specialized memory, linear-time complexity, and test-time task information extraction. Central to Nirvana are: (1) Task-Aware Memory Trigger ( Trigger ), which treats each input as a self-supervised fine-tuning task and adjusts task-related parameters on the fly; and (2) Specialized Memory Updater ( Updater ), which dynamically consolidates task-relevant context. Nirvana matches or surpasses LLM baselines on general benchmarks and achieves the lowest perplexity across specialized domains including biomedicine, finance, and law. On the challenging task of Magnetic Resonance Imaging (MRI), we attach lightweight codecs to the frozen Nirvana backbone and fine-tune them on paired k-space signals and images. Nirvana achieves higher-fidelity reconstructions than conventional LLM-based models, with Trigger providing effective domain-specific adaptation. Ablation studies confirm that removing Trigger leads to substantial degradation across all tasks, underscoring its essential role in task-aware specialization. Models are available at https://huggingface.co/collections/YuhuaJiang/nirvana. Code is available at https://github.com/YuhuaJiang2002/Nirvana.","Large Language Models (LLMs) excel at general language tasks but struggle in specialized domains. Specialized Generalist Models (SGMs) address this by preserving broad capabilities while adapting to target domains. However, existing architectures provide limited support for task-guided specialized memory mechanisms. In this work, we introduce Nirvana, an SGM featuring specialized memory, linear-time complexity, and test-time task information extraction. Central to Nirvana are: (1) Task-Aware Memory Trigger ( Trigger ), which treats each input as a self-supervised fine-tuning task and adjusts task-related parameters on the fly; and (2) Specialized Memory Updater ( Updater ), which dynamically consolidates task-relevant context. Nirvana matches or surpasses LLM baselines on general benchmarks and achieves the lowest perplexity across specialized domains including biomedicine, finance, and law. On the challenging task of Magnetic Resonance Imaging (MRI), we attach lightweight codecs to the frozen Nirvana backbone and fine-tune them on paired k-space signals and images. Nirvana achieves higher-fidelity reconstructions than conventional LLM-based models, with Trigger providing effective domain-specific adaptation. Ablation studies confirm that removing Trigger leads to substantial degradation across all tasks, underscoring its essential role in task-aware specialization. Models are available at https://huggingface.co/collections/YuhuaJiang/nirvana. Code is available at https://github.com/YuhuaJiang2002/Nirvana.",acl_anthology,conference,ACL,formally_published,2026-01-01,,,3.1674439022227316,large language model,,https://aclanthology.org/2026.acl-long.996/,https://aclanthology.org/2026.acl-long.996.pdf,open,pdf/2026-06-26_08_Nirvana_ A Specialized Generalist Model With Task-Aware Memory Mechanism.pdf,downloaded
9,A Survey of Large Language Models for Text-Guided Molecular Discovery: From Molecule Generation to Optimization,Ziqing Wang; Kexin Zhang; Zihan Zhao; Yibo Wen; Abhishek Pandey; Han Liu; Kaize Ding,"Large language models (LLMs) are introducing a paradigm shift in molecular discovery by enabling text-guided interaction with chemical spaces through natural language and symbolic notations, with emerging extensions to incorporate multi-modal inputs. To advance this emerging field, this survey provides an up-to-date and forward-looking review of the emerging use of LLMs for two central tasks: molecule generation and molecule optimization. We organize our survey around four fundamental challenges that have emerged as critical evaluation dimensions in recent studies: ensuring validity, enhancing synthesizability, achieving precise property control, and maximizing diversity. Based on this, we systematically analyze how current LLM learning paradigms are applied to tackle each challenge, revealing the distinct capabilities and inherent limitations of each approach. In addition, we include the commonly used datasets and evaluation protocols aligned with these challenges. We conclude by discussing future directions, positioning this survey as a resource for researchers working at the intersection of LLMs and molecular science. A continuously updated reading list is available at https://github.com/REAL-Lab-NU/Awesome-LLM-Centric-Molecular-Discovery .","Large language models (LLMs) are introducing a paradigm shift in molecular discovery by enabling text-guided interaction with chemical spaces through natural language and symbolic notations, with emerging extensions to incorporate multi-modal inputs. To advance this emerging field, this survey provides an up-to-date and forward-looking review of the emerging use of LLMs for two central tasks: molecule generation and molecule optimization. We organize our survey around four fundamental challenges that have emerged as critical evaluation dimensions in recent studies: ensuring validity, enhancing synthesizability, achieving precise property control, and maximizing diversity. Based on this, we systematically analyze how current LLM learning paradigms are applied to tackle each challenge, revealing the distinct capabilities and inherent limitations of each approach. In addition, we include the commonly used datasets and evaluation protocols aligned with these challenges. We conclude by discussing future directions, positioning this survey as a resource for researchers working at the intersection of LLMs and molecular science. A continuously updated reading list is available at https://github.com/REAL-Lab-NU/Awesome-LLM-Centric-Molecular-Discovery .",acl_anthology,conference,ACL,formally_published,2026-01-01,,,3.1614964920789204,large language model,,https://aclanthology.org/2026.acl-long.2026/,https://aclanthology.org/2026.acl-long.2026.pdf,open,pdf/2026-06-26_09_A Survey of Large Language Models for Text-Guided Molecular Discovery_ From Molecule Generation to Optimization.pdf,downloaded
10,Graph Reasoning Paradigm: Structured and Symbolic Reasoning with Topology-Aware Reinforcement Learning for Large Language Models,Runxuan Liu; Xianhao Ou; Xinyan Ma; Jiyuan Wang; Jiafeng Liang; Jiaqi Li; Tao He; Zheng Chu; Rongchuan Mu; Zekun Wang; Baoxin Wang; Dayong Wu; Ming Liu; Shijin Wang; Guoping Hu; Bing Qin,"Long Chain-of-Thought (LCoT), achieved by Reinforcement Learning with Verifiable Rewards (RLVR), has proven effective in enhancing the reasoning capabilities of Large Language Models (LLMs). However, reasoning in current LLMs is primarily generated as plain text, where performing semantic evaluation on such unstructured data creates a computational bottleneck during training. Despite RLVR-based optimization, existing methods still suffer from coarse-grained supervision, reward hacking, high training costs, and poor generalization.To address these issues, we propose the Graph Reasoning Paradigm (GRP), which realizes structured and symbolic reasoning, implemented via graph-structured representations with step-level cognitive labels. Building upon GRP, we further design Process-Aware Stratified Clipping Group Relative Policy Optimization (PASC-GRPO), which leverages structured evaluation to replace semantic evaluation, achieves process-aware verification through graph-structured outcome rewards, and mitigates reward hacking via stratified clipping advantage estimation. Experiments demonstrate significant improvements across mathematical reasoning and code generation tasks. Data, models, and code will be released later.","Long Chain-of-Thought (LCoT), achieved by Reinforcement Learning with Verifiable Rewards (RLVR), has proven effective in enhancing the reasoning capabilities of Large Language Models (LLMs). However, reasoning in current LLMs is primarily generated as plain text, where performing semantic evaluation on such unstructured data creates a computational bottleneck during training. Despite RLVR-based optimization, existing methods still suffer from coarse-grained supervision, reward hacking, high training costs, and poor generalization.To address these issues, we propose the Graph Reasoning Paradigm (GRP), which realizes structured and symbolic reasoning, implemented via graph-structured representations with step-level cognitive labels. Building upon GRP, we further design Process-Aware Stratified Clipping Group Relative Policy Optimization (PASC-GRPO), which leverages structured evaluation to replace semantic evaluation, achieves process-aware verification through graph-structured outcome rewards, and mitigates reward hacking via stratified clipping advantage estimation. Experiments demonstrate significant improvements across mathematical reasoning and code generation tasks. Data, models, and code will be released later.",acl_anthology,conference,ACL,formally_published,2026-01-01,,,3.1567081969225095,large language model,,https://aclanthology.org/2026.acl-long.1660/,https://aclanthology.org/2026.acl-long.1660.pdf,open,pdf/2026-06-26_10_Graph Reasoning Paradigm_ Structured and Symbolic Reasoning with Topology-Aware Reinforcement Learning for Large Languag.pdf,downloaded
11,Constructing coherent spatial memory in LLM agents through graph rectification,Puzhen Zhang; Xuyang Chen; Yu Feng; Yuhan Jiang; Liqiu Meng,"Given a map description through global traversal navigation instructions, an LLM can often infer the implicit spatial layout and answer user queries by providing shortest paths. However, such context-dependent querying becomes incapable as environments grow larger, motivating the need for incremental map construction that builds a complete topological graph from stepwise observations. We propose a framework for LLM-driven construction and map repair, designed to detect, localize, and correct structural inconsistencies in incrementally constructed navigation graphs. Central to our method is the Version Control, which records the full history of graph edits and their source observations, enabling fine-grained rollback, conflict tracing, and repair evaluation. We further introduce an Edge Impact Score to prioritize minimal-cost repairs based on structural reachability, path usage, and conflict propagation. To properly evaluate our approach, we create a refined version of the MANGO benchmark dataset by systematically removing non-topological actions and inherent structural conflicts, providing a cleaner testbed for LLM-driven construction and map repair. Our approach significantly improves map correctness and robustness, especially in scenarios with entangled or chained inconsistencies. Our results highlight the importance of introspective, history-aware repair mechanisms for maintaining coherent spatial memory in LLM agents.","Given a map description through global traversal navigation instructions, an LLM can often infer the implicit spatial layout and answer user queries by providing shortest paths. However, such context-dependent querying becomes incapable as environments grow larger, motivating the need for incremental map construction that builds a complete topological graph from stepwise observations. We propose a framework for LLM-driven construction and map repair, designed to detect, localize, and correct structural inconsistencies in incrementally constructed navigation graphs. Central to our method is the Version Control, which records the full history of graph edits and their source observations, enabling fine-grained rollback, conflict tracing, and repair evaluation. We further introduce an Edge Impact Score to prioritize minimal-cost repairs based on structural reachability, path usage, and conflict propagation. To properly evaluate our approach, we create a refined version of the MANGO benchmark dataset by systematically removing non-topological actions and inherent structural conflicts, providing a cleaner testbed for LLM-driven construction and map repair. Our approach significantly improves map correctness and robustness, especially in scenarios with entangled or chained inconsistencies. Our results highlight the importance of introspective, history-aware repair mechanisms for maintaining coherent spatial memory in LLM agents.",acl_anthology,conference,ACL,formally_published,2026-01-01,,,3.1537086726019963,llm agent,,https://aclanthology.org/2026.acl-long.2222/,https://aclanthology.org/2026.acl-long.2222.pdf,open,pdf/2026-06-26_11_Constructing coherent spatial memory in LLM agents through graph rectification.pdf,downloaded
12,Curvature-Guided Mixing for MLLM Adaptation,Jinglong Yang; Jiaxuan He; Wenjian Huang; Zhan Zhuang; Jianguo Zhang,"Fine-tuning Multimodal Large Language Models (MLLMs) on specialized tasks often leads to catastrophic forgetting of their general capabilities. Existing model merging methods to combat this are often heuristic or use sub-optimal objectives. We propose CurvatureGuided Mixing (CGM), a theoretically grounded framework that merges pre-trained and fine-tuned models. CGM formulates a joint optimization objective and uses a second-order (Hessian) approximation of the loss landscapes to analytically derive an optimal, closed-form ""soft mixing"" ratio. This ratio intelligently blends parameters based on their relative task-specific curvatures. We also introduce CGM$\dagger$, a robust ""hard mixing"" variant that performs sparse parameter selection guided by a novel, curvature-aware score. Experiments on LLaVA-1.5 and Qwen2.5VL across multiple downstream tasks show that CGM and CGM$\dagger$ consistently improve the trade-off between task specialization and general knowledge retention over existing methods. Code is available at github.com/zzsyjl/CGM-ECCV-2026.","Fine-tuning Multimodal Large Language Models (MLLMs) on specialized tasks often leads to catastrophic forgetting of their general capabilities. Existing model merging methods to combat this are often heuristic or use sub-optimal objectives. We propose CurvatureGuided Mixing (CGM), a theoretically grounded framework that merges pre-trained and fine-tuned models. CGM formulates a joint optimization objective and uses a second-order (Hessian) approximation of the loss landscapes to analytically derive an optimal, closed-form ""soft mixing"" ratio. This ratio intelligently blends parameters based on their relative task-specific curvatures. We also introduce CGM$\dagger$, a robust ""hard mixing"" variant that performs sparse parameter selection guided by a novel, curvature-aware score. Experiments on LLaVA-1.5 and Qwen2.5VL across multiple downstream tasks show that CGM and CGM$\dagger$ consistently improve the trade-off between task specialization and general knowledge retention over existing methods. Code is available at github.com/zzsyjl/CGM-ECCV-2026.",arxiv,preprint,,preprint,2026-06-23,,cs.CV; cs.LG,3.1533493048090113,large language model; multimodal large language model,,http://arxiv.org/abs/2606.24963v1,https://arxiv.org/pdf/2606.24963v1,open,pdf/2026-06-26_12_Curvature-Guided Mixing for MLLM Adaptation.pdf,downloaded
13,Memory-Augmented LLM-based Multi-Agent System for Automated Feature Generation on Tabular Data,FengXian Dong; Zhi Zheng; Xiao Han; Wei Chen; Jingqing Ruan; Tong Xu; Yong Chen; Enhong Chen,"Automated feature generation extracts informative features from raw tabular data without manual intervention and is crucial for accurate, generalizable machine learning. Traditional methods rely on predefined operator libraries and cannot leverage task semantics, limiting their ability to produce diverse, high-value features for complex tasks. Recent Large Language Model (LLM)-based approaches introduce richer semantic signals, but still suffer from a restricted feature space due to fixed generation patterns and from the absence of feedback from the learning objective. To address these challenges, we propose a Memory-Augmented LLM-based Multi-Agent System ( MALMAS ) for automated feature generation. MALMAS decomposes the generation process into agents with distinct responsibilities, and a Router Agent activates an appropriate subset of agents per iteration, further broadening exploration of the feature space. We further integrate a memory module comprising procedural memory, feedback memory, and conceptual memory, enabling iterative refinement that adaptively guides subsequent feature generation and improves feature quality and diversity. Extensive experiments on multiple public datasets against state-of-the-art baselines demonstrate the effectiveness of our approach.","Automated feature generation extracts informative features from raw tabular data without manual intervention and is crucial for accurate, generalizable machine learning. Traditional methods rely on predefined operator libraries and cannot leverage task semantics, limiting their ability to produce diverse, high-value features for complex tasks. Recent Large Language Model (LLM)-based approaches introduce richer semantic signals, but still suffer from a restricted feature space due to fixed generation patterns and from the absence of feedback from the learning objective. To address these challenges, we propose a Memory-Augmented LLM-based Multi-Agent System ( MALMAS ) for automated feature generation. MALMAS decomposes the generation process into agents with distinct responsibilities, and a Router Agent activates an appropriate subset of agents per iteration, further broadening exploration of the feature space. We further integrate a memory module comprising procedural memory, feedback memory, and conceptual memory, enabling iterative refinement that adaptively guides subsequent feature generation and improves feature quality and diversity. Extensive experiments on multiple public datasets against state-of-the-art baselines demonstrate the effectiveness of our approach.",acl_anthology,conference,ACL,formally_published,2026-01-01,,,3.1516245393107774,large language model; multi-agent system,,https://aclanthology.org/2026.acl-long.503/,https://aclanthology.org/2026.acl-long.503.pdf,open,pdf/2026-06-26_13_Memory-Augmented LLM-based Multi-Agent System for Automated Feature Generation on Tabular Data.pdf,downloaded
14,From Graph to Text and Back: Semantic Fidelity in Automated Industrial Knowledge Graphs,Kamyar Zeinalipour; Silvia Severini; Alessia Borghini; Sara Cardarelli; Marco Maggini; Marco Gori,"Knowledge Graphs (KGs) are the backbone of reliable industrial data strategies, yet verbalizing them with Large Language Models (LLMs) often leads to unacceptable risks for high-stakes applications, such as hallucinations or omitted relations. To enforce strict semantic fidelity in KG-to-text generation, we introduce a self-supervised round-trip pipeline. The system verbalizes KG triples into text and immediately attempts to reconstruct the original graph from that text; only verbalizations that enable perfect graph recovery are retained. This creates a closed feedback loop that guarantees the generated text is semantically equivalent to the source data. Experiments confirm that our automated round-trip consistency score correlates strongly with expert judgment, effectively acting as a scalable proxy for human review. Furthermore, we show that standard LLMs can bootstrap their own KG-extraction and generation capabilities by fine-tuning on this trusted synthetic data. Our approach yields significant improvements in triple-extraction accuracy and verbalization faithfulness without relying on costly manual annotation or massive teacher models, offering a practical path to deploying trustworthy, KG-grounded AI systems.","Knowledge Graphs (KGs) are the backbone of reliable industrial data strategies, yet verbalizing them with Large Language Models (LLMs) often leads to unacceptable risks for high-stakes applications, such as hallucinations or omitted relations. To enforce strict semantic fidelity in KG-to-text generation, we introduce a self-supervised round-trip pipeline. The system verbalizes KG triples into text and immediately attempts to reconstruct the original graph from that text; only verbalizations that enable perfect graph recovery are retained. This creates a closed feedback loop that guarantees the generated text is semantically equivalent to the source data. Experiments confirm that our automated round-trip consistency score correlates strongly with expert judgment, effectively acting as a scalable proxy for human review. Furthermore, we show that standard LLMs can bootstrap their own KG-extraction and generation capabilities by fine-tuning on this trusted synthetic data. Our approach yields significant improvements in triple-extraction accuracy and verbalization faithfulness without relying on costly manual annotation or massive teacher models, offering a practical path to deploying trustworthy, KG-grounded AI systems.",acl_anthology,conference,ACL,formally_published,2026-01-01,,,3.1497953598321815,knowledge graph; large language model,,https://aclanthology.org/2026.acl-industry.140/,https://aclanthology.org/2026.acl-industry.140.pdf,open,pdf/2026-06-26_14_From Graph to Text and Back_ Semantic Fidelity in Automated Industrial Knowledge Graphs.pdf,downloaded
15,HeLa-Mem: Hebbian Learning and Associative Memory for LLM Agents,Jinchang Zhu; Jindong Li; Cheng Zhang; Jiahong Liu; Menglin Yang,"Long-term memory is a critical challenge for Large Language Model agents, as fixed context windows cannot preserve coherence across extended interactions. Existing memory systems represent conversation history as unstructured embedding vectors, retrieving information through semantic similarity. This paradigm fails to capture the associative structure of human memory, wherein related experiences progressively strengthen interconnections through repeated co-activation. Inspired by cognitive neuroscience, we identify three mechanisms central to biological memory: association, consolidation, and spreading activation, which remain largely absent in current research. To bridge this gap, we propose HeLa-Mem, a bio-inspired memory architecture that models memory as a dynamic graph with Hebbian learning dynamics. HeLa-Mem employs a dual-level organization: (1) an episodic memory graph that evolves through co-activation patterns, and (2) a semantic memory store populated via Hebbian Distillation, wherein a Reflective Agent identifies densely connected memory hubs and distills them into structured, reusable semantic knowledge. This dual-path design leverages both semantic similarity and learned associations, mirroring the episodic-semantic distinction in human cognition. Experiments on LoCoMo demonstrate superior performance across four question categories while using significantly fewer context tokens. Code is available on GitHub: https://github.com/ReinerBRO/HeLa-Mem","Long-term memory is a critical challenge for Large Language Model agents, as fixed context windows cannot preserve coherence across extended interactions. Existing memory systems represent conversation history as unstructured embedding vectors, retrieving information through semantic similarity. This paradigm fails to capture the associative structure of human memory, wherein related experiences progressively strengthen interconnections through repeated co-activation. Inspired by cognitive neuroscience, we identify three mechanisms central to biological memory: association, consolidation, and spreading activation, which remain largely absent in current research. To bridge this gap, we propose HeLa-Mem, a bio-inspired memory architecture that models memory as a dynamic graph with Hebbian learning dynamics. HeLa-Mem employs a dual-level organization: (1) an episodic memory graph that evolves through co-activation patterns, and (2) a semantic memory store populated via Hebbian Distillation, wherein a Reflective Agent identifies densely connected memory hubs and distills them into structured, reusable semantic knowledge. This dual-path design leverages both semantic similarity and learned associations, mirroring the episodic-semantic distinction in human cognition. Experiments on LoCoMo demonstrate superior performance across four question categories while using significantly fewer context tokens. Code is available on GitHub: https://github.com/ReinerBRO/HeLa-Mem",acl_anthology,conference,ACL,formally_published,2026-01-01,,,3.1497356032251322,large language model; llm agent,,https://aclanthology.org/2026.acl-long.625/,https://aclanthology.org/2026.acl-long.625.pdf,open,pdf/2026-06-26_15_HeLa-Mem_ Hebbian Learning and Associative Memory for LLM Agents.pdf,downloaded
