index,title,authors,abstract,summary,source,venue_type,journal,publication_status,publication_date,doi,categories,score,matched_keywords,cited_by_count,article_url,pdf_url,open_access_status,local_pdf,pdf_download_status
16,Multimodal Large Language Models for Multi-Subject In-Context Image Generation,Yucheng Zhou; Dubing Chen; Huan Zheng; Jianbing Shen,"Recent advances in text-to-image (T2I) generation have enabled visually coherent image synthesis from descriptions, but generating images containing multiple given subjects remains challenging. As the number of reference identities increases, existing methods often suffer from subject missing and semantic drift. To address this problem, we propose MUSIC, the first MLLM specifically designed for MUlti-Subject In-Context image generation. To overcome the data scarcity, we introduce an automatic and scalable data generation pipeline that eliminates the need for manual annotation. Furthermore, we enhance the model’s understanding of multi-subject semantic relationships through a vision chain-of-thought (CoT) mechanism, guiding step-by-step reasoning from subject images to semantics and generation. To mitigate identity entanglement and manage visual complexity, we develop a novel semantics-driven spatial layout planning method and demonstrate its test-time scalability. By incorporating complex subject images during training, we improve the model’s capacity for chained reasoning. In addition, we curate MSIC, a new benchmark tailored for multi-subject in-context generation. Experimental results demonstrate that MUSIC significantly surpasses other methods in both multi- and single-subject scenarios.","Recent advances in text-to-image (T2I) generation have enabled visually coherent image synthesis from descriptions, but generating images containing multiple given subjects remains challenging. As the number of reference identities increases, existing methods often suffer from subject missing and semantic drift. To address this problem, we propose MUSIC, the first MLLM specifically designed for MUlti-Subject In-Context image generation. To overcome the data scarcity, we introduce an automatic and scalable data generation pipeline that eliminates the need for manual annotation. Furthermore, we enhance the model’s understanding of multi-subject semantic relationships through a vision chain-of-thought (CoT) mechanism, guiding step-by-step reasoning from subject images to semantics and generation. To mitigate identity entanglement and manage visual complexity, we develop a novel semantics-driven spatial layout planning method and demonstrate its test-time scalability. By incorporating complex subject images during training, we improve the model’s capacity for chained reasoning. In addition, we curate MSIC, a new benchmark tailored for multi-subject in-context generation. Experimental results demonstrate that MUSIC significantly surpasses other methods in both multi- and single-subject scenarios.",acl_anthology,conference,ACL,formally_published,2026-01-01,,,3.143368606507464,large language model; multimodal large language model,,https://aclanthology.org/2026.acl-long.1518/,https://aclanthology.org/2026.acl-long.1518.pdf,open,pdf/2026-06-26_16_Multimodal Large Language Models for Multi-Subject In-Context Image Generation.pdf,downloaded
17,Toward Consistent World Models with Multi-Token Prediction and Latent Semantic Enhancement,Qimin Zhong; Hao Liao; Haiming Qin; Mingyang Zhou; Rui Mao; Wei Chen; Naipeng Chao,"Whether Large Language Models (LLMs) develop coherent internal world models remains a core debate. While conventional Next-Token Prediction (NTP) focuses on one-step-ahead supervision, Multi-Token Prediction (MTP) has shown promise in learning more structured representations. In this work, we provide a theoretical perspective analyzing the gradient inductive bias of MTP, supported by empirical evidence, showing that MTP promotes the convergence toward internal belief states by inducing representational contractivity via gradient coupling. However, we reveal that standard MTP often suffers from structural hallucinations, where discrete token supervision encourages illegal shortcuts in latent space that violate environmental constraints. To address this, we propose a novel method **Latent Semantic Enhancement MTP (LSE-MTP)**, which anchors predictions to ground-truth hidden state trajectories. Experiments on synthetic graphs and real-world Manhattan Taxi Ride show that LSE-MTP effectively bridges the gap between discrete tokens and continuous state representations, enhancing representation alignment, reducing structural hallucinations, and improving robustness to perturbations.","Whether Large Language Models (LLMs) develop coherent internal world models remains a core debate. While conventional Next-Token Prediction (NTP) focuses on one-step-ahead supervision, Multi-Token Prediction (MTP) has shown promise in learning more structured representations. In this work, we provide a theoretical perspective analyzing the gradient inductive bias of MTP, supported by empirical evidence, showing that MTP promotes the convergence toward internal belief states by inducing representational contractivity via gradient coupling. However, we reveal that standard MTP often suffers from structural hallucinations, where discrete token supervision encourages illegal shortcuts in latent space that violate environmental constraints. To address this, we propose a novel method **Latent Semantic Enhancement MTP (LSE-MTP)**, which anchors predictions to ground-truth hidden state trajectories. Experiments on synthetic graphs and real-world Manhattan Taxi Ride show that LSE-MTP effectively bridges the gap between discrete tokens and continuous state representations, enhancing representation alignment, reducing structural hallucinations, and improving robustness to perturbations.",acl_anthology,conference,ACL,formally_published,2026-01-01,,,3.1430145879501903,large language model,,https://aclanthology.org/2026.acl-long.618/,https://aclanthology.org/2026.acl-long.618.pdf,open,pdf/2026-06-26_17_Toward Consistent World Models with Multi-Token Prediction and Latent Semantic Enhancement.pdf,downloaded
18,CoreGaze: Core Subgraph-Driven Visual Gaze Diffusion for Training-Free Referring Multimodal Large Language Models,Xiaoyang Yi; Jing Chen; Yuru Bao; Jian Zhang,"Referring multimodal large language models enable users to ground queries to specific image regions via spatial prompts, supporting fine-grained referring dialogue. However, existing methods rely on extensive fine-tuning to mitigate attention distraction, which incurs high computational costs and limits adaptability. Without sufficient training data, irrelevant regions in single images easily divert model focus, leading to redundant outputs or hallucinations. To address this, we propose CoreGaze, a training-free framework that simulates human visual gaze diffusion for fine-grained comprehension. First, CoreGaze constructs a sparse semantic graph from visual tokens, modeling region-wise affinities via thresholded similarity. It then maps the user’s visual prompt to a core subgraph with amplified initial influence, which drives a degree-normalized diffusion process using restart-equipped random walks to propagate relevance to contextual neighborhoods. This process prunes irrelevant tokens while preserving user-indicated targets and semantically linked context, distilling a focused yet comprehensive subgraph. Finally, CoreGaze fuses this subgraph with prompt tokens in the frozen large language model decoder, facilitating fine-grained referring generation. Experimental results show that CoreGaze achieves outstanding performance in multiple referring dialogue tasks, showcasing its effectiveness.","Referring multimodal large language models enable users to ground queries to specific image regions via spatial prompts, supporting fine-grained referring dialogue. However, existing methods rely on extensive fine-tuning to mitigate attention distraction, which incurs high computational costs and limits adaptability. Without sufficient training data, irrelevant regions in single images easily divert model focus, leading to redundant outputs or hallucinations. To address this, we propose CoreGaze, a training-free framework that simulates human visual gaze diffusion for fine-grained comprehension. First, CoreGaze constructs a sparse semantic graph from visual tokens, modeling region-wise affinities via thresholded similarity. It then maps the user’s visual prompt to a core subgraph with amplified initial influence, which drives a degree-normalized diffusion process using restart-equipped random walks to propagate relevance to contextual neighborhoods. This process prunes irrelevant tokens while preserving user-indicated targets and semantically linked context, distilling a focused yet comprehensive subgraph. Finally, CoreGaze fuses this subgraph with prompt tokens in the frozen large language model decoder, facilitating fine-grained referring generation. Experimental results show that CoreGaze achieves outstanding performance in multiple referring dialogue tasks, showcasing its effectiveness.",acl_anthology,conference,ACL,formally_published,2026-01-01,,,3.1422900994024427,diffusion; large language model; multimodal large language model,,https://aclanthology.org/2026.acl-long.57/,https://aclanthology.org/2026.acl-long.57.pdf,open,pdf/2026-06-26_18_CoreGaze_ Core Subgraph-Driven Visual Gaze Diffusion for Training-Free Referring Multimodal Large Language Models.pdf,downloaded
19,Bringing Real-World Relations into Video Generation with Graph-Structured Knowledge,Joonhyung Park; Jaeyun Song; Sihwan Park; Eunho Yang,"Recent proprietary video generation models have demonstrated remarkable proficiency in synthesizing highly realistic videos from textual instructions. Most open-source text-to-video models, however, still struggle to accurately simulate real-world physics and dynamic entity interactions. Existing approaches rely on scaling laws and large-scale, high-quality video datasets to implicitly learn physical dynamics, yet this paradigm is constrained by prohibitive costs and the burdensome demands of data curation. Motivated by this, we propose a novel framework that integrates graph-structured temporal knowledge into video latent diffusion models to enhance compositional generation and interaction fidelity. Our framework constructs video scene graphs specifically designed to capture entity relationships, temporal dynamics, and global scene context. These graph-structured representations guide the generation process through cross-attention mechanisms. Additionally, we introduce Graph-Aligned Denoising Loss (GADL), a training objective that ensures adherence to conditioned graphs by incorporating node modification tasks within the denoising process, leveraging synchronized edited video-graph pairs. Comprehensive evaluations demonstrate that incorporating graph-structured knowledge significantly enhances compositionality and the accurate portrayal of real-world interactions in generated videos.","Recent proprietary video generation models have demonstrated remarkable proficiency in synthesizing highly realistic videos from textual instructions. Most open-source text-to-video models, however, still struggle to accurately simulate real-world physics and dynamic entity interactions. Existing approaches rely on scaling laws and large-scale, high-quality video datasets to implicitly learn physical dynamics, yet this paradigm is constrained by prohibitive costs and the burdensome demands of data curation. Motivated by this, we propose a novel framework that integrates graph-structured temporal knowledge into video latent diffusion models to enhance compositional generation and interaction fidelity. Our framework constructs video scene graphs specifically designed to capture entity relationships, temporal dynamics, and global scene context. These graph-structured representations guide the generation process through cross-attention mechanisms. Additionally, we introduce Graph-Aligned Denoising Loss (GADL), a training objective that ensures adherence to conditioned graphs by incorporating node modification tasks within the denoising process, leveraging synchronized edited video-graph pairs. Comprehensive evaluations demonstrate that incorporating graph-structured knowledge significantly enhances compositionality and the accurate portrayal of real-world interactions in generated videos.",acl_anthology,conference,ACL,formally_published,2026-01-01,,,3.1417188494383947,diffusion,,https://aclanthology.org/2026.acl-long.172/,https://aclanthology.org/2026.acl-long.172.pdf,open,pdf/2026-06-26_19_Bringing Real-World Relations into Video Generation with Graph-Structured Knowledge.pdf,downloaded
20,Cell-Based Representation of Relational Binding in Language Models,Qin Dai; Benjamin Heinzerling; Kentaro Inui,"Understanding a discourse requires tracking entities and the relations that hold between them. While Large Language Models (LLMs) perform well on relational reasoning, the mechanism by which they bind entities, relations, and attributes remains unclear. We study discourse-level relational binding and show that LLMs encode it via a Cell-based Binding Representation (CBR): a low-dimensional linear subspace in which each “cell” corresponds to an entity–relation index pair, and bound attributes are retrieved from the corresponding cell during inference. Using controlled multi-sentence data annotated with entity and relation indices, we identify the CBR subspace by decoding these indices from attribute-token activations with Partial Least Squares regression. Across domains and two model families, the indices are linearly decodable and form a grid-like geometry in the projected space. We further find that context-specific CBR representations are related by translation vectors in activation space, enabling cross-context transfer. Finally, activation patching shows that manipulating this subspace systematically changes relational predictions and that perturbing it disrupts performance, providing causal evidence that LLMs rely on CBR for relational binding.","Understanding a discourse requires tracking entities and the relations that hold between them. While Large Language Models (LLMs) perform well on relational reasoning, the mechanism by which they bind entities, relations, and attributes remains unclear. We study discourse-level relational binding and show that LLMs encode it via a Cell-based Binding Representation (CBR): a low-dimensional linear subspace in which each “cell” corresponds to an entity–relation index pair, and bound attributes are retrieved from the corresponding cell during inference. Using controlled multi-sentence data annotated with entity and relation indices, we identify the CBR subspace by decoding these indices from attribute-token activations with Partial Least Squares regression. Across domains and two model families, the indices are linearly decodable and form a grid-like geometry in the projected space. We further find that context-specific CBR representations are related by translation vectors in activation space, enabling cross-context transfer. Finally, activation patching shows that manipulating this subspace systematically changes relational predictions and that perturbing it disrupts performance, providing causal evidence that LLMs rely on CBR for relational binding.",acl_anthology,conference,ACL,formally_published,2026-01-01,,,3.1392545076944645,large language model,,https://aclanthology.org/2026.acl-long.2194/,https://aclanthology.org/2026.acl-long.2194.pdf,open,pdf/2026-06-26_20_Cell-Based Representation of Relational Binding in Language Models.pdf,downloaded
21,From Inheritance to Saturation: Disentangling the Evolution of Visual Redundancy for Architecture-Aware MLLM Inference Acceleration,Jiaqi Shi; Xulong Zhang; Yuechan Li; Xiaoyang Qu; Jianzong Wang,"High-resolution Multimodal Large Language Models (MLLMs) face prohibitive computational costs during inference due to the explosion of visual tokens. Existing acceleration strategies, such as token pruning or layer sparsity, suffer from severe ""backbone dependency"", performing well on Vicuna or Mistral architectures (e.g., LLaVA) but causing significant performance degradation when transferred to architectures like Qwen. To address this, we leverage truncated matrix entropy to uncover a universal three-stage inference lifecycle, decoupling visual redundancy into universal Intrinsic Visual Redundancy (IVR) and architecture-dependent Secondary Saturation Redundancy (SSR). Guided by this insight, we propose HalfV, a framework that first mitigates IVR via a unified pruning strategy and then adaptively handles SSR based on its specific manifestation. Experiments demonstrate that HalfV achieves superior efficiency-performance trade-offs across diverse backbones. Notably, on Qwen25-VL, it retains 96.8% performance at a 4.1 × FLOPs speedup, significantly outperforming state-of-the-art baselines. Our code is available at https://github.com/civilizwa/HalfV .","High-resolution Multimodal Large Language Models (MLLMs) face prohibitive computational costs during inference due to the explosion of visual tokens. Existing acceleration strategies, such as token pruning or layer sparsity, suffer from severe ""backbone dependency"", performing well on Vicuna or Mistral architectures (e.g., LLaVA) but causing significant performance degradation when transferred to architectures like Qwen. To address this, we leverage truncated matrix entropy to uncover a universal three-stage inference lifecycle, decoupling visual redundancy into universal Intrinsic Visual Redundancy (IVR) and architecture-dependent Secondary Saturation Redundancy (SSR). Guided by this insight, we propose HalfV, a framework that first mitigates IVR via a unified pruning strategy and then adaptively handles SSR based on its specific manifestation. Experiments demonstrate that HalfV achieves superior efficiency-performance trade-offs across diverse backbones. Notably, on Qwen25-VL, it retains 96.8% performance at a 4.1 × FLOPs speedup, significantly outperforming state-of-the-art baselines. Our code is available at https://github.com/civilizwa/HalfV .",acl_anthology,conference,ACL,formally_published,2026-01-01,,,3.1369266802290636,large language model; multimodal large language model,,https://aclanthology.org/2026.acl-long.787/,https://aclanthology.org/2026.acl-long.787.pdf,open,pdf/2026-06-26_21_From Inheritance to Saturation_ Disentangling the Evolution of Visual Redundancy for Architecture-Aware MLLM Inference A.pdf,downloaded
22,Textual Steering Vectors Can Improve Visual Understanding in Multimodal Large Language Models,Woody Haosheng Gan; Deqing Fu; Julian Asilis; Ollie Liu; Vatsal Sharan; Robin Jia; Willie Neiswanger,"Steering methods have emerged as effective tools for guiding large language models’ behavior, yet multimodal large language models (MLLMs) lack comparable techniques due to architectural diversity and limited availability of multimodal steering vectors. Inspired by this gap, we demonstrate that steering vectors derived solely from text-only LLM backbones can effectively guide and enhance their multimodal counterparts, revealing a novel cross-modal transfer that enables reuse of existing interpretability tools. Using community-standard methods—Sparse Autoencoders (SAE), Mean Shift, and Linear Probing—we validate this transfer effect across diverse MLLM architectures and visual reasoning tasks. Text-derived steering consistently enhances multimodal performance, with Mean Shift achieving up to +7.3% improvement in spatial relationship accuracy and +3.3% in counting accuracy on CV-Bench, and exhibits strong generalization to out-of-distribution datasets, for example reaching +34.2% on CLEVR counting tasks. This reveals that textual representations alone can effectively enhance visual grounding in MLLMs, bridging the mature ecosystem of text-based steering to MLLMs with minimal additional data collection or computational overhead.","Steering methods have emerged as effective tools for guiding large language models’ behavior, yet multimodal large language models (MLLMs) lack comparable techniques due to architectural diversity and limited availability of multimodal steering vectors. Inspired by this gap, we demonstrate that steering vectors derived solely from text-only LLM backbones can effectively guide and enhance their multimodal counterparts, revealing a novel cross-modal transfer that enables reuse of existing interpretability tools. Using community-standard methods—Sparse Autoencoders (SAE), Mean Shift, and Linear Probing—we validate this transfer effect across diverse MLLM architectures and visual reasoning tasks. Text-derived steering consistently enhances multimodal performance, with Mean Shift achieving up to +7.3% improvement in spatial relationship accuracy and +3.3% in counting accuracy on CV-Bench, and exhibits strong generalization to out-of-distribution datasets, for example reaching +34.2% on CLEVR counting tasks. This reveals that textual representations alone can effectively enhance visual grounding in MLLMs, bridging the mature ecosystem of text-based steering to MLLMs with minimal additional data collection or computational overhead.",acl_anthology,conference,ACL,formally_published,2026-01-01,,,3.1365680784463335,large language model; multimodal large language model,,https://aclanthology.org/2026.acl-long.1861/,https://aclanthology.org/2026.acl-long.1861.pdf,open,pdf/2026-06-26_22_Textual Steering Vectors Can Improve Visual Understanding in Multimodal Large Language Models.pdf,downloaded
23,MTA: Multi-Granular Trajectory Alignment for Large Language Model Distillation,Pham Khanh Chi; Quoc Phong Dao; Thuat Nguyen; Linh Ngo Van; Trung Le; Thanh Hong Nguyen,"Knowledge distillation is a key technique for compressing large language models (LLMs), but most existing methods align representations at fixed layers or token-level outputs, ignoring how representations evolve across depth. As a result, the student is only weakly guided to capture the teacher’s internal relational structure during distillation, which limits knowledge transfer. To address this limitation, we propose Multi-Granular Trajectory Alignment (MTA) , a framework that aligns teacher and student representations along their layer-wise transformation trajectory. MTA adopts a layer-adaptive strategy: lower layers are aligned at the word level to preserve lexical information, while higher layers operate on phrase-level spans (e.g., noun and verb phrases) to capture compositional semantics. We instantiate this idea through a Dynamic Structural Alignment loss that matches the relative geometry among semantic units within each layer. This design is motivated by empirical findings that Transformer representations become increasingly abstract with depth, and is also consistent with linguistic views in which higher-level meaning emerges through the composition of lower-level lexical units. We further incorporate a Hidden Representation Alignment loss to directly align selected teacher–student layers. Experiments show that MTA consistently outperforms state-of-the-art baselines on standard benchmarks, with ablations confirming the contribution of each component.","Knowledge distillation is a key technique for compressing large language models (LLMs), but most existing methods align representations at fixed layers or token-level outputs, ignoring how representations evolve across depth. As a result, the student is only weakly guided to capture the teacher’s internal relational structure during distillation, which limits knowledge transfer. To address this limitation, we propose Multi-Granular Trajectory Alignment (MTA) , a framework that aligns teacher and student representations along their layer-wise transformation trajectory. MTA adopts a layer-adaptive strategy: lower layers are aligned at the word level to preserve lexical information, while higher layers operate on phrase-level spans (e.g., noun and verb phrases) to capture compositional semantics. We instantiate this idea through a Dynamic Structural Alignment loss that matches the relative geometry among semantic units within each layer. This design is motivated by empirical findings that Transformer representations become increasingly abstract with depth, and is also consistent with linguistic views in which higher-level meaning emerges through the composition of lower-level lexical units. We further incorporate a Hidden Representation Alignment loss to directly align selected teacher–student layers. Experiments show that MTA consistently outperforms state-of-the-art baselines on standard benchmarks, with ablations confirming the contribution of each component.",acl_anthology,conference,ACL,formally_published,2026-01-01,,,3.1265953333478835,large language model,,https://aclanthology.org/2026.acl-long.1507/,https://aclanthology.org/2026.acl-long.1507.pdf,open,pdf/2026-06-26_23_MTA_ Multi-Granular Trajectory Alignment for Large Language Model Distillation.pdf,downloaded
