index,title,authors,abstract,summary,source,venue_type,journal,publication_status,publication_date,doi,categories,score,matched_keywords,cited_by_count,article_url,pdf_url,open_access_status,local_pdf,pdf_download_status
1,MPBoCo: Multimodal Prompt-based Boundary-enhanced Continual Framework for Joint Entity and Relation Extraction,Guanglu Sun; Xinyu Liu; Lili Liang; Yang Yu; Fei Lang; Suxia Zhu; Ming Liu,"In real-world scenarios, multimodal information continuously evolves, with new entity and relation types emerging, necessitating timely updates to multimodal knowledge graphs for supporting downstream tasks. However, existing methods struggle to balance real-time adaptability and computational efficiency in continual learning scenarios. To this end, this paper proposes the Continual Multimodal Entity and Relation Joint Extraction (CMERJE) task and a Multimodal Prompt-based Boundary-enhanced Continual (MPBoCo) framework. Specifically, MPBoCo incrementally stores task-specific knowledge via learnable multimodal prompts, dynamically matches relevant prompts for each instance, and fuses them into a frozen backbone model for task-specific reasoning. Subsequently, the boundary-enhanced dual-branch module leverages the auxiliary branch to preserve local syntactic continuity and provide boundary guidance. Experimental results demonstrate that MPBoCo achieves superior performance in real-world scenarios, significantly outperforming baseline methods by 5.5% and 7.2% in 10-task and 5-task settings, respectively.","In real-world scenarios, multimodal information continuously evolves, with new entity and relation types emerging, necessitating timely updates to multimodal knowledge graphs for supporting downstream tasks. However, existing methods struggle to balance real-time adaptability and computational efficiency in continual learning scenarios. To this end, this paper proposes the Continual Multimodal Entity and Relation Joint Extraction (CMERJE) task and a Multimodal Prompt-based Boundary-enhanced Continual (MPBoCo) framework. Specifically, MPBoCo incrementally stores task-specific knowledge via learnable multimodal prompts, dynamically matches relevant prompts for each instance, and fuses them into a frozen backbone model for task-specific reasoning. Subsequently, the boundary-enhanced dual-branch module leverages the auxiliary branch to preserve local syntactic continuity and provide boundary guidance. Experimental results demonstrate that MPBoCo achieves superior performance in real-world scenarios, significantly outperforming baseline methods by 5.5% and 7.2% in 10-task and 5-task settings, respectively.",acl_anthology,conference,ACL,formally_published,2026-01-01,,,3.183528395215074,knowledge graph,,https://aclanthology.org/2026.acl-long.1220/,https://aclanthology.org/2026.acl-long.1220.pdf,open,pdf/2026-06-26_01_MPBoCo_ Multimodal Prompt-based Boundary-enhanced Continual Framework for Joint Entity and Relation Extraction.pdf,downloaded
2,A Stage-Aware Mixture of Experts Framework for Neurodegenerative Disease Progression Modelling,Tiantian He; Keyue Jiang; An Zhao; Anna Schroder; Elinor Thompson; Sonja Soskic; Frederik Barkhof; Daniel C. Alexander,"The long-term progression of neurodegenerative diseases is commonly conceptualized as a spatiotemporal diffusion process that consists of a graph diffusion process across the structural brain connectome and a localized reaction process within brain regions. However, modeling this progression remains challenging due to 1) the scarcity of longitudinal data obtained through irregular and infrequent subject visits and 2) the complex interplay of pathological mechanisms across brain regions and disease stages, where traditional models assume fixed mechanisms throughout disease progression. To address these limitations, we propose a novel stage-aware Mixture of Experts (MoE) framework that explicitly models how different contributing mechanisms dominate at different disease stages through time-dependent expert weighting. This architecture is a key innovation designed to maximize the utility of small datasets and provide interpretable insights into disease etiology. Data-wise, we utilize an iterative dual optimization method to properly estimate the temporal position of individual observations, constructing a cohort-level progression trajectory from irregular snapshots. Model-wise, we enhance the spatial component with an inhomogeneous graph neural diffusion model (IGND) that allows diffusivity to vary based on node states and time, providing more flexible representations of brain networks. We also introduce a localized neural reaction module to capture complex dynamics beyond standard processes.The resulting IGND-MoE model dynamically integrates these components across temporal states, offering a principled way to understand how stage-specific pathological mechanisms contribute to progression. When used to model tau pathology propagation in human brains, IGND-MoE outperforms purely pathophysiological and purely neural baselines in long-term prediction accuracy. Moreover, its stage-wise weights yield novel clinical insights that align with literature, suggesting that graph-related processes are more influential at early stages, while other unknown physical processes become dominant later on. Our findings highlight the necessity of designing hybrid and expert-constrained models that account for the evolving nature of neurodegenerative processes.","The long-term progression of neurodegenerative diseases is commonly conceptualized as a spatiotemporal diffusion process that consists of a graph diffusion process across the structural brain connectome and a localized reaction process within brain regions. However, modeling this progression remains challenging due to 1) the scarcity of longitudinal data obtained through irregular and infrequent subject visits and 2) the complex interplay of pathological mechanisms across brain regions and disease stages, where traditional models assume fixed mechanisms throughout disease progression. To address these limitations, we propose a novel stage-aware Mixture of Experts (MoE) framework that explicitly models how different contributing mechanisms dominate at different disease stages through time-dependent expert weighting. This architecture is a key innovation designed to maximize the utility of small datasets and provide interpretable insights into disease etiology. Data-wise, we utilize an iterative dual optimization method to properly estimate the temporal position of individual observations, constructing a cohort-level progression trajectory from irregular snapshots. Model-wise, we enhance the spatial component with an inhomogeneous graph neural diffusion model (IGND) that allows diffusivity to vary based on node states and time, providing more flexible representations of brain networks. We also introduce a localized neural reaction module to capture complex dynamics beyond standard processes.The resulting IGND-MoE model dynamically integrates these components across temporal states, offering a principled way to understand how stage-specific pathological mechanisms contribute to progression. When used to model tau pathology propagation in human brains, IGND-MoE outperforms purely pathophysiological and purely neural baselines in long-term prediction accuracy. Moreover, its stage-wise weights yield novel clinical insights that align with literature, suggesting that graph-related processes are more influential at early stages, while other unknown physical processes become dominant later on. Our findings highlight the necessity of designing hybrid and expert-constrained models that account for the evolving nature of neurodegenerative processes.",openalex,conference,Proceedings of the AAAI Conference on Artificial Intelligence,formally_published,2026-03-14,https://doi.org/10.1609/aaai.v40i26.39316,Functional Brain Connectivity Studies; Advanced Neuroimaging Techniques and Applications; Machine Learning in Healthcare,3.1816692400068503,diffusion,1,https://doi.org/10.1609/aaai.v40i26.39316,,diamond,,no_pdf_url
3,UMPIRE: Unveiling LLM-generated Posts via Redundant Expressions,Xiaoquan Yi; Haixing Wu; Haozhao Wang; Yichen Li; Yuhua Li; Rui Zhang; Ruixuan Li,"The proliferation of Large Language Models (LLMs) has saturated social media platforms with hyper-realistic posts, rendering traditional detection methods that rely on low-level artifacts or unimodal statistics increasingly ineffective. In this work, we identify a fundamental semantic distinction: humans tend to complement visual content with additional context, while LLMs predominantly describe the visual information. To capture this, UMPIRE employs an orthogonal semantic decomposition mechanism that disentangles textual embeddings into redundant and complementary components. An adaptive gating module dynamically weighs these components to reflect diverse communicative styles. To enforce the desired geometric structure, we introduce a latent contrastive redundancy regularization loss that encourages LLM-generated content to exhibit high semantic redundancy, while human-written content emphasizes complementarity. Experimental results demonstrate that UMPIRE significantly outperforms state-of-the-art detection methods across multiple datasets, achieving up to a 5.38% improvement in accuracy.","The proliferation of Large Language Models (LLMs) has saturated social media platforms with hyper-realistic posts, rendering traditional detection methods that rely on low-level artifacts or unimodal statistics increasingly ineffective. In this work, we identify a fundamental semantic distinction: humans tend to complement visual content with additional context, while LLMs predominantly describe the visual information. To capture this, UMPIRE employs an orthogonal semantic decomposition mechanism that disentangles textual embeddings into redundant and complementary components. An adaptive gating module dynamically weighs these components to reflect diverse communicative styles. To enforce the desired geometric structure, we introduce a latent contrastive redundancy regularization loss that encourages LLM-generated content to exhibit high semantic redundancy, while human-written content emphasizes complementarity. Experimental results demonstrate that UMPIRE significantly outperforms state-of-the-art detection methods across multiple datasets, achieving up to a 5.38% improvement in accuracy.",acl_anthology,conference,ACL,formally_published,2026-01-01,,,3.181552471459996,large language model,,https://aclanthology.org/2026.acl-long.1427/,https://aclanthology.org/2026.acl-long.1427.pdf,open,pdf/2026-06-26_03_UMPIRE_ Unveiling LLM-generated Posts via Redundant Expressions.pdf,downloaded
4,iTAG: Inverse Design for Natural Text Generation with Accurate Causal Graph Annotations,Wenshuo Wang; Boyu Cao; Nan Zhuang; Wei Li,"A fundamental obstacle to causal discovery from text is the lack of causally annotated text data for use as ground truth, due to high annotation costs. This motivates an important task of generating text with causal graph annotations. Early template-based generation methods sacrifice text naturalness in exchange for high causal graph annotation accuracy. Recent Large Language Model (LLM)-dependent methods directly generate natural text from target graphs through LLMs, but do not guarantee causal graph annotation accuracy. Therefore, we propose iTAG, which performs real-world concept assignment to nodes before converting causal graphs into text in existing LLM-dependent methods. iTAG frames this process as an inverse problem with the causal graph as the target, iteratively examining and refining concept selection through Chain-of-Thought (CoT) reasoning so that the induced relations between concepts are as consistent as possible with the target causal relationships described by the causal graph. iTAG demonstrates both extremely high annotation accuracy and naturalness across extensive tests, and the results of testing text-based causal discovery algorithms with the generated data show high statistical correlation with real-world data. This suggests that iTAG-generated data can serve as a practical surrogate for scalable benchmarking of text-based causal discovery algorithms.","A fundamental obstacle to causal discovery from text is the lack of causally annotated text data for use as ground truth, due to high annotation costs. This motivates an important task of generating text with causal graph annotations. Early template-based generation methods sacrifice text naturalness in exchange for high causal graph annotation accuracy. Recent Large Language Model (LLM)-dependent methods directly generate natural text from target graphs through LLMs, but do not guarantee causal graph annotation accuracy. Therefore, we propose iTAG, which performs real-world concept assignment to nodes before converting causal graphs into text in existing LLM-dependent methods. iTAG frames this process as an inverse problem with the causal graph as the target, iteratively examining and refining concept selection through Chain-of-Thought (CoT) reasoning so that the induced relations between concepts are as consistent as possible with the target causal relationships described by the causal graph. iTAG demonstrates both extremely high annotation accuracy and naturalness across extensive tests, and the results of testing text-based causal discovery algorithms with the generated data show high statistical correlation with real-world data. This suggests that iTAG-generated data can serve as a practical surrogate for scalable benchmarking of text-based causal discovery algorithms.",acl_anthology,conference,ACL,formally_published,2026-01-01,,,3.1782250985419336,causal discovery; large language model,,https://aclanthology.org/2026.acl-long.364/,https://aclanthology.org/2026.acl-long.364.pdf,open,pdf/2026-06-26_04_iTAG_ Inverse Design for Natural Text Generation with Accurate Causal Graph Annotations.pdf,downloaded
5,Dynamic Generation of Multi LLM Agents Communication Topologies with Graph Diffusion Models,Eric Hanchen Jiang; Levina Li; Frank Wan; Xiao Liang; Sophia Yin; Yuchen Wu; Xinfeng Li; Yizhou Sun; Wei Wang; Kai-Wei Chang; Ying Nian Wu,"The efficiency of multi-agent systems driven by large language models (LLMs) largely hinges on their communication topology. However, designing an optimal topology is a non-trivial challenge, as it requires balancing competing objectives such as task performance, communication cost, and robustness. Existing frameworks often rely on static or hand-crafted topologies, which inherently fail to adapt to diverse task requirements, leading to either excessive token consumption for simple problems or performance bottlenecks for complex ones. To address this challenge, we introduce a novel generative framework called Guided Topology Diffusion (GTD) . Inspired by conditional discrete graph diffusion models, GTD formulates topology synthesis as an iterative construction process. At each step, the generation is steered by a lightweight proxy model that predicts multi-objective rewards (e.g., accuracy, utility, cost), enabling real-time, gradient-free optimization towards task-adaptive topologies. This iterative, guided synthesis process distinguishes GTD from single-step generative frameworks, enabling it to better navigate complex design trade-offs. We validated GTD across multiple benchmarks, and experiments show that this framework can generate highly task-adaptive, sparse, and efficient communication topologies, significantly outperforming existing methods in LLM agent collaboration. Our code is available at https://anonymous.4open.science/r/diffusion_agent-953C .","The efficiency of multi-agent systems driven by large language models (LLMs) largely hinges on their communication topology. However, designing an optimal topology is a non-trivial challenge, as it requires balancing competing objectives such as task performance, communication cost, and robustness. Existing frameworks often rely on static or hand-crafted topologies, which inherently fail to adapt to diverse task requirements, leading to either excessive token consumption for simple problems or performance bottlenecks for complex ones. To address this challenge, we introduce a novel generative framework called Guided Topology Diffusion (GTD) . Inspired by conditional discrete graph diffusion models, GTD formulates topology synthesis as an iterative construction process. At each step, the generation is steered by a lightweight proxy model that predicts multi-objective rewards (e.g., accuracy, utility, cost), enabling real-time, gradient-free optimization towards task-adaptive topologies. This iterative, guided synthesis process distinguishes GTD from single-step generative frameworks, enabling it to better navigate complex design trade-offs. We validated GTD across multiple benchmarks, and experiments show that this framework can generate highly task-adaptive, sparse, and efficient communication topologies, significantly outperforming existing methods in LLM agent collaboration. Our code is available at https://anonymous.4open.science/r/diffusion_agent-953C .",acl_anthology,conference,ACL,formally_published,2026-01-01,,,3.1780230808073453,diffusion; large language model; llm agent; multi-agent system,,https://aclanthology.org/2026.acl-long.1764/,https://aclanthology.org/2026.acl-long.1764.pdf,open,pdf/2026-06-26_05_Dynamic Generation of Multi LLM Agents Communication Topologies with Graph Diffusion Models.pdf,downloaded
6,Dual-Cluster Memory Agent: Resolving Multi-Paradigm Ambiguity in Optimization Problem Solving,Xinyu Zhang; Yuchen Wan; Boxuan Zhang; Zesheng Yang; Lingling Zhang; Bifan Wei; Jun Liu,"Large Language Models (LLMs) often struggle with structural ambiguity in optimization problems, where a single problem admits multiple related but conflicting modeling paradigms, hindering effective solution generation. To address this, we propose Dual-Cluster Memory Agent (DCM-Agent) to enhance performance by leveraging historical solutions in a training-free manner. Central to this is Dual-Cluster Memory Construction. This agent assigns historical solutions to modeling and coding clusters, then distills each cluster’s content into three structured types: Approach, Checklist, and Pitfall. This process derives generalizable guidance knowledge. Furthermore, this agent introduces Memory-augmented Inference to dynamically navigate solution paths, detect and repair errors, and adaptively switch reasoning paths with structured knowledge. The experiments across seven optimization benchmarks demonstrate that DCM-Agent achieves an average performance improvement of 11%- 21%. Notably, our analysis reveals a “knowledge inheritance” phenomenon: memory constructed by larger models can guide smaller models toward superior performance, highlighting the framework’s scalability and efficiency.","Large Language Models (LLMs) often struggle with structural ambiguity in optimization problems, where a single problem admits multiple related but conflicting modeling paradigms, hindering effective solution generation. To address this, we propose Dual-Cluster Memory Agent (DCM-Agent) to enhance performance by leveraging historical solutions in a training-free manner. Central to this is Dual-Cluster Memory Construction. This agent assigns historical solutions to modeling and coding clusters, then distills each cluster’s content into three structured types: Approach, Checklist, and Pitfall. This process derives generalizable guidance knowledge. Furthermore, this agent introduces Memory-augmented Inference to dynamically navigate solution paths, detect and repair errors, and adaptively switch reasoning paths with structured knowledge. The experiments across seven optimization benchmarks demonstrate that DCM-Agent achieves an average performance improvement of 11%- 21%. Notably, our analysis reveals a “knowledge inheritance” phenomenon: memory constructed by larger models can guide smaller models toward superior performance, highlighting the framework’s scalability and efficiency.",acl_anthology,conference,ACL,formally_published,2026-01-01,,,3.1776857977801685,large language model,,https://aclanthology.org/2026.acl-long.266/,https://aclanthology.org/2026.acl-long.266.pdf,open,pdf/2026-06-26_06_Dual-Cluster Memory Agent_ Resolving Multi-Paradigm Ambiguity in Optimization Problem Solving.pdf,downloaded
7,Simple-VGC: Enhancing Visual Grounding in Multimodal Reasoning via Adaptive Tool Composition,Ye Wang; Qianglong Chen; Siyuan Wang; Zejun Li; Shijie Guo; Zhirui Zhang; Zhongyu Wei,"Multimodal Large Language Models (MLLMs) have achieved strong performance on vision-language tasks, yet often fail to preserve and effectively leverage visual evidence throughout generation. We identify three fundamental types of visual grounding failures: Long-Context Grounding Error, where visual information gradually decays over long sequences; Fine-Grained Grounding Error, where low-resolution or degraded inputs hinder the recovery of detailed visual information; and Regional Grounding Error, where spatially diffuse attention weakens region-level vision-language alignment. To address these issues, we propose a tool-augmented reasoning framework with three targeted compensation strategies: reuse, which re-injects the original image to mitigate visual forgetting; focus_area, which constrains attention to task-relevant regions; and zoom_in, which enhances visual resolution for fine-grained perception. We further construct the TWI-Tools-146K dataset and develop Simple-VGC, a tool-augmented MLLM that interleaves visual and textual tokens. Extensive experiments show that each tool yields targeted improvements for its corresponding grounding error, while their combination produces synergistic gains in visual reasoning. Beyond performance, our analysis provides mechanistic insights into how tool-based interventions improve visual grounding, pointing toward more reliable multimodal reasoning.","Multimodal Large Language Models (MLLMs) have achieved strong performance on vision-language tasks, yet often fail to preserve and effectively leverage visual evidence throughout generation. We identify three fundamental types of visual grounding failures: Long-Context Grounding Error, where visual information gradually decays over long sequences; Fine-Grained Grounding Error, where low-resolution or degraded inputs hinder the recovery of detailed visual information; and Regional Grounding Error, where spatially diffuse attention weakens region-level vision-language alignment. To address these issues, we propose a tool-augmented reasoning framework with three targeted compensation strategies: reuse, which re-injects the original image to mitigate visual forgetting; focus_area, which constrains attention to task-relevant regions; and zoom_in, which enhances visual resolution for fine-grained perception. We further construct the TWI-Tools-146K dataset and develop Simple-VGC, a tool-augmented MLLM that interleaves visual and textual tokens. Extensive experiments show that each tool yields targeted improvements for its corresponding grounding error, while their combination produces synergistic gains in visual reasoning. Beyond performance, our analysis provides mechanistic insights into how tool-based interventions improve visual grounding, pointing toward more reliable multimodal reasoning.",acl_anthology,conference,ACL,formally_published,2026-01-01,,,3.170085702245307,large language model; multimodal large language model,,https://aclanthology.org/2026.acl-long.223/,https://aclanthology.org/2026.acl-long.223.pdf,open,pdf/2026-06-26_07_Simple-VGC_ Enhancing Visual Grounding in Multimodal Reasoning via Adaptive Tool Composition.pdf,downloaded
