index,title,authors,abstract,summary,source,venue_type,journal,publication_status,publication_date,doi,categories,score,matched_keywords,source_hits,matched_researchers,matched_groups,tracking_confidence,tracking_match_type,author_ids,institution_ids,cited_by_count,article_url,pdf_url,open_access_status,local_pdf,pdf_download_status
22,Agentic Routing: The Harness-Native Data Flywheel,Xinchen Liu; Hang Zhou; Yingjie Zong; Yuchuan Tian; Liuyang Song; Shuo Zhang; Yulong Li; Wei He; Mengyu Zheng; Runke Liu; Siyang Cheng; Xiang Kuang; Hailin Hu; Kai Han; Yunhe Wang,"Large language model agents are increasingly executed not by a single model call, but by an execution harness that manages observation, context, control, action, state, and verification. At the same time, frontier and open models are becoming structurally specialized: a model that is strong at code editing, long-context recovery, tool use, mathematical reasoning, or low-latency response may not dominate on the other axes. This makes model selection inside an agent a core systems problem rather than a per-query serving trick. Existing routing methods mostly optimize single-turn cost-quality trade-offs and therefore miss the execution state, intermediate failures, and feedback loops that make agents different from chat completion. We propose Harness-Native agentic routing, a step-level routing paradigm that selects either a single best-fit model for cost-effective execution or multiple complementary models for ensemble-style accuracy improvement, conditioned on the full harness state. The key insight is that every routing decision naturally produces a structured data record -- consisting of the query, harness state, model choice or model set, execution trace, outcome, and cost -- whose labels are supplied by the environment rather than by the router itself. These records form a harness-native data flywheel: execution traces train better routers and harness-native models, which improve cost-quality trade-offs and generate more traces under the same budget. We instantiate this idea in OpenSquilla with a four-layer routing stack, an open LightGBM cold-start ranker, and a staged router-model path that turns logged arena records into progressively stronger routing policies. The report studies singleton and multi-model routing on agentic benchmarks including DRACO and PinchBench, and argues that agentic routing is not merely cost control, but a data engine for agent-native training.","Large language model agents are increasingly executed not by a single model call, but by an execution harness that manages observation, context, control, action, state, and verification. At the same time, frontier and open models are becoming structurally specialized: a model that is strong at code editing, long-context recovery, tool use, mathematical reasoning, or low-latency response may not dominate on the other axes. This makes model selection inside an agent a core systems problem rather than a per-query serving trick. Existing routing methods mostly optimize single-turn cost-quality trade-offs and therefore miss the execution state, intermediate failures, and feedback loops that make agents different from chat completion. We propose Harness-Native agentic routing, a step-level routing paradigm that selects either a single best-fit model for cost-effective execution or multiple complementary models for ensemble-style accuracy improvement, conditioned on the full harness state. The key insight is that every routing decision naturally produces a structured data record -- consisting of the query, harness state, model choice or model set, execution trace, outcome, and cost -- whose labels are supplied by the environment rather than by the router itself. These records form a harness-native data flywheel: execution traces train better routers and harness-native models, which improve cost-quality trade-offs and generate more traces under the same budget. We instantiate this idea in OpenSquilla with a four-layer routing stack, an open LightGBM cold-start ranker, and a staged router-model path that turns logged arena records into progressively stronger routing policies. The report studies singleton and multi-model routing on agentic benchmarks including DRACO and PinchBench, and argues that agentic routing is not merely cost control, but a data engine for agent-native training.",arxiv,preprint,,preprint,2026-07-13,,cs.CL; cs.AI,2.9275062149586573,large language model,,,,,,,,,http://arxiv.org/abs/2607.11399v1,https://arxiv.org/pdf/2607.11399v1,open,pdf/2026-07-15_22_Agentic Routing_ The Harness-Native Data Flywheel.pdf,downloaded
23,Structured Thoughts For Improved Reasoning And Context Pruning,Zain Sarwar; Supriyo Chakraborty; Berkcan Kapusuzoglu; Chia-Hsuan Lee; Anirban Das; Stephen Rawls; Kartik Balasubramaniam; Sambit Sahu,"Large language models (LLMs) excel at generating long chains of thought, but long reasoning traces are often verbose and memory-inefficient. In this work, we introduce Structured Thoughts, a framework that organizes reasoning into alternating <try> and <outcome> blocks: <try> captures exploratory scratch work, while <outcome> contains the distilled conclusion of that step. We construct a dataset of structured thoughts by segmenting reasoning traces into <try> blocks and prompting an LLM to summarize each step into its corresponding <outcome>. Fine-tuning pretrained foundation models on this reformatted data produces models that adopt the structured reasoning style, leading to performance gains of up to 8.08\% on reasoning benchmarks compared to standard SFT. The explicit structure also enables context pruning: after each <try>/<outcome> pair, the <try> can be pruned, allowing the model to retain conclusions without keeping the full scratch work in the context. A proof-of-concept pruning implementation achieves an average of 85\% memory / context savings with an 8.67\% performance drop across mathematical tasks.","Large language models (LLMs) excel at generating long chains of thought, but long reasoning traces are often verbose and memory-inefficient. In this work, we introduce Structured Thoughts, a framework that organizes reasoning into alternating <try> and <outcome> blocks: <try> captures exploratory scratch work, while <outcome> contains the distilled conclusion of that step. We construct a dataset of structured thoughts by segmenting reasoning traces into <try> blocks and prompting an LLM to summarize each step into its corresponding <outcome>. Fine-tuning pretrained foundation models on this reformatted data produces models that adopt the structured reasoning style, leading to performance gains of up to 8.08\% on reasoning benchmarks compared to standard SFT. The explicit structure also enables context pruning: after each <try>/<outcome> pair, the <try> can be pruned, allowing the model to retain conclusions without keeping the full scratch work in the context. A proof-of-concept pruning implementation achieves an average of 85\% memory / context savings with an 8.67\% performance drop across mathematical tasks.",arxiv,preprint,,preprint,2026-07-11,,cs.CL; cs.AI,2.9222977834945634,foundation model; large language model,,,,,,,,,http://arxiv.org/abs/2607.10386v1,https://arxiv.org/pdf/2607.10386v1,open,pdf/2026-07-15_23_Structured Thoughts For Improved Reasoning And Context Pruning.pdf,downloaded
24,"ToolAtlas: Learning Once, Reusing Everywhere with Tool-Side Memory",Yue Fang; Zhibang Yang; Fangkai Yang; Xiaoting Qin; Liqun Li; Qingwei Lin; Saravan Rajmohan; Dongmei Zhang,"Large language model (LLM) agents increasingly rely on external tools served by shared providers and accessed by heterogeneous downstream agents. Existing approaches improve tool use on the agent side through parameter updates, prompt refinement, or agent-side memory, making tool knowledge difficult to share and limited to behaviors observed in past tasks. We argue that reusable tool knowledge should instead be maintained by the tool provider. We introduce ToolAtlas, a graph-based framework that builds a persistent provider-side tool memory of tool capabilities, failure boundaries, and cross-tool compositions through execution-verified probing. At inference time, agents query the tool memory via adaptive graph traversal. Across two MCP-based benchmarks spanning eight services, ToolAtlas outperforms existing tool-side optimization and agent-side memory baselines by up to 21.61% in pass@1 and 18.61% in pass@4. The same tool memory also transfers across environment instances and agent frameworks without retraining or task-time exploration, yielding up to 24.16%/16.22% and 17.49%/14.27% relative gains in pass@1/pass@4, respectively. Ablation studies show that these gains arise from combining tool-centered memory organization with capability-guided execution probing. These results establish provider-side tool memory as an effective and reusable paradigm for tool servers. Our code is in: https://github.com/PuppyKnightUniversity/ToolAtlas.","Large language model (LLM) agents increasingly rely on external tools served by shared providers and accessed by heterogeneous downstream agents. Existing approaches improve tool use on the agent side through parameter updates, prompt refinement, or agent-side memory, making tool knowledge difficult to share and limited to behaviors observed in past tasks. We argue that reusable tool knowledge should instead be maintained by the tool provider. We introduce ToolAtlas, a graph-based framework that builds a persistent provider-side tool memory of tool capabilities, failure boundaries, and cross-tool compositions through execution-verified probing. At inference time, agents query the tool memory via adaptive graph traversal. Across two MCP-based benchmarks spanning eight services, ToolAtlas outperforms existing tool-side optimization and agent-side memory baselines by up to 21.61% in pass@1 and 18.61% in pass@4. The same tool memory also transfers across environment instances and agent frameworks without retraining or task-time exploration, yielding up to 24.16%/16.22% and 17.49%/14.27% relative gains in pass@1/pass@4, respectively. Ablation studies show that these gains arise from combining tool-centered memory organization with capability-guided execution probing. These results establish provider-side tool memory as an effective and reusable paradigm for tool servers. Our code is in: https://github.com/PuppyKnightUniversity/ToolAtlas.",arxiv,preprint,,preprint,2026-07-13,,cs.LG,2.9213830333192043,large language model,,,,,,,,,http://arxiv.org/abs/2607.11126v1,https://arxiv.org/pdf/2607.11126v1,open,"pdf/2026-07-15_24_ToolAtlas_ Learning Once, Reusing Everywhere with Tool-Side Memory.pdf",downloaded
25,The Universal Language of CSI:Unifying Wireless Sensing Across Devices and Environments,Jiayi Chen; Weiting Ou; Guangxu Zhu,"WiFi sensing based on Channel State Information (CSI) promises ubiquitous, device-free perception, yet current research remains trapped in a Tower of Babel - fragmented into isolated silos where models are tailored to specific hardware dialects, fixed environments, and narrow tasks. The primary bottleneck is the Heterogeneity Gap: the disparity in signal dimensions, sampling rates, and semantic labels that prevents cross-system understanding. To bridge this gap, we propose a foundation-model framework that treats CSI not merely as raw signals but as a structured language with a learnable universal grammar. We first curate and standardize a large collection of heterogeneous real-world CSI datasets, establishing a unified infrastructure that allows incompatible signal formats to be treated as a single corpus. Second, we introduce a modular architecture that acts as a universal translator where lightweight dataset-specific adapters tokenize diverse signal inputs into a shared latent vocabulary, while a shared self-supervised Transformer backbone learns the temporal syntax of human motion and environmental dynamics. This design decouples sensing semantics from hardware syntax. Extensive evaluations show that by mastering this universal language, our approach consistently outperforms task-specific baselines and exhibits strong generalization capability in new environments, achieving superior efficiency in few-shot scenarios. By effectively absorbing heterogeneity, the framework offers a path toward robust, general-purpose wireless sensing, mirroring the linguistic generalization observed in Large Language Models. The code implementation is available at: https://github.com/cjychenjiayi/WiLLM.","WiFi sensing based on Channel State Information (CSI) promises ubiquitous, device-free perception, yet current research remains trapped in a Tower of Babel - fragmented into isolated silos where models are tailored to specific hardware dialects, fixed environments, and narrow tasks. The primary bottleneck is the Heterogeneity Gap: the disparity in signal dimensions, sampling rates, and semantic labels that prevents cross-system understanding. To bridge this gap, we propose a foundation-model framework that treats CSI not merely as raw signals but as a structured language with a learnable universal grammar. We first curate and standardize a large collection of heterogeneous real-world CSI datasets, establishing a unified infrastructure that allows incompatible signal formats to be treated as a single corpus. Second, we introduce a modular architecture that acts as a universal translator where lightweight dataset-specific adapters tokenize diverse signal inputs into a shared latent vocabulary, while a shared self-supervised Transformer backbone learns the temporal syntax of human motion and environmental dynamics. This design decouples sensing semantics from hardware syntax. Extensive evaluations show that by mastering this universal language, our approach consistently outperforms task-specific baselines and exhibits strong generalization capability in new environments, achieving superior efficiency in few-shot scenarios. By effectively absorbing heterogeneity, the framework offers a path toward robust, general-purpose wireless sensing, mirroring the linguistic generalization observed in Large Language Models. The code implementation is available at: https://github.com/cjychenjiayi/WiLLM.",arxiv,preprint,,preprint,2026-06-30,,eess.SP; cs.AI,2.92085289972311,large language model,,,,,,,,,http://arxiv.org/abs/2607.09727v1,https://arxiv.org/pdf/2607.09727v1,open,pdf/2026-07-15_25_The Universal Language of CSI_Unifying Wireless Sensing Across Devices and Environments.pdf,downloaded
26,GraphMind: LLMs as Dynamic Knowledge Builders for Sequential Decision-Making,Sunguk Shin; Hayeong Lee; Jun Ho Seo; Jinho Lee; Myunsoo Kim; Minsuk Chang; Byung-Jun Lee,"While the reasoning capabilities of large language models (LLMs) have advanced considerably, efficiently internalizing and leveraging new information in dynamically interactive environments remains a significant challenge. This limitation is particularly pronounced in partially observable environments, which require agents to manage long-term memory and perform effective exploration under incomplete information. To address this, we propose an LLM agent architecture that integrates a knowledge graph as a graph-based memory module. The agent incrementally constructs the knowledge graph through environmental interactions and retrieves relevant information to generate efficient plans. We evaluate our approach in complex navigation tasks specifically designed to present long-horizon and partially observable challenges. Experimental results demonstrate that incorporating a self-extending memory module significantly enhances the performance and efficiency of the LLM’s planning capabilities.","While the reasoning capabilities of large language models (LLMs) have advanced considerably, efficiently internalizing and leveraging new information in dynamically interactive environments remains a significant challenge. This limitation is particularly pronounced in partially observable environments, which require agents to manage long-term memory and perform effective exploration under incomplete information. To address this, we propose an LLM agent architecture that integrates a knowledge graph as a graph-based memory module. The agent incrementally constructs the knowledge graph through environmental interactions and retrieves relevant information to generate efficient plans. We evaluate our approach in complex navigation tasks specifically designed to present long-horizon and partially observable challenges. Experimental results demonstrate that incorporating a self-extending memory module significantly enhances the performance and efficiency of the LLM’s planning capabilities.",acl_anthology,conference,ACL,formally_published,2026-01-01,,,2.902020133721699,knowledge graph; large language model; llm agent,,,,,,,,,https://aclanthology.org/2026.findings-acl.1651/,https://aclanthology.org/2026.findings-acl.1651.pdf,open,pdf/2026-07-15_26_GraphMind_ LLMs as Dynamic Knowledge Builders for Sequential Decision-Making.pdf,downloaded
27,FROST: Factual Reasoning via Optimized Stochastic Trajectories in Large Language Models during Inference,Soumedhik Bharati; Ebad Shabbir; Jiechao Gao,"Large language models face a trade-off between factual consistency and reasoningdiversity: deterministic decoding prioritizes reliability but may miss alternativesolution paths, while high-temperature sampling increases exploration at the costof accuracy. We present FROST (Factual Reasoning via Optimized StochasticTrajectories), an inference-time framework that balances exploration andexploitation without additional training or context augmentation. FROST combinesdeterministic inference from a large model with targeted stochastic sampling froma smaller model, selecting outputs via multi-criteria validation over coherence,factual grounding, and semantic novelty. Across HotpotQA, CommonsenseQA, andMMLU, FROST achieves 2–5 percentage point improvements over standard chain-of-thoughtprompting and reduces unsupported outputs by 40% relative to Standard CoT. Comparedto Self-Consistency ensembles, FROST delivers comparable accuracy at 28% lowerinference cost through strategic delegation to smaller models. On an adversarialsubset with unanswerable queries, FROST abstains on 34% of cases versus 8% forstandard chain-of-thought, reducing false positives by 45%. Task-stratifiedevaluation shows that exploration benefits scale with problem ambiguity.Generalization to mathematical reasoning, code generation, and multimodal domainsremains future work.","Large language models face a trade-off between factual consistency and reasoningdiversity: deterministic decoding prioritizes reliability but may miss alternativesolution paths, while high-temperature sampling increases exploration at the costof accuracy. We present FROST (Factual Reasoning via Optimized StochasticTrajectories), an inference-time framework that balances exploration andexploitation without additional training or context augmentation. FROST combinesdeterministic inference from a large model with targeted stochastic sampling froma smaller model, selecting outputs via multi-criteria validation over coherence,factual grounding, and semantic novelty. Across HotpotQA, CommonsenseQA, andMMLU, FROST achieves 2–5 percentage point improvements over standard chain-of-thoughtprompting and reduces unsupported outputs by 40% relative to Standard CoT. Comparedto Self-Consistency ensembles, FROST delivers comparable accuracy at 28% lowerinference cost through strategic delegation to smaller models. On an adversarialsubset with unanswerable queries, FROST abstains on 34% of cases versus 8% forstandard chain-of-thought, reducing false positives by 45%. Task-stratifiedevaluation shows that exploration benefits scale with problem ambiguity.Generalization to mathematical reasoning, code generation, and multimodal domainsremains future work.",acl_anthology,conference,ACL,formally_published,2026-01-01,,,2.9019983896322277,large language model,,,,,,,,,https://aclanthology.org/2026.acl-industry.77/,https://aclanthology.org/2026.acl-industry.77.pdf,open,pdf/2026-07-15_27_FROST_ Factual Reasoning via Optimized Stochastic Trajectories in Large Language Models during Inference.pdf,downloaded
28,Reinforcement Learning with Semantic Rewards Enables Low-Resource Language Expansion without Alignment Tax,Zeli Su; Ziyin Zhang; Zhou Liu; Xuexian Song; Zhankai Xu; Longfei Zheng; Xiaolu Zhang; Rong Fu; Guixian Xu; Wentao Zhang,"Extending large language models (LLMs) to low-resource languages often incurs an “align- ment tax”: improvements in the target lan- guage come at the cost of catastrophic forget- ting in general capabilities. We argue that this trade-off arises from the rigidity of supervised fine-tuning (SFT), which enforces token-level surface imitation on narrow and biased data distributions. To address this limitation, we propose a semantic-space alignment paradigm powered by Group Relative Policy Optimiza- tion (GRPO), where the model is optimized us- ing embedding-level semantic rewards rather than likelihood maximization. This objective encourages meaning preservation through flex- ible realizations, enabling controlled updates that reduce destructive interference with pre- trained knowledge. We evaluate our approach on Tibetan–Chinese machine translation and Ti- betan headline generation. Experiments show that our method acquires low-resource capa- bilities while markedly mitigating alignment tax, preserving general competence more effec- tively than SFT. Despite producing less rigid surface overlap, semantic RL yields higher se- mantic quality and preference in open-ended generation, and few-shot transfer results indi- cate that it learns more transferable and ro- bust representations under limited supervision. Overall, our study demonstrates that reinforce- ment learning with semantic rewards provides a safer and more reliable pathway for inclusive low-resource language expansion.","Extending large language models (LLMs) to low-resource languages often incurs an “align- ment tax”: improvements in the target lan- guage come at the cost of catastrophic forget- ting in general capabilities. We argue that this trade-off arises from the rigidity of supervised fine-tuning (SFT), which enforces token-level surface imitation on narrow and biased data distributions. To address this limitation, we propose a semantic-space alignment paradigm powered by Group Relative Policy Optimiza- tion (GRPO), where the model is optimized us- ing embedding-level semantic rewards rather than likelihood maximization. This objective encourages meaning preservation through flex- ible realizations, enabling controlled updates that reduce destructive interference with pre- trained knowledge. We evaluate our approach on Tibetan–Chinese machine translation and Ti- betan headline generation. Experiments show that our method acquires low-resource capa- bilities while markedly mitigating alignment tax, preserving general competence more effec- tively than SFT. Despite producing less rigid surface overlap, semantic RL yields higher se- mantic quality and preference in open-ended generation, and few-shot transfer results indi- cate that it learns more transferable and ro- bust representations under limited supervision. Overall, our study demonstrates that reinforce- ment learning with semantic rewards provides a safer and more reliable pathway for inclusive low-resource language expansion.",acl_anthology,conference,ACL,formally_published,2026-01-01,,,2.9012311252844185,large language model,,,,,,,,,https://aclanthology.org/2026.findings-acl.880/,https://aclanthology.org/2026.findings-acl.880.pdf,open,pdf/2026-07-15_28_Reinforcement Learning with Semantic Rewards Enables Low-Resource Language Expansion without Alignment Tax.pdf,downloaded
