index,title,authors,abstract,summary,source,venue_type,journal,publication_status,publication_date,doi,categories,score,matched_keywords,source_hits,matched_researchers,matched_groups,tracking_confidence,tracking_match_type,author_ids,institution_ids,cited_by_count,article_url,pdf_url,open_access_status,local_pdf,pdf_download_status
15,LaGuadia: Language-Guided Adaptive Distillation from Pathology Foundation Models,Gangsu Kim; Won-Ki Jeong,"Pathology Foundation Models (PFMs) offer powerful Whole Slide Image (WSI) representations but suffer from massive computational costs. While Knowledge Distillation (KD) can create efficient student models, existing multi-teacher methods often use suboptimal uniform weighting that ignores tissue heterogeneity. We propose LaGuadia (Language-Guided Adaptive DistillAtion), a framework that develops a compact pathology image encoder by dynamically integrating expertise from multiple PFMs under clinical linguistic guidance. Our approach utilizes a multi-stage pipeline: first, extracting visually observable clinical keywords from pathology reports; second, aligning visual features with these keywords via a Vision-Language meta-teacher (MedSigLIP) to provide dense semantic guidance; and finally, performing adaptive KD where teacher contributions are weighted based on their semantic alignment with the clinical narrative. Experiments on WSI captioning, visual question answering, and slide-level classification tasks demonstrate that an 87M parameter LaGuadia student model matches or exceeds foundation-scale models such as GigaPath and UNI, achieving strong factual consistency and robust generalization. These results highlight clinical language as an effective semantic anchor for building efficient and reliable digital pathology systems. Code is available at https://github.com/hvcl/LaGuadia.","Pathology Foundation Models (PFMs) offer powerful Whole Slide Image (WSI) representations but suffer from massive computational costs. While Knowledge Distillation (KD) can create efficient student models, existing multi-teacher methods often use suboptimal uniform weighting that ignores tissue heterogeneity. We propose LaGuadia (Language-Guided Adaptive DistillAtion), a framework that develops a compact pathology image encoder by dynamically integrating expertise from multiple PFMs under clinical linguistic guidance. Our approach utilizes a multi-stage pipeline: first, extracting visually observable clinical keywords from pathology reports; second, aligning visual features with these keywords via a Vision-Language meta-teacher (MedSigLIP) to provide dense semantic guidance; and finally, performing adaptive KD where teacher contributions are weighted based on their semantic alignment with the clinical narrative. Experiments on WSI captioning, visual question answering, and slide-level classification tasks demonstrate that an 87M parameter LaGuadia student model matches or exceeds foundation-scale models such as GigaPath and UNI, achieving strong factual consistency and robust generalization. These results highlight clinical language as an effective semantic anchor for building efficient and reliable digital pathology systems. Code is available at https://github.com/hvcl/LaGuadia.",arxiv,preprint,,preprint,2026-07-13,,cs.CV; cs.LG,3.125612496750044,foundation model,,,,,,,,,http://arxiv.org/abs/2607.11257v1,https://arxiv.org/pdf/2607.11257v1,open,pdf/2026-07-15_15_LaGuadia_ Language-Guided Adaptive Distillation from Pathology Foundation Models.pdf,downloaded
16,modelDNA: Calibrated Lineage Verification and Merge Decomposition from Sampled Weight Fingerprints,Muhammad Awais Bin Adil; Saad Aamir,"The lineage graph of open-weight language models is self-reported: Hugging Face's base_model metadata field is optional and unverified, and over 60% of Hub models document no parentage at all. Methods for detecting lineage from weights exist in the research literature, but each ships as paper code tied to one signal and one experiment; when a provenance dispute breaks, the analysis is redone by hand. This report describes modelDNA, a tool that fingerprints a model from roughly 100-300 MB of ranged HTTP reads (instead of a full 15 GB download for a 7B model), compares the fingerprint against a reference database of foundation models across four published signal families, and returns one of eight verdict classes with a calibrated probability, preferring honest abstention to confident error. On a benchmark of 15 real Hub models with org-documented parentage, judged against 8 candidate bases (13 positives, 107 hard negatives), the system achieves AUROC 1.0, zero false positives at its reporting threshold, and 13/13 correct top-1 parent attribution. The report's second contribution is merge decomposition. Every mainstream weight-merging method is (near-)linear per tensor, and fingerprint sample positions are deterministic functions of tensor identity, so a merged model's fingerprint is the same linear combination of its parents' fingerprints. Mixture weights can therefore be recovered from fingerprints alone by sum-to-one constrained least squares. Against merges with published mergekit configurations as ground truth, the method recovers a slerp merge's layer-interpolation curves at r = 0.999 and a dare_ties merge's mixture weights to within 0.011 of the published values, without downloading any weights beyond the fingerprints. All fingerprints, benchmarks, and the inferred lineage graph of 55 models are public and reproducible offline.","The lineage graph of open-weight language models is self-reported: Hugging Face's base_model metadata field is optional and unverified, and over 60% of Hub models document no parentage at all. Methods for detecting lineage from weights exist in the research literature, but each ships as paper code tied to one signal and one experiment; when a provenance dispute breaks, the analysis is redone by hand. This report describes modelDNA, a tool that fingerprints a model from roughly 100-300 MB of ranged HTTP reads (instead of a full 15 GB download for a 7B model), compares the fingerprint against a reference database of foundation models across four published signal families, and returns one of eight verdict classes with a calibrated probability, preferring honest abstention to confident error. On a benchmark of 15 real Hub models with org-documented parentage, judged against 8 candidate bases (13 positives, 107 hard negatives), the system achieves AUROC 1.0, zero false positives at its reporting threshold, and 13/13 correct top-1 parent attribution. The report's second contribution is merge decomposition. Every mainstream weight-merging method is (near-)linear per tensor, and fingerprint sample positions are deterministic functions of tensor identity, so a merged model's fingerprint is the same linear combination of its parents' fingerprints. Mixture weights can therefore be recovered from fingerprints alone by sum-to-one constrained least squares. Against merges with published mergekit configurations as ground truth, the method recovers a slerp merge's layer-interpolation curves at r = 0.999 and a dare_ties merge's mixture weights to within 0.011 of the published values, without downloading any weights beyond the fingerprints. All fingerprints, benchmarks, and the inferred lineage graph of 55 models are public and reproducible offline.",arxiv,preprint,,preprint,2026-07-12,,cs.LG,3.1094537440093695,foundation model,,,,,,,,,http://arxiv.org/abs/2607.10617v1,https://arxiv.org/pdf/2607.10617v1,open,pdf/2026-07-15_16_modelDNA_ Calibrated Lineage Verification and Merge Decomposition from Sampled Weight Fingerprints.pdf,downloaded
17,Generative Augmentation of Raman Spectra for Glioma Classification,Andrei Iuşan; Iulian Vasile; Daria Voiculescu; Ion Petre; Andrei Păun; Bogdan Oancea; Mihaela Păun,"Access to sufficiently large biomedical datasets remains a major obstacle for machine learning in Raman spectroscopy-based diagnostics. In particular, for glioma analysis, datasets are typically small and heterogeneous, affected by acquisition-specific variability. This work investigates the utility of deep generative augmentation in such a small-cohort setting. We analyze glioma biopsy spectra acquired from 58 tumor samples and consider both binary IDH-status classification and 6-class methylation subtype classification problems. To address the limited size and imbalance of the dataset, we develop a conditional variational autoencoder ($β$-CVAE) capable of generating class-conditioned synthetic Raman spectra. The generated data are evaluated in Train-on-Synthetic, Test-on-Real (TS/TR) and Train-on-Synthetic+Real, Test-on-Real (TSR/TR) settings under a strict patient-isolated cross-validation protocol. Models trained exclusively on synthetic data underperform models trained on real spectra, indicating a substantial domain gap between synthetic and real distributions. However, augmenting the real training data with synthetic spectra consistently improves classification performance across multiple models. These findings indicate that, even with a limited number of independent patient samples, generative models can capture sufficient structure to provide useful regularization for downstream classifiers. We also investigate a reconstruction-based inference strategy, termed Classification by Reconstruction (CbR), in which class prediction is based on reconstruction error under different class conditions. Overall, the results support the use of deep generative augmentation as a practical strategy for improving machine learning robustness in Raman spectroscopy applications characterized by limited biomedical datasets.","Access to sufficiently large biomedical datasets remains a major obstacle for machine learning in Raman spectroscopy-based diagnostics. In particular, for glioma analysis, datasets are typically small and heterogeneous, affected by acquisition-specific variability. This work investigates the utility of deep generative augmentation in such a small-cohort setting. We analyze glioma biopsy spectra acquired from 58 tumor samples and consider both binary IDH-status classification and 6-class methylation subtype classification problems. To address the limited size and imbalance of the dataset, we develop a conditional variational autoencoder ($β$-CVAE) capable of generating class-conditioned synthetic Raman spectra. The generated data are evaluated in Train-on-Synthetic, Test-on-Real (TS/TR) and Train-on-Synthetic+Real, Test-on-Real (TSR/TR) settings under a strict patient-isolated cross-validation protocol. Models trained exclusively on synthetic data underperform models trained on real spectra, indicating a substantial domain gap between synthetic and real distributions. However, augmenting the real training data with synthetic spectra consistently improves classification performance across multiple models. These findings indicate that, even with a limited number of independent patient samples, generative models can capture sufficient structure to provide useful regularization for downstream classifiers. We also investigate a reconstruction-based inference strategy, termed Classification by Reconstruction (CbR), in which class prediction is based on reconstruction error under different class conditions. Overall, the results support the use of deep generative augmentation as a practical strategy for improving machine learning robustness in Raman spectroscopy applications characterized by limited biomedical datasets.",arxiv,preprint,,preprint,2026-07-11,,cs.LG,3.0080017129845387,variational autoencoder,,,,,,,,,http://arxiv.org/abs/2607.10196v1,https://arxiv.org/pdf/2607.10196v1,open,pdf/2026-07-15_17_Generative Augmentation of Raman Spectra for Glioma Classification.pdf,downloaded
18,From Expressivity to Sample Complexity: Narrow Teachers for Transformers via C-RASP,Michael Rizvi-Martel; Satwik Bhattamishra; Guillaume Rabusseau; Michael Hahn,"A theoretical understanding of Transformers is crucial to better understand the capacities and limitations of large language models (LLMs). There is much work analyzing the expressivity of attention-based models. By proposing handcrafted weights or using computational complexity arguments, a large amount of past theoretical works have sought to characterize which tasks are and which are not in the hypothesis class of Transformer models. However, little work investigates the learnability of such solutions. In this work, we make progress towards this goal. Inspired by recent loss landscape analysis work, we propose preliminary sample complexity bounds for learning C-RASP constructions with Transformers.","A theoretical understanding of Transformers is crucial to better understand the capacities and limitations of large language models (LLMs). There is much work analyzing the expressivity of attention-based models. By proposing handcrafted weights or using computational complexity arguments, a large amount of past theoretical works have sought to characterize which tasks are and which are not in the hypothesis class of Transformer models. However, little work investigates the learnability of such solutions. In this work, we make progress towards this goal. Inspired by recent loss landscape analysis work, we propose preliminary sample complexity bounds for learning C-RASP constructions with Transformers.",arxiv,preprint,,preprint,2026-07-13,,cs.LG; cs.CL,2.995933438627871,large language model,,,,,,,,,http://arxiv.org/abs/2607.11760v1,https://arxiv.org/pdf/2607.11760v1,open,pdf/2026-07-15_18_From Expressivity to Sample Complexity_ Narrow Teachers for Transformers via C-RASP.pdf,downloaded
19,Unified Backbone Refinement for Diffusion Models via Internal-Latent Analysis,Haksoo Lim; Myeongjin Lee; Wonjoon Chang; Jaesik Choi,"Diffusion models have achieved remarkable success across diverse domains, with performance closely related to the denoising backbones that parameterize the score function. In this paper, we present a systematic, phase-aware analysis of diffusion components and show that abrupt, early-stage fluctuations in deep latents are strongly associated with artifacts. Guided by these findings, we introduce DUNE (Diffusion Unified Network refiNEr), a training-free refinement framework that detects abrupt deviations in deep low-noise internal latents using a shared EMA-based criterion, and applies backbone-specific suppression to the detector-selected entries. Although derived from U-Net, the same detect-suppress principle extends naturally to Transformer-based diffusion models by acting on the latents of deep self-attention blocks. Extensive experiments across multiple backbones indicate that DUNE improves fidelity while reducing hallucinations, offering new insight into where and when diffusion backbones should be controlled.","Diffusion models have achieved remarkable success across diverse domains, with performance closely related to the denoising backbones that parameterize the score function. In this paper, we present a systematic, phase-aware analysis of diffusion components and show that abrupt, early-stage fluctuations in deep latents are strongly associated with artifacts. Guided by these findings, we introduce DUNE (Diffusion Unified Network refiNEr), a training-free refinement framework that detects abrupt deviations in deep low-noise internal latents using a shared EMA-based criterion, and applies backbone-specific suppression to the detector-selected entries. Although derived from U-Net, the same detect-suppress principle extends naturally to Transformer-based diffusion models by acting on the latents of deep self-attention blocks. Extensive experiments across multiple backbones indicate that DUNE improves fidelity while reducing hallucinations, offering new insight into where and when diffusion backbones should be controlled.",arxiv,preprint,,preprint,2026-07-04,,cs.CV; cs.AI; cs.LG,2.9829296684128552,diffusion,,,,,,,,,http://arxiv.org/abs/2607.09753v1,https://arxiv.org/pdf/2607.09753v1,open,pdf/2026-07-15_19_Unified Backbone Refinement for Diffusion Models via Internal-Latent Analysis.pdf,downloaded
20,Multi-Agent LLMs Fail to Explore Each Other,Hyeong Kyu Choi; Jiatong Li; Wendi Li; Xin Eric Wang; Sharon Li,"Exploration is essential for reliable autonomy in multi-agent systems, yet it remains unclear whether large language model (LLM) agents can explore effectively when interacting with one another. We show that modern LLM agents fail to do so, often exhibiting myopic and polarized interaction patterns that lead to suboptimal coordination and increased regret. We formalize this challenge as the Multi-Agent Exploration problem, modeling it as a partially observable stochastic game (POSG) problem in which agents must probe peers to infer their capabilities and identify effective interaction strategies. To address this, we introduce Multi- Agent Contextual Exploration (MACE), a lightweight framework that explicitly promotes exploration through structured peer selection. Across both contextual and parametric diversity settings, MACE substantially improves exploration behavior and downstream task performance. We further show theoretically that the value of exploration increases with agent diversity. Overall, our results highlight a fundamental limitation of current LLM agents and underscore the importance of explicitly guided exploration for reliable multi-agent autonomy. Code will be released in https://github.com/deeplearning-wisc/mace","Exploration is essential for reliable autonomy in multi-agent systems, yet it remains unclear whether large language model (LLM) agents can explore effectively when interacting with one another. We show that modern LLM agents fail to do so, often exhibiting myopic and polarized interaction patterns that lead to suboptimal coordination and increased regret. We formalize this challenge as the Multi-Agent Exploration problem, modeling it as a partially observable stochastic game (POSG) problem in which agents must probe peers to infer their capabilities and identify effective interaction strategies. To address this, we introduce Multi- Agent Contextual Exploration (MACE), a lightweight framework that explicitly promotes exploration through structured peer selection. Across both contextual and parametric diversity settings, MACE substantially improves exploration behavior and downstream task performance. We further show theoretically that the value of exploration increases with agent diversity. Overall, our results highlight a fundamental limitation of current LLM agents and underscore the importance of explicitly guided exploration for reliable multi-agent autonomy. Code will be released in https://github.com/deeplearning-wisc/mace",arxiv,preprint,,preprint,2026-07-13,,cs.MA; cs.AI,2.9414784759997845,large language model; llm agent; multi-agent system,,,,,,,,,http://arxiv.org/abs/2607.11250v1,https://arxiv.org/pdf/2607.11250v1,open,pdf/2026-07-15_20_Multi-Agent LLMs Fail to Explore Each Other.pdf,downloaded
21,"Route, Communicate, and Reason: Gated Routing and Adaptive Depth for Efficient Multi-Agent Reasoning",Sudipto Ghosh; Tanmoy Chakraborty,"Multi-agent ensembling multiplies active parameters and inference cost without answering three basic questions: which agents to consult, how deeply a query should traverse a hierarchy of agents, and when inter-agent communication is worth its cost. We present GRADE (Gated Routing and Adaptive Depth for Efficient Reasoning), a hierarchical multi-agent system in which four lightweight learned gates jointly govern agent selection, hierarchy depth, inter-agent communication, and branch pruning. Training uses CoGRPO (Collaborative Group-Relative Policy Optimization), a novel critic-free recipe that adapts GRPO to multi-agent hierarchies and assigns a shared advantage signal to every gate and agent that participated in a rollout. Agent models are drawn from a hot-swappable Expert Registry; per-agent calibration maps allow experts to be replaced at inference time without retraining. At $\sim$17B average active parameters, GRADE outperforms all baselines on GSM8K, MMLUPro, and GPQA, surpassing the strongest baseline by 4.8 points on MMLUPro at half the active compute. On AIME-2025, where model depth dominates, GRADE remains competitive to existing frameworks. Ablations isolate the hierarchy and masked cross-attention as the largest contributors to accuracy, and show that per-agent calibration is necessary for safe hot-swapping.","Multi-agent ensembling multiplies active parameters and inference cost without answering three basic questions: which agents to consult, how deeply a query should traverse a hierarchy of agents, and when inter-agent communication is worth its cost. We present GRADE (Gated Routing and Adaptive Depth for Efficient Reasoning), a hierarchical multi-agent system in which four lightweight learned gates jointly govern agent selection, hierarchy depth, inter-agent communication, and branch pruning. Training uses CoGRPO (Collaborative Group-Relative Policy Optimization), a novel critic-free recipe that adapts GRPO to multi-agent hierarchies and assigns a shared advantage signal to every gate and agent that participated in a rollout. Agent models are drawn from a hot-swappable Expert Registry; per-agent calibration maps allow experts to be replaced at inference time without retraining. At $\sim$17B average active parameters, GRADE outperforms all baselines on GSM8K, MMLUPro, and GPQA, surpassing the strongest baseline by 4.8 points on MMLUPro at half the active compute. On AIME-2025, where model depth dominates, GRADE remains competitive to existing frameworks. Ablations isolate the hierarchy and masked cross-attention as the largest contributors to accuracy, and show that per-agent calibration is necessary for safe hot-swapping.",arxiv,preprint,,preprint,2026-07-12,,cs.AI; cs.CL; cs.LG,2.932714130117478,multi-agent system,,,,,,,,,http://arxiv.org/abs/2607.10836v1,https://arxiv.org/pdf/2607.10836v1,open,"pdf/2026-07-15_21_Route, Communicate, and Reason_ Gated Routing and Adaptive Depth for Efficient Multi-Agent Reasoning.pdf",downloaded
