index,title,authors,abstract,summary,source,venue_type,journal,publication_status,publication_date,doi,categories,score,matched_keywords,source_hits,matched_researchers,matched_groups,tracking_confidence,tracking_match_type,author_ids,institution_ids,cited_by_count,article_url,pdf_url,open_access_status,local_pdf,pdf_download_status
8,KGCQual: An Interpretable Framework for Evaluating the Knowledge Graph Construction Quality from Text,Nipun Misra; Vikranth Udandarao; Aanchal Gupta; Yogender Kumar; Manuj Mukherjee; Raghava Mutharaju,"Knowledge Graphs (KGs) are increasingly constructed through automated extraction pipelines; however, such systems often introduce spurious or incomplete triples, which degrade downstream performance. Existing evaluation practices rely heavily on task-specific metrics or small-scale manual verification, offering limited insight into the structural and semantic fidelity of extracted graphs. We propose a novel, interpretable metric for intrinsic KG quality assessment that measures how closely an automatically extracted graph approximates an ""ideal"" graph capturing the key noun phrases, predicate relations, and basic linguistic phenomena such as negation expressed in the source text. Our framework integrates two complementary components: (1) an entity-level assessment that evaluates completeness, resolution quality, and connectivity, and (2) a relation-level assessment that judges predicate preservation and multiplicity using lexical similarity, dependency-parse alignment, and light-weight negation handling to ensure semantic faithfulness. We evaluate our metric across multiple state-of-the-art triple extraction systems and datasets, including WebNLG, TinyButMighty, and BenchIE, demonstrating that it reliably identifies omissions, redundancy, and structural deviations that existing metrics overlook. Our work offers a scalable, model-agnostic, and interpretable framework for comparing automated KG construction methods and provides a foundation for standardised evaluation. We further validate the metric through an ablation study isolating noun and verb components, and a downstream evaluation showing that KGCQual scores correlate significantly with link prediction performance on the same extracted KGs. The code repository is available at https://github.com/kracr/kg-quality-metric.","Knowledge Graphs (KGs) are increasingly constructed through automated extraction pipelines; however, such systems often introduce spurious or incomplete triples, which degrade downstream performance. Existing evaluation practices rely heavily on task-specific metrics or small-scale manual verification, offering limited insight into the structural and semantic fidelity of extracted graphs. We propose a novel, interpretable metric for intrinsic KG quality assessment that measures how closely an automatically extracted graph approximates an ""ideal"" graph capturing the key noun phrases, predicate relations, and basic linguistic phenomena such as negation expressed in the source text. Our framework integrates two complementary components: (1) an entity-level assessment that evaluates completeness, resolution quality, and connectivity, and (2) a relation-level assessment that judges predicate preservation and multiplicity using lexical similarity, dependency-parse alignment, and light-weight negation handling to ensure semantic faithfulness. We evaluate our metric across multiple state-of-the-art triple extraction systems and datasets, including WebNLG, TinyButMighty, and BenchIE, demonstrating that it reliably identifies omissions, redundancy, and structural deviations that existing metrics overlook. Our work offers a scalable, model-agnostic, and interpretable framework for comparing automated KG construction methods and provides a foundation for standardised evaluation. We further validate the metric through an ablation study isolating noun and verb components, and a downstream evaluation showing that KGCQual scores correlate significantly with link prediction performance on the same extracted KGs. The code repository is available at https://github.com/kracr/kg-quality-metric.",arxiv,preprint,,preprint,2026-07-11,,cs.AI; cs.CL,3.2711400479281005,knowledge graph,,,,,,,,,http://arxiv.org/abs/2607.10212v1,https://arxiv.org/pdf/2607.10212v1,open,pdf/2026-07-15_08_KGCQual_ An Interpretable Framework for Evaluating the Knowledge Graph Construction Quality from Text.pdf,downloaded
9,Integrating Background Knowledge for Scalable Causal Discovery,Mátyás Schubert; Theofanis Aslanidis; Tom Claassen; Sara Magliacane,"Expert background knowledge is often available in practical applications of causal discovery. Such constraints on the true causal graph can help causal discovery in terms of identifiability of causal effects and accuracy of the learned structure, but also in reducing the space of candidate causal graphs. As causal discovery can become computationally expensive for large number of variables, it is crucial to utilize background knowledge effectively during the causal discovery process. However, most current methods only use background knowledge in a postprocessing step after causal discovery to refine the learned graph. In this work, we develop a framework for utilizing background knowledge during the causal discovery process, focusing especially on scalable causal discovery methods that recover only a subset of the whole graph. We implement our framework for multiple algorithms and empirically show that utilizing background knowledge can both reduce computational requirements and increase the quality of the learned structures.","Expert background knowledge is often available in practical applications of causal discovery. Such constraints on the true causal graph can help causal discovery in terms of identifiability of causal effects and accuracy of the learned structure, but also in reducing the space of candidate causal graphs. As causal discovery can become computationally expensive for large number of variables, it is crucial to utilize background knowledge effectively during the causal discovery process. However, most current methods only use background knowledge in a postprocessing step after causal discovery to refine the learned graph. In this work, we develop a framework for utilizing background knowledge during the causal discovery process, focusing especially on scalable causal discovery methods that recover only a subset of the whole graph. We implement our framework for multiple algorithms and empirically show that utilizing background knowledge can both reduce computational requirements and increase the quality of the learned structures.",arxiv,preprint,,preprint,2026-07-11,,stat.ML; cs.LG,3.270614638521561,causal discovery,,,,,,,,,http://arxiv.org/abs/2607.10456v1,https://arxiv.org/pdf/2607.10456v1,open,pdf/2026-07-15_09_Integrating Background Knowledge for Scalable Causal Discovery.pdf,downloaded
10,GAE: Graph-Augmented Evolution for Scientific Discovery via Reinforcement Optimization,Xuanzhou Chen; Taoli Cheng,"Evolutionary program search guided by Large Language Models (LLMs) has emerged as a powerful paradigm for automated scientific discovery. However, current approaches are fundamentally constrained by three bottlenecks: structurally blind parent selection, sparse whole-program evaluation rewards, and static mutation operators that fail to adapt during search. We present GAE (Graph-Augmented Evolution), a framework that resolves these limitations through a tightly coupled, three-pillar architecture. First, a relational graph neural network (GNN) parses programs into typed computation graphs, producing structure-aware embeddings. Second, an RL-optimized meta-controller leverages these embeddings to replace blind evolutionary sampling with a directed policy, dynamically selecting optimal parents and mutation directions based on reward history. Third, an online GRPO fine-tuning loop continuously updates the LLM mutation operator at test-time using group-normalized evaluation rewards, directly aligning the model's generation distribution with high-fitness structural edits. We evaluate GAE on a challenging scientific discovery task: symbolic regression for complex nonlinear oscillator systems. By transforming stochastic search into a directed, self-improving trajectory, GAE efficiently discovers closed-form physical equations, consistently matching or outperforming static LLM-driven baselines and achieving state-of-the-art out-of-distribution performance.","Evolutionary program search guided by Large Language Models (LLMs) has emerged as a powerful paradigm for automated scientific discovery. However, current approaches are fundamentally constrained by three bottlenecks: structurally blind parent selection, sparse whole-program evaluation rewards, and static mutation operators that fail to adapt during search. We present GAE (Graph-Augmented Evolution), a framework that resolves these limitations through a tightly coupled, three-pillar architecture. First, a relational graph neural network (GNN) parses programs into typed computation graphs, producing structure-aware embeddings. Second, an RL-optimized meta-controller leverages these embeddings to replace blind evolutionary sampling with a directed policy, dynamically selecting optimal parents and mutation directions based on reward history. Third, an online GRPO fine-tuning loop continuously updates the LLM mutation operator at test-time using group-normalized evaluation rewards, directly aligning the model's generation distribution with high-fitness structural edits. We evaluate GAE on a challenging scientific discovery task: symbolic regression for complex nonlinear oscillator systems. By transforming stochastic search into a directed, self-improving trajectory, GAE efficiently discovers closed-form physical equations, consistently matching or outperforming static LLM-driven baselines and achieving state-of-the-art out-of-distribution performance.",arxiv,preprint,,preprint,2026-07-11,,cs.LG; cs.AI,3.2540132711021377,large language model,,,,,,,,,http://arxiv.org/abs/2607.10127v1,https://arxiv.org/pdf/2607.10127v1,open,pdf/2026-07-15_10_GAE_ Graph-Augmented Evolution for Scientific Discovery via Reinforcement Optimization.pdf,downloaded
11,"SciMKG: A Multimodal Knowledge Graph for Science Education with Text, Image, Video and Audio",Tong Lu; Zhichun Wang; Y. Zhou; Yiming Guan; Zhiyong Bai; Junsheng Du,"Knowledge graphs (KGs) play a vital role in intelligent education by offering structured representations of educational content. However, constructing multimodal educational knowledge graphs (EKGs) from diverse open educational resources remains a challenge due to the reliance on costly manual annotations and the lack of multimodal integration. In this work, we propose an automated framework that harnesses the reasoning capabilities of large language models (LLMs) to construct multimodal EKGs from open courses efficiently. In our framework, an Extraction-Verification-Integration-Augmentation pipeline is designed to incrementally extract and refine disciplinary concepts from learning resources. Texts, images, videos and audios are aligned with their corresponding concepts. To ensure semantic consistency across modalities, we propose a cross-modal alignment method based on shared structural and semantic features. Using our framework, we build SciMKG, a large-scale multimodal EKG for Chinese K12 education in sciences (biology, physics, and chemistry), encompassing 1,356 knowledge points, 34,630 multimodal concepts, and 403,400 relational triples. Experimental results show that our method improves concept extraction F1 score by 9 % over state-of-the-art baselines; both automatic and human evaluations confirm the robustness of our multimodal alignment method. SciMKG and our construction toolkit will be publicly released to support further research and applications in AI-driven education.","Knowledge graphs (KGs) play a vital role in intelligent education by offering structured representations of educational content. However, constructing multimodal educational knowledge graphs (EKGs) from diverse open educational resources remains a challenge due to the reliance on costly manual annotations and the lack of multimodal integration. In this work, we propose an automated framework that harnesses the reasoning capabilities of large language models (LLMs) to construct multimodal EKGs from open courses efficiently. In our framework, an Extraction-Verification-Integration-Augmentation pipeline is designed to incrementally extract and refine disciplinary concepts from learning resources. Texts, images, videos and audios are aligned with their corresponding concepts. To ensure semantic consistency across modalities, we propose a cross-modal alignment method based on shared structural and semantic features. Using our framework, we build SciMKG, a large-scale multimodal EKG for Chinese K12 education in sciences (biology, physics, and chemistry), encompassing 1,356 knowledge points, 34,630 multimodal concepts, and 403,400 relational triples. Experimental results show that our method improves concept extraction F1 score by 9 % over state-of-the-art baselines; both automatic and human evaluations confirm the robustness of our multimodal alignment method. SciMKG and our construction toolkit will be publicly released to support further research and applications in AI-driven education.",openalex,conference,Proceedings of the AAAI Conference on Artificial Intelligence,formally_published,2026-03-14,https://doi.org/10.1609/aaai.v40i18.38574,Advanced Graph Neural Networks; Multimodal Machine Learning Applications; Topic Modeling,3.239881037203806,knowledge graph; large language model,,,,,,A5038050749; A5080268112; A5129643683; A5129717099; A5129732324; A5129747881,I142974352; I157773358; I25254941; I4210110997,1,https://doi.org/10.1609/aaai.v40i18.38574,https://ojs.aaai.org/index.php/AAAI/article/download/38574/42536,diamond,,failed
12,From Global to Factor-Wise Expert Composition in Discrete Diffusion Models,Haozhe Huang; Yudong Xu; Abhijoy Mandal; Alán Aspuru-Guzik,"Discrete diffusion models offer a powerful framework for solving complex reasoning tasks, particularly through compositional generation, which combines multiple pre-trained experts to generalize beyond their individual training data. Recent theoretical corrections introduce time-dependent mixing weights to better align composed diffusion dynamics with the intended target. However, these methods are fundamentally limited by working on a per-sample basis, treating each generated state monolithically and ignoring the potential spatial or functional specializations of different experts. In this work, we address this limitation by proposing FactorDiff - a factor-wise composition framework for diffusion models. We posit that samples can be further decomposed into smaller factors, and propose a sampling process that dynamically routes each factor to the most relevant expert. We instantiate this framework with spatial/pixel-level compositions and validate it on the ARC-AGI benchmark, demonstrating that simple factor-specific routing consistently outperforms complex global scalar weighting schemes on tasks that require logical consistency and spatial disentanglement.","Discrete diffusion models offer a powerful framework for solving complex reasoning tasks, particularly through compositional generation, which combines multiple pre-trained experts to generalize beyond their individual training data. Recent theoretical corrections introduce time-dependent mixing weights to better align composed diffusion dynamics with the intended target. However, these methods are fundamentally limited by working on a per-sample basis, treating each generated state monolithically and ignoring the potential spatial or functional specializations of different experts. In this work, we address this limitation by proposing FactorDiff - a factor-wise composition framework for diffusion models. We posit that samples can be further decomposed into smaller factors, and propose a sampling process that dynamically routes each factor to the most relevant expert. We instantiate this framework with spatial/pixel-level compositions and validate it on the ARC-AGI benchmark, demonstrating that simple factor-specific routing consistently outperforms complex global scalar weighting schemes on tasks that require logical consistency and spatial disentanglement.",arxiv,preprint,,preprint,2026-07-13,,cs.LG,3.1976453593671286,diffusion,,,,,,,,,http://arxiv.org/abs/2607.11758v1,https://arxiv.org/pdf/2607.11758v1,open,pdf/2026-07-15_12_From Global to Factor-Wise Expert Composition in Discrete Diffusion Models.pdf,downloaded
13,PromptGraph: Graph-Guided Prompt Sanitization for Balancing Privacy and Utility in LLM Inference,Chen Gu; Hui Wan; Donghui Hu; Hui Wang; Zhuoer Gu,"Large Language Model (LLM) services introduce a fundamental privacy challenge. Sensitive information may be inferred not only from explicit identifiers, such as names or phone numbers, but also from contextual associations among otherwise innocuous spans. Existing sanitizers typically assign privacy or utility signals to individual spans without explicitly modeling pairwise relationships among them. In this paper, we propose PromptGraph, a graph-guided prompt-sanitization approach for privacy-preserving LLM inference. PromptGraph estimates privacy leakage at the span level and utility-relevant contextual dependencies between pairs of spans. It represents each prompt as an attributed graph, in which nodes carry span-level privacy scores and edges encode contextual dependencies needed to preserve utility. The sanitization objective selects a protected span set that maximizes privacy gain while penalizing the loss of contextual dependencies. This formulation explicitly balances privacy and utility when contextual evidence is hidden. Protected spans are sanitized locally, and returned placeholders are restored only after passing local consistency checks. We conduct extensive experiments showing that PromptGraph achieves a more favorable balance between privacy and utility than prompt-privacy baselines.","Large Language Model (LLM) services introduce a fundamental privacy challenge. Sensitive information may be inferred not only from explicit identifiers, such as names or phone numbers, but also from contextual associations among otherwise innocuous spans. Existing sanitizers typically assign privacy or utility signals to individual spans without explicitly modeling pairwise relationships among them. In this paper, we propose PromptGraph, a graph-guided prompt-sanitization approach for privacy-preserving LLM inference. PromptGraph estimates privacy leakage at the span level and utility-relevant contextual dependencies between pairs of spans. It represents each prompt as an attributed graph, in which nodes carry span-level privacy scores and edges encode contextual dependencies needed to preserve utility. The sanitization objective selects a protected span set that maximizes privacy gain while penalizing the loss of contextual dependencies. This formulation explicitly balances privacy and utility when contextual evidence is hidden. Protected spans are sanitized locally, and returned placeholders are restored only after passing local consistency checks. We conduct extensive experiments showing that PromptGraph achieves a more favorable balance between privacy and utility than prompt-privacy baselines.",arxiv,preprint,,preprint,2026-07-12,,cs.CR; cs.AI,3.15773697355223,large language model,,,,,,,,,http://arxiv.org/abs/2607.10709v1,https://arxiv.org/pdf/2607.10709v1,open,pdf/2026-07-15_13_PromptGraph_ Graph-Guided Prompt Sanitization for Balancing Privacy and Utility in LLM Inference.pdf,downloaded
14,GRATE: Temporal Extensions for Inductive KG Foundation Models via Gated Rotary Attention,Jiaxin Pan; Osama Mohammed; Daniel Hernández; Steffen Staab,"Knowledge graph foundation models such as Ultra and Trix achieve strong inductive transfer by learning relation-graph representations that generalise to unseen entities and relations. Extending this transferability to temporal knowledge graphs (TKGs) remains challenging: existing temporal models tie their parameters to dataset-specific entities, relations, or timestamps and are not designed to transfer to TKGs with disjoint vocabularies. We propose GRATE (Gated Rotary Attention for Temporal Encoding), an entity-side message function that adds no learnable parameters and encodes time through relative time differences by rotating each edge message according to its time gap to the query and applying a query-conditioned gate to select temporally relevant signals. GRATE integrates into NBFNet-style KG foundation models while preserving structural transferability. Existing TKG benchmarks evaluate within shared train/test vocabularies and cannot directly test cross-dataset temporal transfer; we therefore construct GDELTIndT and WIKIIndT, inductive transfer benchmark suites with disjoint entities, relations, and timestamps spanning both interpolation and extrapolation. Across these benchmarks and held-out forecasting datasets, a single jointly pretrained GRATE checkpoint improves over the static base model in most settings.","Knowledge graph foundation models such as Ultra and Trix achieve strong inductive transfer by learning relation-graph representations that generalise to unseen entities and relations. Extending this transferability to temporal knowledge graphs (TKGs) remains challenging: existing temporal models tie their parameters to dataset-specific entities, relations, or timestamps and are not designed to transfer to TKGs with disjoint vocabularies. We propose GRATE (Gated Rotary Attention for Temporal Encoding), an entity-side message function that adds no learnable parameters and encodes time through relative time differences by rotating each edge message according to its time gap to the query and applying a query-conditioned gate to select temporally relevant signals. GRATE integrates into NBFNet-style KG foundation models while preserving structural transferability. Existing TKG benchmarks evaluate within shared train/test vocabularies and cannot directly test cross-dataset temporal transfer; we therefore construct GDELTIndT and WIKIIndT, inductive transfer benchmark suites with disjoint entities, relations, and timestamps spanning both interpolation and extrapolation. Across these benchmarks and held-out forecasting datasets, a single jointly pretrained GRATE checkpoint improves over the static base model in most settings.",arxiv,preprint,,preprint,2026-07-11,,cs.AI,3.1415520124605556,foundation model; knowledge graph,,,,,,,,,http://arxiv.org/abs/2607.10197v1,https://arxiv.org/pdf/2607.10197v1,open,pdf/2026-07-15_14_GRATE_ Temporal Extensions for Inductive KG Foundation Models via Gated Rotary Attention.pdf,downloaded
