index,title,authors,abstract,summary,source,venue_type,journal,publication_status,publication_date,doi,categories,score,matched_keywords,source_hits,matched_researchers,matched_groups,tracking_confidence,tracking_match_type,author_ids,institution_ids,cited_by_count,article_url,pdf_url,open_access_status,local_pdf,pdf_download_status
1,UNIT: Unleash Large Language Models Potential for Graph Continual Learning,Tairan Huang; Yili Wang; Beibei Hu; Yiting Shi; Qiutong Li; Changlong He; Jianliang Gao,"In real-world multimodal web scenarios, graph-structured data often arrives in a streaming manner, making graph continual learning a crucial paradigm for continuously modeling such evolving structures. However, existing graph continual learning methods still face two fundamental challenges. 1) semantic-structural separation, where the graph-based methods excel at modeling topological relationships but neglect deep semantics. 2) imbalanced knowledge transfer, where existing models fail to effectively leverage general knowledge gained from early tasks to benefit subsequent new tasks. To address above issues, we propose a novel framework, \textbf{UN}leash Large Language Models PotentIal for Graph ConTinual Learning (UNIT). By fine-tuning large language model only on the first task, we bridge the distributional gap between the pre-trained LLM corpus and the target task dataset to enhance the adaptability of LLMs for graph-structured tasks. Meanwhile, we propose an uncertain-aware anchor generation mechanism to effectively preserve representative knowledge across tasks, avoiding the neglect of universal knowledge learned from previous tasks. Additionally, we introduce structural confluence modeling to explicitly integrates graph topology information into semantic information, enhancing the collaborative capabilities between semantic understanding and structural modeling. Extensive experiments demonstrate that our proposed method achieves state-of-the-art performance in the graph continual learning task.","In real-world multimodal web scenarios, graph-structured data often arrives in a streaming manner, making graph continual learning a crucial paradigm for continuously modeling such evolving structures. However, existing graph continual learning methods still face two fundamental challenges. 1) semantic-structural separation, where the graph-based methods excel at modeling topological relationships but neglect deep semantics. 2) imbalanced knowledge transfer, where existing models fail to effectively leverage general knowledge gained from early tasks to benefit subsequent new tasks. To address above issues, we propose a novel framework, \textbf{UN}leash Large Language Models PotentIal for Graph ConTinual Learning (UNIT). By fine-tuning large language model only on the first task, we bridge the distributional gap between the pre-trained LLM corpus and the target task dataset to enhance the adaptability of LLMs for graph-structured tasks. Meanwhile, we propose an uncertain-aware anchor generation mechanism to effectively preserve representative knowledge across tasks, avoiding the neglect of universal knowledge learned from previous tasks. Additionally, we introduce structural confluence modeling to explicitly integrates graph topology information into semantic information, enhancing the collaborative capabilities between semantic understanding and structural modeling. Extensive experiments demonstrate that our proposed method achieves state-of-the-art performance in the graph continual learning task.",arxiv,preprint,,preprint,2026-07-11,,cs.AI,3.7849100942952942,large language model,,,,,,,,,http://arxiv.org/abs/2607.10159v1,https://arxiv.org/pdf/2607.10159v1,open,pdf/2026-07-15_01_UNIT_ Unleash Large Language Models Potential for Graph Continual Learning.pdf,downloaded
2,Knowledge Graphs Meet Graph Neural Networks: A Comprehensive Survey,Chengcheng Sun; Jiayun Tian; Cheng Zhai; Zhixiao Wang; Yajie Song; Xiaobin Rui; Jian Zhang; Philip S. Yu,"Graph Neural Networks (GNNs) have emerged as a powerful paradigm in Knowledge Graphs (KGs) due to their intrinsic ability to model graph-structured data. However, there remains a lack of a systematic review about GNN-based methodologies across the entire knowledge graph technologies pipeline. To address this gap, we first propose a novel two-level taxonomy framework for GNN-based knowledge graph technologies: the KG technologies pipeline and GNN-based perspective. Specifically, the knowledge graph technologies pipeline covers knowledge graph construction, knowledge graph embedding, knowledge reasoning and knowledge graph applications. Meanwhile, the GNN-based perspective provides a new categorization of knowledge graph technologies with GNN models, such as GCN, GAT, and HGNN. Then, we analyze the advantages of GNN technology based on the characteristics of different tasks in the knowledge graph lifecycle. Furthermore, we detailed review various GNN-based models for knowledge graph following the proposed taxonomy, and summarize strengths and limitations. Finally, we discuss unresolved challenges and outline promising directions for future research.","Graph Neural Networks (GNNs) have emerged as a powerful paradigm in Knowledge Graphs (KGs) due to their intrinsic ability to model graph-structured data. However, there remains a lack of a systematic review about GNN-based methodologies across the entire knowledge graph technologies pipeline. To address this gap, we first propose a novel two-level taxonomy framework for GNN-based knowledge graph technologies: the KG technologies pipeline and GNN-based perspective. Specifically, the knowledge graph technologies pipeline covers knowledge graph construction, knowledge graph embedding, knowledge reasoning and knowledge graph applications. Meanwhile, the GNN-based perspective provides a new categorization of knowledge graph technologies with GNN models, such as GCN, GAT, and HGNN. Then, we analyze the advantages of GNN technology based on the characteristics of different tasks in the knowledge graph lifecycle. Furthermore, we detailed review various GNN-based models for knowledge graph following the proposed taxonomy, and summarize strengths and limitations. Finally, we discuss unresolved challenges and outline promising directions for future research.",arxiv,preprint,,preprint,2026-05-12,10.1145/3814608,cs.LG; cs.AI; cs.SI,3.6979031166189102,knowledge graph,,,,,,,,,http://arxiv.org/abs/2607.09666v1,https://arxiv.org/pdf/2607.09666v1,open,pdf/2026-07-15_02_Knowledge Graphs Meet Graph Neural Networks_ A Comprehensive Survey.pdf,downloaded
3,Surprisingly Simple and Effective Multi-Domain Graph Foundation Model through Graph-to-Table Alignment,Chunyu Hu; Tianyin Liao; Ge Lan; Xingxuan Zhang; Jianxin Li; Peng Cui; Ziwei Zhang,"Graph Foundation Models (GFMs) have emerged as a promising paradigm for learning transferable representations across diverse graph domains. Recent advancements in GFMs have been largely dominated by two paradigms: Graph Neural Network and Large Language Model (LLM) based methods. However, these methods often face a fundamental dilemma between training with limited data and a heavy reliance on textual attributes. Tabular foundation models (TFMs) offer a potential alternative, as node features and representations can be naturally organized in a tabular form. However, how to enable TFMs to effectively capture structural information of graphs remains largely unexplored. The key challenge is to learn a graph-to-table alignment mechanism that enables graph structural understanding for TFMs. To address this, we propose GTAlign, a surprisingly simple yet effective Graph-to-Table Alignment framework for text-free Graph Foundation Model. Specifically, we first pretrain a graph encoder that maps diverse graphs into a unified latent space to capture domain-agnostic graph representations. To further bridge the gap between graph topology and the tabular representation space, we propose community-guided continual pre-training, where pseudo-labels derived from graph community are used to construct few-shot prediction episodes. Lastly, we adapt the graph encoder for an unseen target domain and perform in-context inference. Extensive experiments on five benchmark datasets demonstrate that GTAlign significantly outperforms state-of-the-art baselines on both node and graph classification, offering a simple, effective, and text-free GFM model. Code will be released upon acceptance.","Graph Foundation Models (GFMs) have emerged as a promising paradigm for learning transferable representations across diverse graph domains. Recent advancements in GFMs have been largely dominated by two paradigms: Graph Neural Network and Large Language Model (LLM) based methods. However, these methods often face a fundamental dilemma between training with limited data and a heavy reliance on textual attributes. Tabular foundation models (TFMs) offer a potential alternative, as node features and representations can be naturally organized in a tabular form. However, how to enable TFMs to effectively capture structural information of graphs remains largely unexplored. The key challenge is to learn a graph-to-table alignment mechanism that enables graph structural understanding for TFMs. To address this, we propose GTAlign, a surprisingly simple yet effective Graph-to-Table Alignment framework for text-free Graph Foundation Model. Specifically, we first pretrain a graph encoder that maps diverse graphs into a unified latent space to capture domain-agnostic graph representations. To further bridge the gap between graph topology and the tabular representation space, we propose community-guided continual pre-training, where pseudo-labels derived from graph community are used to construct few-shot prediction episodes. Lastly, we adapt the graph encoder for an unseen target domain and perform in-context inference. Extensive experiments on five benchmark datasets demonstrate that GTAlign significantly outperforms state-of-the-art baselines on both node and graph classification, offering a simple, effective, and text-free GFM model. Code will be released upon acceptance.",arxiv,preprint,,preprint,2026-07-13,,cs.LG,3.696376810066333,foundation model; large language model,,,,,,,,,http://arxiv.org/abs/2607.11374v1,https://arxiv.org/pdf/2607.11374v1,open,pdf/2026-07-15_03_Surprisingly Simple and Effective Multi-Domain Graph Foundation Model through Graph-to-Table Alignment.pdf,downloaded
4,Laguerre Geometry for Interpreting Large Language Models,Chunwei Ma; Russell Wolfinger,"Existing hypotheses represent a concept in an LLM as a single point, a linear direction, or a Gaussian cluster, yet it remains unclear how and why such structures emerge. Here, we show that concept geometry can be precisely characterized via Laguerre Geometry, in which a concept is defined as a region--a Laguerre-Voronoi cell or a union of cells--allowing us to strictly define, measure, and separate concepts. Building on this formulation, we show that finer-grained concept structures, such as inclusion and hierarchy, are naturally revealed by the Laguerre weights. We then push this geometry inside the transformer. Decomposing each layer into piecewise-linear operators, we show that a token's hidden trajectory is governed by two coupled mechanisms: a static tree of self-contained piecewise-linear flow, and a dynamic transport that hops the trajectory across trees when cross-token attention fires. This decomposition yields Geometric Lens, a training-free, hyperparameter-free method for reading out the exact concept a hidden vector encodes at any layer. We also develop Laguerre Autoencoder, a 2D visualizer that renders both the decision geometry and a model's full reasoning trajectory in one view. Finally, we move beyond explanatory geometry toward actionable interpretability, showing that Geometric Lens recovers the correct factual token when a model is prompted with in-context interference. The code is available on GitHub.","Existing hypotheses represent a concept in an LLM as a single point, a linear direction, or a Gaussian cluster, yet it remains unclear how and why such structures emerge. Here, we show that concept geometry can be precisely characterized via Laguerre Geometry, in which a concept is defined as a region--a Laguerre-Voronoi cell or a union of cells--allowing us to strictly define, measure, and separate concepts. Building on this formulation, we show that finer-grained concept structures, such as inclusion and hierarchy, are naturally revealed by the Laguerre weights. We then push this geometry inside the transformer. Decomposing each layer into piecewise-linear operators, we show that a token's hidden trajectory is governed by two coupled mechanisms: a static tree of self-contained piecewise-linear flow, and a dynamic transport that hops the trajectory across trees when cross-token attention fires. This decomposition yields Geometric Lens, a training-free, hyperparameter-free method for reading out the exact concept a hidden vector encodes at any layer. We also develop Laguerre Autoencoder, a 2D visualizer that renders both the decision geometry and a model's full reasoning trajectory in one view. Finally, we move beyond explanatory geometry toward actionable interpretability, showing that Geometric Lens recovers the correct factual token when a model is prompted with in-context interference. The code is available on GitHub.",arxiv,preprint,,preprint,2026-07-12,,cs.AI,3.448237280719762,large language model,,,,,,,,,http://arxiv.org/abs/2607.10578v1,https://arxiv.org/pdf/2607.10578v1,open,pdf/2026-07-15_04_Laguerre Geometry for Interpreting Large Language Models.pdf,downloaded
5,DAG-FM: A Foundation Model for Causal Discovery under Heterogeneous Causal Mechanisms,Yikang Chen; Zhengkang Guan; Haoyuan Qian; Peng Cui; Yi Yang; Kun Kuang,"Causal discovery from observational tabular data remains fundamentally challenging, primarily due to the heterogeneity of underlying causal mechanisms and the high-dimensional combinatorial search space of Directed Acyclic Graphs (DAGs). In this paper, we propose \textbf{DAG-FM}, a novel foundation model architecture that amortizes causal discovery. Unlike direct matrix prediction, DAG-FM decomposes the causal discovery process into two auto-regressive stages using two specialized Transformer-based sub-modules: a leaf-node predictor and a parent-node predictor. To effectively model complex row-column interactions, we adopt a robust tabular interaction block to output feature-wise representations. Crucially, to handle diverse and unknown Functional Causal Model (FCM) assumptions in real-world scenarios, we introduce Mixture-of-Leaf-Experts (MoLE), allowing the model to dynamically route and adapt to identifiable mechanism families. Through an iterative inference algorithm, DAG-FM seamlessly extracts causal orderings and constructs valid DAGs. Extensive experiments demonstrate that DAG-FM achieves state-of-the-art performance on both synthetic benchmarks and complex real-world datasets, significantly outperforming traditional classical algorithms and recent foundation models in both accuracy and scalability.","Causal discovery from observational tabular data remains fundamentally challenging, primarily due to the heterogeneity of underlying causal mechanisms and the high-dimensional combinatorial search space of Directed Acyclic Graphs (DAGs). In this paper, we propose \textbf{DAG-FM}, a novel foundation model architecture that amortizes causal discovery. Unlike direct matrix prediction, DAG-FM decomposes the causal discovery process into two auto-regressive stages using two specialized Transformer-based sub-modules: a leaf-node predictor and a parent-node predictor. To effectively model complex row-column interactions, we adopt a robust tabular interaction block to output feature-wise representations. Crucially, to handle diverse and unknown Functional Causal Model (FCM) assumptions in real-world scenarios, we introduce Mixture-of-Leaf-Experts (MoLE), allowing the model to dynamically route and adapt to identifiable mechanism families. Through an iterative inference algorithm, DAG-FM seamlessly extracts causal orderings and constructs valid DAGs. Extensive experiments demonstrate that DAG-FM achieves state-of-the-art performance on both synthetic benchmarks and complex real-world datasets, significantly outperforming traditional classical algorithms and recent foundation models in both accuracy and scalability.",arxiv,preprint,,preprint,2026-07-13,,cs.LG; stat.ML,3.3766475125444066,causal discovery; foundation model,,,,,,,,,http://arxiv.org/abs/2607.11510v1,https://arxiv.org/pdf/2607.11510v1,open,pdf/2026-07-15_05_DAG-FM_ A Foundation Model for Causal Discovery under Heterogeneous Causal Mechanisms.pdf,downloaded
6,CDFM: Towards a General-Purpose Causal Discovery Foundation Model,Jie Qiao; Ruichu Cai; Zijian Li; Weilin Chen; Pengfei Hua; Boyan Xu; Zhengming Chen; Zhifeng Hao; Peng Cui,"Causal discovery, the process of recovering underlying causal structures from observational data, is a fundamental pursuit across scientific disciplines. Over the past decades, numerous algorithms have been developed to tackle this challenge through workflows tailored to the specific causal mechanisms underlying each type of dataset, demonstrating effectiveness across a wide range of applications. However, as the volume and heterogeneity of real-world data continue to grow, this dataset-specific approach inevitably leads to a fragmented, test-driven paradigm that struggles to scale to the demands of modern scientific discovery. To address this, we formulate the Causal Discovery Foundation Model (CDFM) as a unified, general-purpose framework for zero-shot structural inference. To ensure reliable generalization across unknown domains, we first investigate the theoretical boundaries of causal identifiability, revealing the indispensable role of causal prior mechanisms in this process. Building on these insights, we formulate a principled variational framework that treats unknown causal mechanisms as latent variables and mathematically decomposes the intractable marginal likelihood into distinct, tractable learning modules. The variational decomposition provides a conceptual design principle for the architecture design of CDFM, while comprehensive causal knowledge guides the large-scale synthesis of our pretraining data. By pretraining on a massive, highly diverse space of synthetic structural causal models, CDFM successfully internalizes complex statistical asymmetries. Extensive experiments demonstrate that CDFM consistently outperforms traditional algorithms, driving a paradigm shift toward a general-purpose causal discovery foundation model.","Causal discovery, the process of recovering underlying causal structures from observational data, is a fundamental pursuit across scientific disciplines. Over the past decades, numerous algorithms have been developed to tackle this challenge through workflows tailored to the specific causal mechanisms underlying each type of dataset, demonstrating effectiveness across a wide range of applications. However, as the volume and heterogeneity of real-world data continue to grow, this dataset-specific approach inevitably leads to a fragmented, test-driven paradigm that struggles to scale to the demands of modern scientific discovery. To address this, we formulate the Causal Discovery Foundation Model (CDFM) as a unified, general-purpose framework for zero-shot structural inference. To ensure reliable generalization across unknown domains, we first investigate the theoretical boundaries of causal identifiability, revealing the indispensable role of causal prior mechanisms in this process. Building on these insights, we formulate a principled variational framework that treats unknown causal mechanisms as latent variables and mathematically decomposes the intractable marginal likelihood into distinct, tractable learning modules. The variational decomposition provides a conceptual design principle for the architecture design of CDFM, while comprehensive causal knowledge guides the large-scale synthesis of our pretraining data. By pretraining on a massive, highly diverse space of synthetic structural causal models, CDFM successfully internalizes complex statistical asymmetries. Extensive experiments demonstrate that CDFM consistently outperforms traditional algorithms, driving a paradigm shift toward a general-purpose causal discovery foundation model.",arxiv,preprint,,preprint,2026-07-13,,cs.LG; cs.AI; stat.ML,3.355923082112218,causal discovery; foundation model,,,,,,,,,http://arxiv.org/abs/2607.11508v1,https://arxiv.org/pdf/2607.11508v1,open,pdf/2026-07-15_06_CDFM_ Towards a General-Purpose Causal Discovery Foundation Model.pdf,downloaded
7,RAGU: A Multi-Step GraphRAG Engine with a Compact Domain-Adapted LLM,Mikhail Komarov; Ivan Bondarenko; Stanislav Shtuka; Oleg Sedukhin; Roman Shuvalov; Yana Dementyeva; Matvey Solovyov; Nikolay O. Nikitin,"Graph retrieval-augmented generation (GraphRAG) enhances large language models with structured knowledge, yet existing systems construct knowledge graphs in a single extraction pass, producing noisy entities and brittle retrieval. RAGU, an open-source modular GraphRAG engine, addresses this by separating extraction from consolidation: entities and relations pass through two-stage typed extraction, DBSCAN-backed deduplication, LLM summarization, and Leiden community detection. A key insight motivates a compact extractor: the skills an in-pipeline LLM needs - comprehension, extraction, reasoning over context - are language skills that grow only weakly with model size, unlike factual world knowledge. Accordingly, we train Meno-Lite-0.1, a 7B model optimized for language skills, which outperforms Qwen2.5-32B on knowledge-graph construction (+12.5% relative harmonic mean) and matches it on English GraphRAG tasks. On GraphRAG-Bench (Medical), RAGU retrieves the most complete context at every factoid level (evidence recall up to 0.84 vs. $\leq$0.76) and overtakes HippoRAG2 on synthesis tasks; on multi-hop factoid QA, the apparent HippoRAG2 advantage is shown to be largely an answer-format artifact. RAGU is installable via $\texttt{pip install graph_ragu}$, runs on a single GPU, and is released under MIT. The source code is publicly available at https://github.com/RaguTeam/RAGU, and the Meno-Lite-0.1 model can be obtained from https://huggingface.co/bond005/meno-lite-0.1.","Graph retrieval-augmented generation (GraphRAG) enhances large language models with structured knowledge, yet existing systems construct knowledge graphs in a single extraction pass, producing noisy entities and brittle retrieval. RAGU, an open-source modular GraphRAG engine, addresses this by separating extraction from consolidation: entities and relations pass through two-stage typed extraction, DBSCAN-backed deduplication, LLM summarization, and Leiden community detection. A key insight motivates a compact extractor: the skills an in-pipeline LLM needs - comprehension, extraction, reasoning over context - are language skills that grow only weakly with model size, unlike factual world knowledge. Accordingly, we train Meno-Lite-0.1, a 7B model optimized for language skills, which outperforms Qwen2.5-32B on knowledge-graph construction (+12.5% relative harmonic mean) and matches it on English GraphRAG tasks. On GraphRAG-Bench (Medical), RAGU retrieves the most complete context at every factoid level (evidence recall up to 0.84 vs. $\leq$0.76) and overtakes HippoRAG2 on synthesis tasks; on multi-hop factoid QA, the apparent HippoRAG2 advantage is shown to be largely an answer-format artifact. RAGU is installable via $\texttt{pip install graph_ragu}$, runs on a single GPU, and is released under MIT. The source code is publicly available at https://github.com/RaguTeam/RAGU, and the Meno-Lite-0.1 model can be obtained from https://huggingface.co/bond005/meno-lite-0.1.",arxiv,preprint,,preprint,2026-07-13,,cs.CL; cs.AI,3.339398101788878,knowledge graph; large language model,,,,,,,,,http://arxiv.org/abs/2607.11683v1,https://arxiv.org/pdf/2607.11683v1,open,pdf/2026-07-15_07_RAGU_ A Multi-Step GraphRAG Engine with a Compact Domain-Adapted LLM.pdf,downloaded
