index,title,authors,abstract,summary,source,venue_type,journal,publication_status,publication_date,doi,categories,score,matched_keywords,cited_by_count,article_url,pdf_url,open_access_status,local_pdf,pdf_download_status
8,GS-Quant: Granular Semantic and Generative Structural Quantization for Knowledge Graph Completion,Qizhuo Xie; Yunhui Liu; Yu Xing; Qianzi Hou; Xudong Jin; Tao Zheng; Tieke He,"Large Language Models (LLMs) have shown immense potential in Knowledge Graph Completion (KGC), yet bridging the modality gap between continuous graph embeddings and discrete LLM tokens remains a critical challenge. While recent quantization-based approaches attempt to align these modalities, they typically treat quantization as flat numerical compression, resulting in semantically entangled codes that fail to mirror the hierarchical nature of human reasoning. In this paper, we propose GS-Quant, a novel framework that generates semantically coherent and structurally stratified discrete codes for KG entities. Unlike prior methods, GS-Quant is grounded in the insight that entity representations should follow a linguistic coarse-to-fine logic. We introduce a Granular Semantic Enhancement module that injects hierarchical knowledge into the codebook, ensuring that earlier codes capture global semantic categories while later codes refine specific attributes. Furthermore, a Generative Structural Reconstruction module imposes causal dependencies on the code sequence, transforming independent discrete units into structured semantic descriptors. By expanding the LLM vocabulary with these learned codes, we enable the model to reason over graph structures isomorphically to natural language generation. Experimental results demonstrate that GS-Quant significantly outperforms existing text-based and embedding-based baselines.","Large Language Models (LLMs) have shown immense potential in Knowledge Graph Completion (KGC), yet bridging the modality gap between continuous graph embeddings and discrete LLM tokens remains a critical challenge. While recent quantization-based approaches attempt to align these modalities, they typically treat quantization as flat numerical compression, resulting in semantically entangled codes that fail to mirror the hierarchical nature of human reasoning. In this paper, we propose GS-Quant, a novel framework that generates semantically coherent and structurally stratified discrete codes for KG entities. Unlike prior methods, GS-Quant is grounded in the insight that entity representations should follow a linguistic coarse-to-fine logic. We introduce a Granular Semantic Enhancement module that injects hierarchical knowledge into the codebook, ensuring that earlier codes capture global semantic categories while later codes refine specific attributes. Furthermore, a Generative Structural Reconstruction module imposes causal dependencies on the code sequence, transforming independent discrete units into structured semantic descriptors. By expanding the LLM vocabulary with these learned codes, we enable the model to reason over graph structures isomorphically to natural language generation. Experimental results demonstrate that GS-Quant significantly outperforms existing text-based and embedding-based baselines.",acl_anthology,conference,ACL,formally_published,2026-01-01,,,3.3756248950947407,knowledge graph; large language model,,https://aclanthology.org/2026.acl-long.765/,https://aclanthology.org/2026.acl-long.765.pdf,open,pdf/2026-06-25_08_GS-Quant_ Granular Semantic and Generative Structural Quantization for Knowledge Graph Completion.pdf,downloaded
9,SP-Mind: An Autonomous Reasoning Agent for Spatial Proteomics Analysis,Yucheng Yuan; Yuanfeng Ji; Zhongxiao Li; Ruijiang Li,"Spatial proteomics enables single-cell-resolution characterization of protein expression within tissue architecture, playing a critical role in understanding tumor microenvironments and guiding precision medicine. However, current analysis workflows remain fragmented, requiring expert manual orchestration of heterogeneous tools and limiting research scalability and reproducibility. We present SP-Mind, the first autonomous AI agent designed to unify the spatial proteomics analysis pipeline, from raw multiplexed tissue imaging to downstream phenotype discovery. Equipped with expert-curated biological analysis skills and specialized computational tools, SP-Mind converts natural-language queries into end-to-end analytical workflows without task-specific fine-tuning. To rigorously evaluate its capabilities, we introduce SP-Bench, a comprehensive benchmark spanning diverse tissue types, comprising 102 tasks across 18 distinct categories. Through extensive evaluation on SP-Bench and established downstream tasks, SP-Mind achieves state-of-the-art performance compared to existing open-source biomedical agent baselines.","Spatial proteomics enables single-cell-resolution characterization of protein expression within tissue architecture, playing a critical role in understanding tumor microenvironments and guiding precision medicine. However, current analysis workflows remain fragmented, requiring expert manual orchestration of heterogeneous tools and limiting research scalability and reproducibility. We present SP-Mind, the first autonomous AI agent designed to unify the spatial proteomics analysis pipeline, from raw multiplexed tissue imaging to downstream phenotype discovery. Equipped with expert-curated biological analysis skills and specialized computational tools, SP-Mind converts natural-language queries into end-to-end analytical workflows without task-specific fine-tuning. To rigorously evaluate its capabilities, we introduce SP-Bench, a comprehensive benchmark spanning diverse tissue types, comprising 102 tasks across 18 distinct categories. Through extensive evaluation on SP-Bench and established downstream tasks, SP-Mind achieves state-of-the-art performance compared to existing open-source biomedical agent baselines.",arxiv,preprint,,preprint,2026-06-23,,cs.AI,3.3754242968676507,ai agent; benchmark; computational; reasoning agent; single-cell; single-cell-computation; spatial proteomics; spatial-omics-computation,,http://arxiv.org/abs/2606.24235v1,https://arxiv.org/pdf/2606.24235v1,open,pdf/2026-06-25_09_SP-Mind_ An Autonomous Reasoning Agent for Spatial Proteomics Analysis.pdf,downloaded
10,TRN-R1-Zero: Text-rich Network Reasoning via LLMs with Reinforcement Learning Only,Yilun Liu; Ruihong Qiu; Zi Huang,"Zero-shot reasoning on text-rich networks (TRNs) remains a challenging frontier, as models must integrate textual semantics with relational structure without task-specific supervision. While graph neural networks rely on fixed label spaces and supervised objectives, recent large language model (LLM)-based approaches often overlook graph context or depend on distillation from larger models, limiting generalisation. We propose TRN-R1-Zero, a post-training framework for TRN reasoning trained solely via reinforcement learning. TRN-R1-Zero directly optimises base LLMs using a Neighbour-aware Group Relative Policy Optimisation objective that dynamically adjusts rewards based on a novel margin gain metric for the informativeness of neighbouring signals, effectively guiding the model toward relational reasoning. Unlike prior methods, TRN-R1-Zero requires no supervised fine-tuning or chain-of-thought data generated from large reasoning models. Extensive experiments across citation, hyperlink, social and co-purchase TRN benchmarks demonstrate the superiority and robustness of TRN-R1-Zero. Beyond cross-domain transfer, TRN-R1-Zero, trained solely on node-level tasks, further generalises to edge- and graph-level tasks in a zero-shot manner. The codebase is open-source at [https://github.com/superallen13/TRN-R1-Zero](https://github.com/superallen13/TRN-R1-Zero).","Zero-shot reasoning on text-rich networks (TRNs) remains a challenging frontier, as models must integrate textual semantics with relational structure without task-specific supervision. While graph neural networks rely on fixed label spaces and supervised objectives, recent large language model (LLM)-based approaches often overlook graph context or depend on distillation from larger models, limiting generalisation. We propose TRN-R1-Zero, a post-training framework for TRN reasoning trained solely via reinforcement learning. TRN-R1-Zero directly optimises base LLMs using a Neighbour-aware Group Relative Policy Optimisation objective that dynamically adjusts rewards based on a novel margin gain metric for the informativeness of neighbouring signals, effectively guiding the model toward relational reasoning. Unlike prior methods, TRN-R1-Zero requires no supervised fine-tuning or chain-of-thought data generated from large reasoning models. Extensive experiments across citation, hyperlink, social and co-purchase TRN benchmarks demonstrate the superiority and robustness of TRN-R1-Zero. Beyond cross-domain transfer, TRN-R1-Zero, trained solely on node-level tasks, further generalises to edge- and graph-level tasks in a zero-shot manner. The codebase is open-source at [https://github.com/superallen13/TRN-R1-Zero](https://github.com/superallen13/TRN-R1-Zero).",acl_anthology,conference,ACL,formally_published,2026-01-01,,,3.3392618392549247,large language model,,https://aclanthology.org/2026.acl-long.823/,https://aclanthology.org/2026.acl-long.823.pdf,open,pdf/2026-06-25_10_TRN-R1-Zero_ Text-rich Network Reasoning via LLMs with Reinforcement Learning Only.pdf,downloaded
11,Thesis Proposal: On the Granularity-Robustness Trade-off in Text-Derived Knowledge Graphs,Surawat Pralomram,"Retrieval-augmented generation (RAG) based on dense embeddings has become a dominant paradigm for text retrieval. However, many real-world applications require attribute-specific querying, where explicit values or properties must be extracted from text (e.g., symptoms in clinical notes or dosage values in medical reports). Dense retrieval handles paraphrastic variation well but often entangles multiple attributes within a single embedding, making value extraction difficult. Knowledge graphs (KGs), in contrast, support explicit attribute access but are brittle under linguistic and structural variation, leading to low recall.This thesis proposal aims to investigate the representational trade-off underlying these approaches. We study knowledge graph representations from an information-theoretic and optimal coding perspective, focusing on the tension between fine-grained factorization and compact canonicalization of concepts. Building on this perspective, we propose a query-driven framework for constructing and retrieving knowledge graphs from text, aiming to combine the robustness of dense retrieval with the explicit queryability of symbolic representations.","Retrieval-augmented generation (RAG) based on dense embeddings has become a dominant paradigm for text retrieval. However, many real-world applications require attribute-specific querying, where explicit values or properties must be extracted from text (e.g., symptoms in clinical notes or dosage values in medical reports). Dense retrieval handles paraphrastic variation well but often entangles multiple attributes within a single embedding, making value extraction difficult. Knowledge graphs (KGs), in contrast, support explicit attribute access but are brittle under linguistic and structural variation, leading to low recall.This thesis proposal aims to investigate the representational trade-off underlying these approaches. We study knowledge graph representations from an information-theoretic and optimal coding perspective, focusing on the tension between fine-grained factorization and compact canonicalization of concepts. Building on this perspective, we propose a query-driven framework for constructing and retrieving knowledge graphs from text, aiming to combine the robustness of dense retrieval with the explicit queryability of symbolic representations.",acl_anthology,conference,ACL,formally_published,2026-01-01,,,3.331707142186515,knowledge graph,,https://aclanthology.org/2026.acl-srw.17/,https://aclanthology.org/2026.acl-srw.17.pdf,open,pdf/2026-06-25_11_Thesis Proposal_ On the Granularity-Robustness Trade-off in Text-Derived Knowledge Graphs.pdf,downloaded
12,TIDEST: post-imputation differential expression testing for spatial transcriptomics data,"Roeder, K.; Lei, J.; Testa, L.","Spatial transcriptomics enables the study of tissue organization in situ, but many high-resolution platforms measure only a limited gene panel, leaving much of the transcriptome unobserved. Although deep learning methods can reconstruct missing genes from matched single-cell references, downstream differential expression (DE) analysis remains unreliable because prediction uncertainty and spatially structured sources of variation are typically ignored. These factors can bias effect estimates and inflate false discoveries. We present TIDEST, a framework for DE testing after spatial transcriptomic imputation. TIDEST uses information from measured genes to correct systematic errors in reconstructed expression and adjusts for latent spatial variation, such as tissue architecture or cell type composition, that can create spurious differences between biological groups. Across extensive simulations, TIDEST maintains substantially better error control than existing approaches while preserving power. Applications to mouse brain, human glioblastoma, and human breast cancer data recover biologically meaningful DE signals that are missed or distorted by conventional analyses. TIDEST provides a principled framework for DE analysis on reconstructed spatial transcriptomes.","Spatial transcriptomics enables the study of tissue organization in situ, but many high-resolution platforms measure only a limited gene panel, leaving much of the transcriptome unobserved. Although deep learning methods can reconstruct missing genes from matched single-cell references, downstream differential expression (DE) analysis remains unreliable because prediction uncertainty and spatially structured sources of variation are typically ignored. These factors can bias effect estimates and inflate false discoveries. We present TIDEST, a framework for DE testing after spatial transcriptomic imputation. TIDEST uses information from measured genes to correct systematic errors in reconstructed expression and adjusts for latent spatial variation, such as tissue architecture or cell type composition, that can create spurious differences between biological groups. Across extensive simulations, TIDEST maintains substantially better error control than existing approaches while preserving power. Applications to mouse brain, human glioblastoma, and human breast cancer data recover biologically meaningful DE signals that are missed or distorted by conventional analyses. TIDEST provides a principled framework for DE analysis on reconstructed spatial transcriptomes.",biorxiv,preprint,biorxiv,preprint,2026-06-24,10.64898/2026.06.19.733432,genomics,3.3312842986644298,deep learning; framework; method; omics-simulation; simulation; single-cell; single-cell-computation; spatial transcriptomics; spatial-omics-computation,,https://www.biorxiv.org/content/10.64898/2026.06.19.733432v1.full.pdf,https://www.biorxiv.org/content/10.64898/2026.06.19.733432v1.full.pdf,open,,failed
13,GenDis: Generative-Discriminative Dual-View Co-Training for Generalized Category Discovery,Xi Chen; Chuan Qin; Jinpeng Li; Shasha Hu; Chao Wang; Hengshu Zhu; Hui Xiong,"Generalized Category Discovery (GCD) aims to identify both known and novel categories from partially labeled data, reflecting more realistic open-world learning scenarios. However, most existing methods rely solely on one-hot discriminative supervision, leading to overfitting on seen classes and poor generalization to unseen ones. Recent advances introduce large language models (LLMs) to incorporate external semantics, yet they often suffer from semantic–label misalignment and weak semantic integration during training. We propose GenDis, a Generative–Discriminative Dual-View Co-Training framework that unifies discriminative classification and semantic label generation within an LLM. Discriminative pseudo-labels guide the formation of a separable generative latent space, enabling semantically meaningful supervision for novel classes. To ensure consistency between the two views, we employ Canonical Correlation Analysis (CCA)-based alignment and a curriculum-guided, dispersion-aware pseudo-labeling strategy for iterative refinement. Extensive experiments on five GCD benchmarks demonstrate that GenDis substantially outperforms prior methods, validating the effectiveness of dual-view co-training with semantically enriched supervision. The anonymized repository is available at https://anonymous.4open.science/r/GenDis.","Generalized Category Discovery (GCD) aims to identify both known and novel categories from partially labeled data, reflecting more realistic open-world learning scenarios. However, most existing methods rely solely on one-hot discriminative supervision, leading to overfitting on seen classes and poor generalization to unseen ones. Recent advances introduce large language models (LLMs) to incorporate external semantics, yet they often suffer from semantic–label misalignment and weak semantic integration during training. We propose GenDis, a Generative–Discriminative Dual-View Co-Training framework that unifies discriminative classification and semantic label generation within an LLM. Discriminative pseudo-labels guide the formation of a separable generative latent space, enabling semantically meaningful supervision for novel classes. To ensure consistency between the two views, we employ Canonical Correlation Analysis (CCA)-based alignment and a curriculum-guided, dispersion-aware pseudo-labeling strategy for iterative refinement. Extensive experiments on five GCD benchmarks demonstrate that GenDis substantially outperforms prior methods, validating the effectiveness of dual-view co-training with semantically enriched supervision. The anonymized repository is available at https://anonymous.4open.science/r/GenDis.",acl_anthology,conference,ACL,formally_published,2026-01-01,,,3.329217159698463,large language model,,https://aclanthology.org/2026.acl-long.107/,https://aclanthology.org/2026.acl-long.107.pdf,open,pdf/2026-06-25_13_GenDis_ Generative-Discriminative Dual-View Co-Training for Generalized Category Discovery.pdf,downloaded
14,Defense Against Knowledge Poisoning Attack on GraphRAG,Havva Alizadeh Noughabi; Fattane Zarrinkalam; Ali Dehghantanha,"GraphRAG augments large language models with structured knowledge graphs, enabling graph-based context selection and a more integrated view of the knowledge space. However, recent work shows that GraphRAG exposes a new attack surface: corpus-level knowledge poisoning can inject spurious entities and relationships during graph construction, corrupting query-specific subgraphs and steering the generator toward incorrect answers. We propose Hop-wise Guard for GraphRAG (HoG-GRAG), a defense layer between retriever and generator that decomposes multi-hop questions into ordered subqueries, monitors hop-wise execution for poisoning-induced inconsistencies, and locally repairs the retrieved subgraph by pruning compromised entities and relationships and adding only minimal missing evidence. Experiments on multi-hop datasets and multiple GraphRAG configurations show that HoG-GRAG recovers a large fraction of the lost performance. The code is available at https://github.com/CyberScienceLab/HoG-GRAG.","GraphRAG augments large language models with structured knowledge graphs, enabling graph-based context selection and a more integrated view of the knowledge space. However, recent work shows that GraphRAG exposes a new attack surface: corpus-level knowledge poisoning can inject spurious entities and relationships during graph construction, corrupting query-specific subgraphs and steering the generator toward incorrect answers. We propose Hop-wise Guard for GraphRAG (HoG-GRAG), a defense layer between retriever and generator that decomposes multi-hop questions into ordered subqueries, monitors hop-wise execution for poisoning-induced inconsistencies, and locally repairs the retrieved subgraph by pruning compromised entities and relationships and adding only minimal missing evidence. Experiments on multi-hop datasets and multiple GraphRAG configurations show that HoG-GRAG recovers a large fraction of the lost performance. The code is available at https://github.com/CyberScienceLab/HoG-GRAG.",acl_anthology,conference,ACL,formally_published,2026-01-01,,,3.3291693093124533,knowledge graph; large language model,,https://aclanthology.org/2026.acl-short.47/,https://aclanthology.org/2026.acl-short.47.pdf,open,pdf/2026-06-25_14_Defense Against Knowledge Poisoning Attack on GraphRAG.pdf,downloaded
15,Collaboration of Fusion and Independence: Hypercomplex-driven Robust Multi-Modal Knowledge Graph Completion,Zhiqiang Liu; Yichi Zhang; Mengshu Sun; Lei Liang; Wen Zhang,"Multi-modal knowledge graph completion (MMKGC) aims to discover missing facts in multi-modal knowledge graphs (MMKGs) by leveraging both structural relationships and diverse modality information of entities. Existing MMKGC methods follow two multi-modal paradigms: fusion-based and ensemble-based. Fusion-based methods employ fixed fusion strategies, which inevitably leads to the loss of modality-specific information and a lack of flexibility to adapt to varying modality relevance across contexts. In contrast, ensemble-based methods retain modality independence through dedicated sub-models but struggle to capture the nuanced, context-dependent semantic interplay between modalities. To overcome these dual limitations, we propose a novel MMKGC method M-Hyper, which achieves the coexistence and collaboration of fused and independent modality representations. Our method integrates the strengths of both paradigms, enabling effective cross-modal interactions while maintaining modality-specific information. Inspired by “quaternion” algebra, we utilize its four orthogonal bases to represent multiple independent modalities and employ the Hamilton product to efficiently model pair-wise interactions among them. Specifically, we introduce a Fine-grained Entity Representation Factorization (FERF) module and a Robust Relation-aware Modality Fusion (R2MF) module to obtain robust representations for three independent modalities and one fused modality. The resulting four modality representations are then mapped to the four orthogonal bases of a biquaternion for comprehensive modality interaction. Extensive experiments indicate its state-of-the-art performance with better robustness.","Multi-modal knowledge graph completion (MMKGC) aims to discover missing facts in multi-modal knowledge graphs (MMKGs) by leveraging both structural relationships and diverse modality information of entities. Existing MMKGC methods follow two multi-modal paradigms: fusion-based and ensemble-based. Fusion-based methods employ fixed fusion strategies, which inevitably leads to the loss of modality-specific information and a lack of flexibility to adapt to varying modality relevance across contexts. In contrast, ensemble-based methods retain modality independence through dedicated sub-models but struggle to capture the nuanced, context-dependent semantic interplay between modalities. To overcome these dual limitations, we propose a novel MMKGC method M-Hyper, which achieves the coexistence and collaboration of fused and independent modality representations. Our method integrates the strengths of both paradigms, enabling effective cross-modal interactions while maintaining modality-specific information. Inspired by “quaternion” algebra, we utilize its four orthogonal bases to represent multiple independent modalities and employ the Hamilton product to efficiently model pair-wise interactions among them. Specifically, we introduce a Fine-grained Entity Representation Factorization (FERF) module and a Robust Relation-aware Modality Fusion (R2MF) module to obtain robust representations for three independent modalities and one fused modality. The resulting four modality representations are then mapped to the four orthogonal bases of a biquaternion for comprehensive modality interaction. Extensive experiments indicate its state-of-the-art performance with better robustness.",acl_anthology,conference,ACL,formally_published,2026-01-01,,,3.327319641005083,knowledge graph,,https://aclanthology.org/2026.acl-long.1289/,https://aclanthology.org/2026.acl-long.1289.pdf,open,pdf/2026-06-25_15_Collaboration of Fusion and Independence_ Hypercomplex-driven Robust Multi-Modal Knowledge Graph Completion.pdf,downloaded
