index,title,authors,abstract,summary,source,venue_type,journal,publication_status,publication_date,doi,categories,score,matched_keywords,cited_by_count,article_url,pdf_url,open_access_status,local_pdf,pdf_download_status
1,Learning Fair Graph Representations via Probability of Necessity and Sufficiency,Chuxun Liu; Qingfeng Chen; Debo Cheng; Jiangzhang Gan; Xiaoli Li; Lin Liu,"Graph Neural Networks (GNNs) excel at modeling graph data but often amplify biases tied to sensitive attributes like gender and race. Existing causality-based methods use isolated interventions on graph topology or features but struggle to produce representations that balance predictive power with fairness. This leads to two issues: (1) weak predictive power, where representations miss critical task-relevant features, and (2) bias amplification, where representations encode sensitive attributes, causing unfair outcomes. To address these issues, we introduce the Probability of Necessity and Sufficiency (PNS), where necessity ensures representations capture only essential features for predictions, and sufficiency guarantees these features are adequate without relying on sensitive attributes. We propose FairSNR, a fairness-aware graph representation learning framework that introduces constraints based on the PNS. This leverages PNS to guide the learning of fair representations from graph data. In particular, FairSNR employs an encoder to learn node representations with high PNS for downstream tasks. To compute and optimize PNS, FairSNR introduces an intervenor to generate the most challenging counterfactual interventions on the representations, thereby enhancing the model’s causal stability even under worst-case scenarios. Further, a discriminator is trained to detect and mitigate sensitive information leakage in the learned representations, effectively disentangling sensitive biases from task-relevant features. Experiments on real-world graph datasets demonstrate that FairSNR outperforms existing state-of-the-art (SOTA) methods in both fairness and utility.","Graph Neural Networks (GNNs) excel at modeling graph data but often amplify biases tied to sensitive attributes like gender and race. Existing causality-based methods use isolated interventions on graph topology or features but struggle to produce representations that balance predictive power with fairness. This leads to two issues: (1) weak predictive power, where representations miss critical task-relevant features, and (2) bias amplification, where representations encode sensitive attributes, causing unfair outcomes. To address these issues, we introduce the Probability of Necessity and Sufficiency (PNS), where necessity ensures representations capture only essential features for predictions, and sufficiency guarantees these features are adequate without relying on sensitive attributes. We propose FairSNR, a fairness-aware graph representation learning framework that introduces constraints based on the PNS. This leverages PNS to guide the learning of fair representations from graph data. In particular, FairSNR employs an encoder to learn node representations with high PNS for downstream tasks. To compute and optimize PNS, FairSNR introduces an intervenor to generate the most challenging counterfactual interventions on the representations, thereby enhancing the model’s causal stability even under worst-case scenarios. Further, a discriminator is trained to detect and mitigate sensitive information leakage in the learned representations, effectively disentangling sensitive biases from task-relevant features. Experiments on real-world graph datasets demonstrate that FairSNR outperforms existing state-of-the-art (SOTA) methods in both fairness and utility.",openalex,conference,Proceedings of the AAAI Conference on Artificial Intelligence,formally_published,2026-03-14,https://doi.org/10.1609/aaai.v40i28.39540,Advanced Graph Neural Networks; Ethics and Social Impacts of AI; Machine Learning in Healthcare,3.5277466018709767,graph representation learning,1,https://doi.org/10.1609/aaai.v40i28.39540,https://ojs.aaai.org/index.php/AAAI/article/download/39540/43501,diamond,,failed
2,An atlas-scale generative model for unified representation learning of bulk RNA-seq data,"Pande, A.; Uyar, B.; Akalin, A.","Public bulk RNA-seq repositories contain hundreds of thousands of samples, creating opportunities for large-scale representation learning, but integration across studies remains challenging because of heterogeneous annotations, experimental protocols, and technical variation. While pre-trained foundation models are now widely available for single-cell RNA-seq, comparable resources for bulk RNA-seq remain scarce, motivating a model that learns a unified, tissue-aware representation directly from bulk data. We trained a supervised variational autoencoder (VAE) on a compendium of 118,263 bulk RNA-seq samples that we assembled from TCGA, GTEx, and ARCHS4 and mapped to 42 tissue categories. The model classifies tissue of origin at 94.9% balanced accuracy (weighted F1 96.2%) and compresses 16,115 genes into a 121-dimensional latent space. Tissue identity is the primary organizing axis of the latent space, while source effects remain secondary. To assess the impact of data volume, we constructed training sets at three different scales (38K, 75K, and 118K samples). Our results demonstrated that reconstruction fidelity improved incrementally with each expansion of the dataset, but with diminishing returns. We validated the model on an independent cohort of 734 paediatric tumour samples from TARGET, achieving 84.6% agreement with the expected tissue of origin. The trained model and code are available at GitHub (https://github.com/BIMSBbioinfo/flexynesis_tissue_vae_manuscript) with an interactive web application.","Public bulk RNA-seq repositories contain hundreds of thousands of samples, creating opportunities for large-scale representation learning, but integration across studies remains challenging because of heterogeneous annotations, experimental protocols, and technical variation. While pre-trained foundation models are now widely available for single-cell RNA-seq, comparable resources for bulk RNA-seq remain scarce, motivating a model that learns a unified, tissue-aware representation directly from bulk data. We trained a supervised variational autoencoder (VAE) on a compendium of 118,263 bulk RNA-seq samples that we assembled from TCGA, GTEx, and ARCHS4 and mapped to 42 tissue categories. The model classifies tissue of origin at 94.9% balanced accuracy (weighted F1 96.2%) and compresses 16,115 genes into a 121-dimensional latent space. Tissue identity is the primary organizing axis of the latent space, while source effects remain secondary. To assess the impact of data volume, we constructed training sets at three different scales (38K, 75K, and 118K samples). Our results demonstrated that reconstruction fidelity improved incrementally with each expansion of the dataset, but with diminishing returns. We validated the model on an independent cohort of 734 paediatric tumour samples from TARGET, achieving 84.6% agreement with the expected tissue of origin. The trained model and code are available at GitHub (https://github.com/BIMSBbioinfo/flexynesis_tissue_vae_manuscript) with an interactive web application.",biorxiv,preprint,biorxiv,preprint,2026-06-24,10.64898/2026.06.18.733198,bioinformatics,3.5122729135106923,annotation; foundation model; generative model; integration; model; omics-simulation; representation learning; single-cell; single-cell-computation; variational autoencoder,,https://www.biorxiv.org/content/10.64898/2026.06.18.733198v1.full.pdf,https://www.biorxiv.org/content/10.64898/2026.06.18.733198v1.full.pdf,open,,failed
3,HiGoE: Hierarchical Graph of Evidence to Enhance Retrieval-Augmented Generation for Long-context Summarization,Long Yuan; Kaiwen Tian; Zi Chen; Bolong Zheng; Chuan Ma,"Long-context summarization is pivotal for extracting core insights from extensive documents. While Large Language Models (LLMs) show remarkable capabilities, they frequently encounter attention dilution and hallucination with lengthy inputs. Retrieval-Augmented Generation (RAG) partially mitigates this, but conventional RAG relies on shallow similarity retrieval of fragmented chunks, failing to capture high-level thematic structures and long-range dependencies. Although graph-based RAG approaches have emerged to address these structural limitations, existing solutions, such as Graph of Records (GoR), critically suffer from a fundamental flaw: they paradoxically re-introduce hallucinations by constructing graphs based on unreliable, LLM-generated responses. To overcome these challenges, we introduce Hierarchical Graph of Evidence (HiGoE) (Code link https://github.com/tkw123/HiGOE). HiGoE redefines the retrieval process by replacing unreliable chunk-based methods with a filtered proposition–evidence graph, ensuring verifiable fact grounding and substantially reducing hallucination. Moreover, HiGoE leverages Personalized PageRank (PPR) to cluster related nodes into thematic hierarchies, thereby restoring global document structure and effectively mitigating attention dilution. To model complex, multi-level relations beyond mere shallow similarity, we develop an Enhanced Graph Attention Network. Experiments show HiGoE consistently surpasses baselines in quality and efficiency.","Long-context summarization is pivotal for extracting core insights from extensive documents. While Large Language Models (LLMs) show remarkable capabilities, they frequently encounter attention dilution and hallucination with lengthy inputs. Retrieval-Augmented Generation (RAG) partially mitigates this, but conventional RAG relies on shallow similarity retrieval of fragmented chunks, failing to capture high-level thematic structures and long-range dependencies. Although graph-based RAG approaches have emerged to address these structural limitations, existing solutions, such as Graph of Records (GoR), critically suffer from a fundamental flaw: they paradoxically re-introduce hallucinations by constructing graphs based on unreliable, LLM-generated responses. To overcome these challenges, we introduce Hierarchical Graph of Evidence (HiGoE) (Code link https://github.com/tkw123/HiGOE). HiGoE redefines the retrieval process by replacing unreliable chunk-based methods with a filtered proposition–evidence graph, ensuring verifiable fact grounding and substantially reducing hallucination. Moreover, HiGoE leverages Personalized PageRank (PPR) to cluster related nodes into thematic hierarchies, thereby restoring global document structure and effectively mitigating attention dilution. To model complex, multi-level relations beyond mere shallow similarity, we develop an Enhanced Graph Attention Network. Experiments show HiGoE consistently surpasses baselines in quality and efficiency.",acl_anthology,conference,ACL,formally_published,2026-01-01,,,3.4096606533862603,large language model,,https://aclanthology.org/2026.acl-long.902/,https://aclanthology.org/2026.acl-long.902.pdf,open,pdf/2026-06-25_03_HiGoE_ Hierarchical Graph of Evidence to Enhance Retrieval-Augmented Generation for Long-context Summarization.pdf,downloaded
4,Sparse Feature Coactivation Reveals Causal Semantic Modules in Large Language Models,Ruixuan Deng; Xiaoyang Hu; Miles Gilberti; Shane Storks; Aman Taxali; Mike Angstadt; Chandra Sripada; Joyce Chai,"We identify semantically coherent, context-consistent network components in large language models (LLMs) using coactivation of sparse autoencoder (SAE) features collected from just a handful of prompts. Focusing on concept-relation prediction tasks, we show that ablating these components for concepts (e.g., countries and words) and relations (e.g., capital city and translation language) changes model outputs in predictable ways, while amplifying these components induces counterfactual responses. Notably, composing relation and concept components yields compound counterfactual outputs. Further analysis reveals that while most concept components emerge from the very first layer, more abstract relation components are concentrated in later layers. Lastly, we show that extracted components more comprehensively capture concepts and relations than individual features while maintaining specificity. Overall, our findings suggest a modular organization of knowledge and advance methods for efficient, targeted LLM manipulation.","We identify semantically coherent, context-consistent network components in large language models (LLMs) using coactivation of sparse autoencoder (SAE) features collected from just a handful of prompts. Focusing on concept-relation prediction tasks, we show that ablating these components for concepts (e.g., countries and words) and relations (e.g., capital city and translation language) changes model outputs in predictable ways, while amplifying these components induces counterfactual responses. Notably, composing relation and concept components yields compound counterfactual outputs. Further analysis reveals that while most concept components emerge from the very first layer, more abstract relation components are concentrated in later layers. Lastly, we show that extracted components more comprehensively capture concepts and relations than individual features while maintaining specificity. Overall, our findings suggest a modular organization of knowledge and advance methods for efficient, targeted LLM manipulation.",acl_anthology,conference,ACL,formally_published,2026-01-01,,,3.4051456612006814,large language model,,https://aclanthology.org/2026.acl-long.155/,https://aclanthology.org/2026.acl-long.155.pdf,open,pdf/2026-06-25_04_Sparse Feature Coactivation Reveals Causal Semantic Modules in Large Language Models.pdf,downloaded
5,Autonomous Knowledge Graph Exploration with Adaptive Breadth-Depth Retrieval,Joaquin Polonuer; Lucas Vittor; Iñaki Arango; Ayush Noori; David A. Clifton; Luciano Del Corro; Marinka Zitnik,"Retrieving evidence for language model queries from knowledge graphs requires balancing broad search across the graph with multi-hop traversal to follow relational links. Similarity-based retrievers provide coverage but remain shallow, whereas traversal-based methods rely on selecting seed nodes to start exploration, which can fail when queries span multiple entities and relations. We introduce ARK: Adaptive Retriever of Knowledge, a tool-using KG retriever that gives a language model control over this breadth-depth tradeoff using a two-operation toolset: global lexical search over node descriptors and one-hop neighborhood exploration that composes into multi-hop traversal. ARK alternates between breadth-oriented discovery and depth-oriented expansion without depending on a fragile seed selection, a pre-set hop depth, or requiring retrieval training. ARK adapts tool use to queries, using global search for language-heavy queries and neighborhood exploration for relation-heavy queries.On STaRK, ARK reaches 59.1% average Hit@1 and 67.4 average MRR, improving average Hit@1 by up to 31.4% and average MRR by up to 28.0% over retrieval-based and agent-based training-free methods.Finally, we distill ARK’s tool-use trajectories from a large teacher into an 8B model via label-free imitation, improving Hit@1 by +7.0, +26.6, and +13.5 absolute points over the base 8B model on AMAZON, MAG, and PRIME datasets, respectively, while retaining up to 98.5% of the teacher’s Hit@1 rate.","Retrieving evidence for language model queries from knowledge graphs requires balancing broad search across the graph with multi-hop traversal to follow relational links. Similarity-based retrievers provide coverage but remain shallow, whereas traversal-based methods rely on selecting seed nodes to start exploration, which can fail when queries span multiple entities and relations. We introduce ARK: Adaptive Retriever of Knowledge, a tool-using KG retriever that gives a language model control over this breadth-depth tradeoff using a two-operation toolset: global lexical search over node descriptors and one-hop neighborhood exploration that composes into multi-hop traversal. ARK alternates between breadth-oriented discovery and depth-oriented expansion without depending on a fragile seed selection, a pre-set hop depth, or requiring retrieval training. ARK adapts tool use to queries, using global search for language-heavy queries and neighborhood exploration for relation-heavy queries.On STaRK, ARK reaches 59.1% average Hit@1 and 67.4 average MRR, improving average Hit@1 by up to 31.4% and average MRR by up to 28.0% over retrieval-based and agent-based training-free methods.Finally, we distill ARK’s tool-use trajectories from a large teacher into an 8B model via label-free imitation, improving Hit@1 by +7.0, +26.6, and +13.5 absolute points over the base 8B model on AMAZON, MAG, and PRIME datasets, respectively, while retaining up to 98.5% of the teacher’s Hit@1 rate.",acl_anthology,conference,ACL,formally_published,2026-01-01,,,3.3915181799005234,knowledge graph,,https://aclanthology.org/2026.acl-long.714/,https://aclanthology.org/2026.acl-long.714.pdf,open,pdf/2026-06-25_05_Autonomous Knowledge Graph Exploration with Adaptive Breadth-Depth Retrieval.pdf,downloaded
6,CAPruner: Conceptual-Adjacent Scene Graph Pruner for Enhancing 3D Spatial Reasoning of Large Language Models,Shengli Zhou; Xiangchen Wang; Guanhua Chen; Feng Zheng,"Large language models (LLMs) have recently been applied to 3D vision-language (3D-VL) tasks, which require spatial reasoning to identify target objects relative to anchors. Scene graphs are commonly employed to represent such relations, but reasoning over complete graphs incurs high token costs and computational inefficiencies, motivating the need for pruning. Existing pruning methods primarily rely on spatial proximity and often remove task-relevant relations, thereby undermining reliable spatial reasoning. To address these limitations, we derive a key requirement for scene graph pruning: preserving spatial relations that are most pertinent to the specific 3D-VL task. Guided by this insight, we propose the Conceptual-Adjacent Scene Graph Pruner (CAPruner). CAPruner integrates fuzzy semantic relevance with spatial proximity to estimate the importance of relations, enabling the selection of critical relations in a task-specific context. Moreover, to avoid costly relation-level annotations, CAPruner is trained by supervising the aggregated scores of each node’s incident edges. Extensive experiments demonstrate that CAPruner effectively preserves relations essential for spatial reasoning, leading to substantial performance improvements of LLMs on 3D-VL tasks. Code is available at https://github.com/fz-zsl/CAPruner.","Large language models (LLMs) have recently been applied to 3D vision-language (3D-VL) tasks, which require spatial reasoning to identify target objects relative to anchors. Scene graphs are commonly employed to represent such relations, but reasoning over complete graphs incurs high token costs and computational inefficiencies, motivating the need for pruning. Existing pruning methods primarily rely on spatial proximity and often remove task-relevant relations, thereby undermining reliable spatial reasoning. To address these limitations, we derive a key requirement for scene graph pruning: preserving spatial relations that are most pertinent to the specific 3D-VL task. Guided by this insight, we propose the Conceptual-Adjacent Scene Graph Pruner (CAPruner). CAPruner integrates fuzzy semantic relevance with spatial proximity to estimate the importance of relations, enabling the selection of critical relations in a task-specific context. Moreover, to avoid costly relation-level annotations, CAPruner is trained by supervising the aggregated scores of each node’s incident edges. Extensive experiments demonstrate that CAPruner effectively preserves relations essential for spatial reasoning, leading to substantial performance improvements of LLMs on 3D-VL tasks. Code is available at https://github.com/fz-zsl/CAPruner.",acl_anthology,conference,ACL,formally_published,2026-01-01,,,3.3911375587744432,large language model,,https://aclanthology.org/2026.acl-long.23/,https://aclanthology.org/2026.acl-long.23.pdf,open,pdf/2026-06-25_06_CAPruner_ Conceptual-Adjacent Scene Graph Pruner for Enhancing 3D Spatial Reasoning of Large Language Models.pdf,downloaded
7,"Revealing the Seen, Imagining the Beyond: A Survey of Image-Grounded Chain-of-Thought Reasoning in Multimodal LLMs",Qihua Dong; Yitian Zhang; Huimin Zeng; Yizhou Wang; Jianglin Lu; Kuo Yang; Yun Fu,"Multimodal large language models (MLLMs) are making rapid strides in complex visual reasoning. This survey synthesizes the emerging paradigm of Image-Grounded Chain-of-Thought (IG-CoT), where models ground intermediate inferences by interleaving textual rationales with visual state updates. We formalize IG-CoT, present a method-centric taxonomy covering prompting, supervised fine-tuning, and reinforcement learning, and map these techniques to representative benchmarks. Our analysis identifies two domains where IG-CoT offers significant advantages: detail-oriented reasoning requiring meticulous perception, and imagined-world reasoning for simulating unseen states in games, geometry, and planning. We discuss the practical trade-offs of current methods regarding controllability, data, and compute. We conclude by highlighting key challenges (efficiency, data quality, and generative capabilities) and outlining promising future directions, including lightweight architectures, richer intermediate supervision, and method-aware evaluations that better assess faithfulness and long-horizon reasoning. We maintain a continuously updated paper list at https://github.com/dddraxxx/Awesome-Image-Grounded-CoT.","Multimodal large language models (MLLMs) are making rapid strides in complex visual reasoning. This survey synthesizes the emerging paradigm of Image-Grounded Chain-of-Thought (IG-CoT), where models ground intermediate inferences by interleaving textual rationales with visual state updates. We formalize IG-CoT, present a method-centric taxonomy covering prompting, supervised fine-tuning, and reinforcement learning, and map these techniques to representative benchmarks. Our analysis identifies two domains where IG-CoT offers significant advantages: detail-oriented reasoning requiring meticulous perception, and imagined-world reasoning for simulating unseen states in games, geometry, and planning. We discuss the practical trade-offs of current methods regarding controllability, data, and compute. We conclude by highlighting key challenges (efficiency, data quality, and generative capabilities) and outlining promising future directions, including lightweight architectures, richer intermediate supervision, and method-aware evaluations that better assess faithfulness and long-horizon reasoning. We maintain a continuously updated paper list at https://github.com/dddraxxx/Awesome-Image-Grounded-CoT.",acl_anthology,conference,ACL,formally_published,2026-01-01,,,3.377750355481294,large language model; multimodal large language model,,https://aclanthology.org/2026.acl-long.2087/,https://aclanthology.org/2026.acl-long.2087.pdf,open,"pdf/2026-06-25_07_Revealing the Seen, Imagining the Beyond_ A Survey of Image-Grounded Chain-of-Thought Reasoning in Multimodal LLMs.pdf",downloaded
