index,title,authors,abstract,summary,source,venue_type,journal,publication_status,publication_date,doi,categories,score,matched_keywords,cited_by_count,article_url,pdf_url,open_access_status,local_pdf,pdf_download_status
16,Compressing then Matching: An Efficient Pre-training Paradigm for Multimodal Embedding,Da Li; Yuxiao Luo; Keping Bi; Jiafeng Guo; Wei Yuan; Biao Yang; Yan Wang; Fan Yang; Tingting Gao; Guorui Zhou,"Multimodal Large Language Models advance multimodal representation learning by acquiring transferable semantic embeddings, thereby substantially enhancing performance across a range of vision-language tasks, including cross-modal retrieval, clustering, and classification. An effective embedding is expected to comprehensively preserve the semantic content of the input while simultaneously emphasizing features that are discriminative for downstream tasks. Recent approaches demonstrate that MLLMs can be adapted into competitive embedding models via large-scale contrastive learning, enabling the simultaneous optimization of two complementary objectives. We argue that the two aforementioned objectives can be decoupled: a comprehensive understanding of the input enables the embedding model to achieve superior performance on downstream tasks via contrastive learning. In this paper, we propose CoMa, a compressed pre-training phase, which serves as a warm-up stage for contrastive learning. Experiments demonstrate that with only a small amount of pre-training data, we can transform an MLLM into a competitive embedding model. CoMa achieves new state-of-the-art results among MLLMs of comparable size on the MMEB, realizing optimization in both efficiency and effectiveness. Our project is available at https://github.com/Trustworthy-Information-Access/CoMa.","Multimodal Large Language Models advance multimodal representation learning by acquiring transferable semantic embeddings, thereby substantially enhancing performance across a range of vision-language tasks, including cross-modal retrieval, clustering, and classification. An effective embedding is expected to comprehensively preserve the semantic content of the input while simultaneously emphasizing features that are discriminative for downstream tasks. Recent approaches demonstrate that MLLMs can be adapted into competitive embedding models via large-scale contrastive learning, enabling the simultaneous optimization of two complementary objectives. We argue that the two aforementioned objectives can be decoupled: a comprehensive understanding of the input enables the embedding model to achieve superior performance on downstream tasks via contrastive learning. In this paper, we propose CoMa, a compressed pre-training phase, which serves as a warm-up stage for contrastive learning. Experiments demonstrate that with only a small amount of pre-training data, we can transform an MLLM into a competitive embedding model. CoMa achieves new state-of-the-art results among MLLMs of comparable size on the MMEB, realizing optimization in both efficiency and effectiveness. Our project is available at https://github.com/Trustworthy-Information-Access/CoMa.",acl_anthology,conference,ACL,formally_published,2026-01-01,,,3.3207900529276024,large language model; multimodal large language model,,https://aclanthology.org/2026.acl-long.169/,https://aclanthology.org/2026.acl-long.169.pdf,open,pdf/2026-06-25_16_Compressing then Matching_ An Efficient Pre-training Paradigm for Multimodal Embedding.pdf,downloaded
17,KG-ViP: Bridging Knowledge Grounding and Visual Perception in Multi-modal LLMs for Visual Question Answering,Zhiyang Li; Ao Ke; Yukun Cao; Xike Xie,"Multi-modal Large Language Models (MLLMs) for Visual Question Answering (VQA) often suffer from dual limitations: knowledge hallucination and insufficient fine-grained visual perception. Crucially, we identify that commonsense graphs and scene graphs provide precisely complementary solutions to these respective deficiencies by providing rich external knowledge and capturing fine-grained visual details. However, prior works typically treat them in isolation, overlooking their synergistic potential. To bridge this gap, we propose KG-ViP, a unified framework that empowers MLLMs by fusing scene graphs and commonsense graphs. The core of the KG-ViP framework is a novel retrieval-and-fusion pipeline that utilizes the query as a semantic bridge to progressively integrate both graphs, synthesizing a unified structured context that facilitates reliable multi-modal reasoning. Extensive experiments on FVQA 2.0+ and MVQA benchmarks demonstrate that KG-ViP significantly outperforms existing VQA methods.","Multi-modal Large Language Models (MLLMs) for Visual Question Answering (VQA) often suffer from dual limitations: knowledge hallucination and insufficient fine-grained visual perception. Crucially, we identify that commonsense graphs and scene graphs provide precisely complementary solutions to these respective deficiencies by providing rich external knowledge and capturing fine-grained visual details. However, prior works typically treat them in isolation, overlooking their synergistic potential. To bridge this gap, we propose KG-ViP, a unified framework that empowers MLLMs by fusing scene graphs and commonsense graphs. The core of the KG-ViP framework is a novel retrieval-and-fusion pipeline that utilizes the query as a semantic bridge to progressively integrate both graphs, synthesizing a unified structured context that facilitates reliable multi-modal reasoning. Extensive experiments on FVQA 2.0+ and MVQA benchmarks demonstrate that KG-ViP significantly outperforms existing VQA methods.",acl_anthology,conference,ACL,formally_published,2026-01-01,,,3.3108619227436358,large language model,,https://aclanthology.org/2026.acl-long.1622/,https://aclanthology.org/2026.acl-long.1622.pdf,open,pdf/2026-06-25_17_KG-ViP_ Bridging Knowledge Grounding and Visual Perception in Multi-modal LLMs for Visual Question Answering.pdf,downloaded
18,AutoSchemaKG: Autonomous Knowledge Graph Construction through Dynamic Schema Induction from Web-Scale Corpora,Jiaxin Bai; Wei Fan; Qi Hu; Qing Zong; Chunyang Li; Hong Ting Tsang; Hongyu Luo; Yauwai Yim; Haoyu Huang; Xiao Zhou; Feng Qin; Tianshi Zheng; Xi Peng; Xin Yao; Huiwen Yang; Leijie Wu; JI Yi; Gong Zhang; Renhai Chen; Yangqiu Song,"We present AutoSchemaKG, a framework for fully autonomous knowledge graph construction that eliminates the need for predefined schemas. Our system leverages large language models to simultaneously extract knowledge triples and induce comprehensive schemas directly from text, modeling both entities and events while employing conceptualization to organize instances into semantic categories. Processing over 50 million documents, we construct ATLAS (Automated Triple Linking And Schema induction), a family of knowledge graphs with 900+ million nodes and 5.9 billion edges. This approach outperforms state-of-the-art baselines on multi-hop QA tasks and enhances LLM factuality. Notably, our schema induction achieves 92% semantic alignment with human-crafted schemas with zero manual intervention, demonstrating that billion-scale knowledge graphs with dynamically induced schemas can effectively complement parametric knowledge in large language models.","We present AutoSchemaKG, a framework for fully autonomous knowledge graph construction that eliminates the need for predefined schemas. Our system leverages large language models to simultaneously extract knowledge triples and induce comprehensive schemas directly from text, modeling both entities and events while employing conceptualization to organize instances into semantic categories. Processing over 50 million documents, we construct ATLAS (Automated Triple Linking And Schema induction), a family of knowledge graphs with 900+ million nodes and 5.9 billion edges. This approach outperforms state-of-the-art baselines on multi-hop QA tasks and enhances LLM factuality. Notably, our schema induction achieves 92% semantic alignment with human-crafted schemas with zero manual intervention, demonstrating that billion-scale knowledge graphs with dynamically induced schemas can effectively complement parametric knowledge in large language models.",acl_anthology,conference,ACL,formally_published,2026-01-01,,,3.3048636558995,knowledge graph; large language model,,https://aclanthology.org/2026.acl-long.942/,https://aclanthology.org/2026.acl-long.942.pdf,open,pdf/2026-06-25_18_AutoSchemaKG_ Autonomous Knowledge Graph Construction through Dynamic Schema Induction from Web-Scale Corpora.pdf,downloaded
19,Graph-Based Alternatives to LLMs for Human Simulation,Joseph Suh; Suhong Moon; Serina Chang,"Large language models (LLMs) have become a popular approach for simulating human behaviors, yet it remains unclear if LLMs are necessary for all simulation tasks. We study a broad family of close-ended simulation tasks, with applications from survey prediction to test-taking, and show that a graph neural network can match or surpass strong LLM-based methods. We introduce Graph-basEd Models for Human Simulation (GEMS) which formulates close-ended simulation as link prediction on a heterogeneous graph of individuals and choices. Across three datasets and three evaluation settings, GEMS matches or outperforms the strongest LLM-based methods while using three orders of magnitude fewer parameters. These results suggest that graph-based modeling can complement LLMs as an efficient and transparent approach to simulating human behaviors. Code is available at https://github.com/schang-lab/gems.","Large language models (LLMs) have become a popular approach for simulating human behaviors, yet it remains unclear if LLMs are necessary for all simulation tasks. We study a broad family of close-ended simulation tasks, with applications from survey prediction to test-taking, and show that a graph neural network can match or surpass strong LLM-based methods. We introduce Graph-basEd Models for Human Simulation (GEMS) which formulates close-ended simulation as link prediction on a heterogeneous graph of individuals and choices. Across three datasets and three evaluation settings, GEMS matches or outperforms the strongest LLM-based methods while using three orders of magnitude fewer parameters. These results suggest that graph-based modeling can complement LLMs as an efficient and transparent approach to simulating human behaviors. Code is available at https://github.com/schang-lab/gems.",acl_anthology,conference,ACL,formally_published,2026-01-01,,,3.3022760698024642,large language model,,https://aclanthology.org/2026.acl-long.2157/,https://aclanthology.org/2026.acl-long.2157.pdf,open,pdf/2026-06-25_19_Graph-Based Alternatives to LLMs for Human Simulation.pdf,downloaded
20,Semantic Span Annotation: An Exploratory Study of LLM Annotation,Tejas Goyal; Dhriti Krishnan; Anuj Gupta; Jaromir Savelka,"Structured span extraction research is siloed by context length, annotation task, and domain, making it difficult to assess how well large language models (LLMs) generalize across realistic extraction settings. We introduce SSA (Structured Span Annotation), a unified evaluation framework bringing together five datasets across four domains: finance, biomedicine, affective analysis, and privacy, under a common JSONL format with character-level offsets. We conduct an exploratory study evaluating seven models (three closed, four open-weight) under three prompting configurations: zero-shot, definition-augmented, and few-shot, formulating extraction as inline XML generation where models reproduce the document with tagged spans. Our results reveal two distinct performance regimes: on tasks requiring complex ontology reasoning, zero-shot performance is near zero (e.g., 0.00% F1 on FiNER-139) but improves substantially with label definitions (e.g., Claude Opus 4.6 rises from 8.8% to 57.5% F1); on pattern-based tasks like PII detection, definitions consistently hurt performance across all models. These findings suggest that prompting strategy must be matched to task structure, and that unified evaluation frameworks spanning varied domains and input lengths are essential for understanding LLM extraction capabilities.","Structured span extraction research is siloed by context length, annotation task, and domain, making it difficult to assess how well large language models (LLMs) generalize across realistic extraction settings. We introduce SSA (Structured Span Annotation), a unified evaluation framework bringing together five datasets across four domains: finance, biomedicine, affective analysis, and privacy, under a common JSONL format with character-level offsets. We conduct an exploratory study evaluating seven models (three closed, four open-weight) under three prompting configurations: zero-shot, definition-augmented, and few-shot, formulating extraction as inline XML generation where models reproduce the document with tagged spans. Our results reveal two distinct performance regimes: on tasks requiring complex ontology reasoning, zero-shot performance is near zero (e.g., 0.00% F1 on FiNER-139) but improves substantially with label definitions (e.g., Claude Opus 4.6 rises from 8.8% to 57.5% F1); on pattern-based tasks like PII detection, definitions consistently hurt performance across all models. These findings suggest that prompting strategy must be matched to task structure, and that unified evaluation frameworks spanning varied domains and input lengths are essential for understanding LLM extraction capabilities.",acl_anthology,conference,ACL,formally_published,2026-01-01,,,3.2978119355081748,large language model,,https://aclanthology.org/2026.acl-srw.39/,https://aclanthology.org/2026.acl-srw.39.pdf,open,pdf/2026-06-25_20_Semantic Span Annotation_ An Exploratory Study of LLM Annotation.pdf,downloaded
21,Rethinking Data Mixing from the Perspective of Large Language Models,Yuanjian Xu; Tianze Sun; Changwei Xu; XinLong Zhao; Jianing Hao; Ran Chen; Yang Liu; Ruijie Xu; Stephen Chen; Guang Zhang,"Data mixing strategy is essential for large language model (LLM) training. Empirical evidence shows that inappropriate strategies can significantly reduce generalization. Although recent methods have improved empirical performance, several fundamental questions remain open: what constitutes a domain, whether human and model perceptions of domains are aligned, and how domain weighting influences generalization. We address these questions by establishing formal connections between gradient dynamics and domain distributions, offering a theoretical framework that clarifies the role of domains in training dynamics. Building on this analysis, we introduce DoGraph, a reweighting framework that formulates data scheduling as a graph-constrained optimization problem. Extensive experiments on GPT-2 models of varying scales demonstrate that DoGraph consistently achieves competitive performance.","Data mixing strategy is essential for large language model (LLM) training. Empirical evidence shows that inappropriate strategies can significantly reduce generalization. Although recent methods have improved empirical performance, several fundamental questions remain open: what constitutes a domain, whether human and model perceptions of domains are aligned, and how domain weighting influences generalization. We address these questions by establishing formal connections between gradient dynamics and domain distributions, offering a theoretical framework that clarifies the role of domains in training dynamics. Building on this analysis, we introduce DoGraph, a reweighting framework that formulates data scheduling as a graph-constrained optimization problem. Extensive experiments on GPT-2 models of varying scales demonstrate that DoGraph consistently achieves competitive performance.",acl_anthology,conference,ACL,formally_published,2026-01-01,,,3.28982037314679,large language model,,https://aclanthology.org/2026.acl-short.28/,https://aclanthology.org/2026.acl-short.28.pdf,open,pdf/2026-06-25_21_Rethinking Data Mixing from the Perspective of Large Language Models.pdf,downloaded
22,GraphSynth: Resolving the Diversity-Reliability Trade-off with Probabilistic Factor Graphs,Zehua Cheng; Wei Dai; Jiahao Sun; Thomas Lukasiewicz,"The large language models offer a scaleable solution for the generation of synthetic data faced with a trade-off between maintaining the diversity of generation and achieving factually accurate results. This paper introduces Graphsynth, a framework which leverages a probabilistic factor graph modeling the universe of attributes. The framework leverages a high-level schema mapping compiled into efficient hard masks during the decoding phase for maintaining the syntactic truth and a span-synchronized verifier for dismissing logical contradictions at the decode time. The experiments conducted on biomedical, legal, and generic domains show that the method outperforms the state-of-the-art baselines with a structural integrity approaching perfection, a coverage of around 94% attributes on the factor graph solution, and a boost in performance on downstream tasks such as +17.9% on TruthfulQA.","The large language models offer a scaleable solution for the generation of synthetic data faced with a trade-off between maintaining the diversity of generation and achieving factually accurate results. This paper introduces Graphsynth, a framework which leverages a probabilistic factor graph modeling the universe of attributes. The framework leverages a high-level schema mapping compiled into efficient hard masks during the decoding phase for maintaining the syntactic truth and a span-synchronized verifier for dismissing logical contradictions at the decode time. The experiments conducted on biomedical, legal, and generic domains show that the method outperforms the state-of-the-art baselines with a structural integrity approaching perfection, a coverage of around 94% attributes on the factor graph solution, and a boost in performance on downstream tasks such as +17.9% on TruthfulQA.",acl_anthology,conference,ACL,formally_published,2026-01-01,,,3.284461806167005,large language model,,https://aclanthology.org/2026.acl-long.1969/,https://aclanthology.org/2026.acl-long.1969.pdf,open,pdf/2026-06-25_22_GraphSynth_ Resolving the Diversity-Reliability Trade-off with Probabilistic Factor Graphs.pdf,downloaded
23,"Factual Retrieval in LLMs Is a Redundant, Distributed and Non-Contiguous Process",Hail Hochman; Natalie Shapira; Yoav Goldberg,"Large language models (LLMs) store and recall factual knowledge, yet the precise mechanism of how entity representations are transformed to enable specific attribute retrieval remains underexplored. In this work, we investigate this mechanism through the lens of an “attribute-computation path”—a sequence of computational steps over the entity representation required to elicit a target attribute. We then propose an iterative patching protocol to identify a minimal subset of layers necessary for this computation. Applying our method to LLaMA 3.1 8B and Qwen 3 8B, we find that these paths are non-contiguous, often skipping layers, and that models possess multiple, functionally-equivalent paths for the same entity and fact, highlighting a high degree of redundancy in attribute computation. This implies that knowledge computation is highly distributed, potentially explaining the localization-editing mismatch and suggesting that knowledge storage and retrieval in LLMs is far from being well understood.","Large language models (LLMs) store and recall factual knowledge, yet the precise mechanism of how entity representations are transformed to enable specific attribute retrieval remains underexplored. In this work, we investigate this mechanism through the lens of an “attribute-computation path”—a sequence of computational steps over the entity representation required to elicit a target attribute. We then propose an iterative patching protocol to identify a minimal subset of layers necessary for this computation. Applying our method to LLaMA 3.1 8B and Qwen 3 8B, we find that these paths are non-contiguous, often skipping layers, and that models possess multiple, functionally-equivalent paths for the same entity and fact, highlighting a high degree of redundancy in attribute computation. This implies that knowledge computation is highly distributed, potentially explaining the localization-editing mismatch and suggesting that knowledge storage and retrieval in LLMs is far from being well understood.",acl_anthology,conference,ACL,formally_published,2026-01-01,,,3.275538398643687,large language model,,https://aclanthology.org/2026.acl-long.2168/,https://aclanthology.org/2026.acl-long.2168.pdf,open,"pdf/2026-06-25_23_Factual Retrieval in LLMs Is a Redundant, Distributed and Non-Contiguous Process.pdf",downloaded
24,Query-Efficient Agentic Graph Extraction Attacks on GraphRAG Systems,Shuhua Yang; Jiahao Zhang; Yilong Wang; Dongwon Lee; Suhang Wang,"Graph-based retrieval-augmented generation (GraphRAG) systems construct knowledge graphs over document collections to support multi-hop reasoning. While prior work shows that GraphRAG responses may leak retrieved subgraphs, the feasibility of *query-efficient* reconstruction of the hidden graph structure remains unexplored under realistic query budgets. We study a budget-constrained black-box setting where an adversary adaptively queries the system to steal its latent entity–relation graph. We propose AGEA (Agentic Graph Extraction Attack), a framework that leverages a novelty-guided exploration–exploitation strategy, external graph memory modules, and a two-stage graph extraction pipeline combining lightweight discovery with LLM-based filtering. We evaluate AGEA on medical, agriculture, and literary datasets across Microsoft-GraphRAG and LightRAG systems. Under identical query budgets, AGEA significantly outperforms prior attack baselines, recovering up to 90% of entities and relationships while maintaining high precision. These results demonstrate that modern GraphRAG systems are highly vulnerable to structured, agentic extraction attacks, even under strict query limits. The code is available at https://github.com/shuashua0608/AGEA.","Graph-based retrieval-augmented generation (GraphRAG) systems construct knowledge graphs over document collections to support multi-hop reasoning. While prior work shows that GraphRAG responses may leak retrieved subgraphs, the feasibility of *query-efficient* reconstruction of the hidden graph structure remains unexplored under realistic query budgets. We study a budget-constrained black-box setting where an adversary adaptively queries the system to steal its latent entity–relation graph. We propose AGEA (Agentic Graph Extraction Attack), a framework that leverages a novelty-guided exploration–exploitation strategy, external graph memory modules, and a two-stage graph extraction pipeline combining lightweight discovery with LLM-based filtering. We evaluate AGEA on medical, agriculture, and literary datasets across Microsoft-GraphRAG and LightRAG systems. Under identical query budgets, AGEA significantly outperforms prior attack baselines, recovering up to 90% of entities and relationships while maintaining high precision. These results demonstrate that modern GraphRAG systems are highly vulnerable to structured, agentic extraction attacks, even under strict query limits. The code is available at https://github.com/shuashua0608/AGEA.",acl_anthology,conference,ACL,formally_published,2026-01-01,,,3.272062903001851,knowledge graph,,https://aclanthology.org/2026.acl-long.727/,https://aclanthology.org/2026.acl-long.727.pdf,open,pdf/2026-06-25_24_Query-Efficient Agentic Graph Extraction Attacks on GraphRAG Systems.pdf,downloaded
