index,title,authors,abstract,summary,source,venue_type,journal,publication_status,publication_date,doi,categories,score,matched_keywords,cited_by_count,article_url,pdf_url,open_access_status,local_pdf,pdf_download_status
25,Mind the Heads: Topological Representation Alignment for Multimodal LLMs,Davide Caffagni; Alberto Compagnoni; Federico Melis; Sara Sarto; Pier Luigi Dovesi; Mark Granroth-Wilding; Marcella Cornia; Lorenzo Baraldi,"Representation alignment has emerged as an effective approach to improve Multimodal Large Language Models (MLLMs) by regularizing their internal representations toward those of an external vision encoder. However, existing methods typically align a fixed layer of the language backbone, overlooking the fine-grained structure of Transformer models. In this work, we propose Head-Wise Representation Alignment (HeRA), a method that enforces cross-modal alignment at the level of individual attention heads. Our approach is grounded in the Platonic Representation Hypothesis, focusing on preserving the topological structure of representations (i.e., their local neighborhood relationships) across modalities. Following the Mutual K-Nearest Neighbor (MKNN) alignment metric, we introduce a contrastive objective that acts as a differentiable proxy for matching local structures. HeRA applies this objective during multimodal training to specific attention heads in the LLM, selected by their alignment score according to the MKNN metric. Counterintuitively, we find that aligning the least aligned heads yields the largest gains. Extensive evaluations across multiple MLLMs and 18 benchmarks demonstrate that HeRA consistently improves performance on challenging vision-centric tasks and serves as an effective regularizer against visual hallucinations by naturally curbing the over-reliance on linguistic priors. Our code is publicly released.","Representation alignment has emerged as an effective approach to improve Multimodal Large Language Models (MLLMs) by regularizing their internal representations toward those of an external vision encoder. However, existing methods typically align a fixed layer of the language backbone, overlooking the fine-grained structure of Transformer models. In this work, we propose Head-Wise Representation Alignment (HeRA), a method that enforces cross-modal alignment at the level of individual attention heads. Our approach is grounded in the Platonic Representation Hypothesis, focusing on preserving the topological structure of representations (i.e., their local neighborhood relationships) across modalities. Following the Mutual K-Nearest Neighbor (MKNN) alignment metric, we introduce a contrastive objective that acts as a differentiable proxy for matching local structures. HeRA applies this objective during multimodal training to specific attention heads in the LLM, selected by their alignment score according to the MKNN metric. Counterintuitively, we find that aligning the least aligned heads yields the largest gains. Extensive evaluations across multiple MLLMs and 18 benchmarks demonstrate that HeRA consistently improves performance on challenging vision-centric tasks and serves as an effective regularizer against visual hallucinations by naturally curbing the over-reliance on linguistic priors. Our code is publicly released.",arxiv,preprint,,preprint,2026-06-22,,cs.CV; cs.AI; cs.CL; cs.MM,3.2705807451975124,large language model; multimodal large language model,,http://arxiv.org/abs/2606.23885v1,https://arxiv.org/pdf/2606.23885v1,open,pdf/2026-06-25_25_Mind the Heads_ Topological Representation Alignment for Multimodal LLMs.pdf,downloaded
26,SPIO: Ensemble and Selective Strategies via LLM-Based Multi-Agent Planning in Automated Data Science,Wonduk Seo; Juhyeon Lee; Yanjun Shao; Qingshan Zhou; Seunghyun Lee; Yi Bu,"Large Language Models (LLMs) have enabled dynamic reasoning in automated data analytics, yet recent multi-agent systems remain limited by rigid, single-path workflows that restrict strategic exploration and often lead to suboptimal outcomes. To overcome these limitations, we propose SPIO (Sequential Plan Integration and Optimization), a framework that replaces rigid workflows with adaptive, multi-path planning across four core modules: data preprocessing, feature engineering, model selection, and hyperparameter tuning. In each module, specialized agents generate diverse candidate strategies, which are cascaded and refined by an optimization agent. SPIO offers two operating modes: SPIO-S for selecting a single optimal pipeline, and SPIO-E for ensembling top-k pipelines to maximize robustness. Extensive evaluations on Kaggle and OpenML benchmarks show that SPIO consistently outperforms state-of-the-art baselines, achieving an average performance gain of 5.6%. By explicitly exploring and integrating multiple solution paths, SPIO delivers a more flexible, accurate, and reliable foundation for automated data science.","Large Language Models (LLMs) have enabled dynamic reasoning in automated data analytics, yet recent multi-agent systems remain limited by rigid, single-path workflows that restrict strategic exploration and often lead to suboptimal outcomes. To overcome these limitations, we propose SPIO (Sequential Plan Integration and Optimization), a framework that replaces rigid workflows with adaptive, multi-path planning across four core modules: data preprocessing, feature engineering, model selection, and hyperparameter tuning. In each module, specialized agents generate diverse candidate strategies, which are cascaded and refined by an optimization agent. SPIO offers two operating modes: SPIO-S for selecting a single optimal pipeline, and SPIO-E for ensembling top-k pipelines to maximize robustness. Extensive evaluations on Kaggle and OpenML benchmarks show that SPIO consistently outperforms state-of-the-art baselines, achieving an average performance gain of 5.6%. By explicitly exploring and integrating multiple solution paths, SPIO delivers a more flexible, accurate, and reliable foundation for automated data science.",acl_anthology,conference,ACL,formally_published,2026-01-01,,,3.260368439859604,large language model; multi-agent system,,https://aclanthology.org/2026.acl-long.1039/,https://aclanthology.org/2026.acl-long.1039.pdf,open,pdf/2026-06-25_26_SPIO_ Ensemble and Selective Strategies via LLM-Based Multi-Agent Planning in Automated Data Science.pdf,downloaded
27,FLUX3D: High-Fidelity 3D Gaussian Generation with Diffusion-Aligned Sparse Representation,Haorui Ji; Weizhe Liu; Hongdong Li; Hengkai Guo,"Sparse voxel representation has emerged as a scalable foundation for image-to-3D Gaussian Splatting (3DGS) generation, yet current methods struggle to preserve high-frequency visual details of input images due to two structural bottlenecks. First, they adopt discriminative 2D features optimized for semantic abstraction to construct sparse voxel latents, which suppress reconstructive cues and induce a representation bottleneck. Second, in the generation stage, standard diffusion transformers lack effective mechanisms to align dense 2D image tokens with sparse 3D voxel latents, resulting in a cross-modal correspondence bottleneck. To address these issues, we propose FLUX3D, a scalable image-to-3DGS framework that boosts both representation learning and cross-modal alignment during generation. We first revisit 2D feature selection for sparse-voxel-based 3D representation learning, propose Diffusion-Aligned Structured Latents (DA-SLAT) and couple it with a decoder-only architecture to improve 3DGS reconstruction fidelity. We also design a sparse-structure-aware diffusion framework, which integrates the Sparse-structure Multimodal Diffusion Transformer (SMDiT) and Modal-Aware Rotary Positional Embedding (MARoPE) to achieve geometry-agnostic 2D-3D alignment. Extensive benchmark experiments demonstrate that FLUX3D yields substantial improvements in appearance fidelity and significantly outperforms all state-of-the-art (SOTA) methods in generating high-quality 3DGS assets.","Sparse voxel representation has emerged as a scalable foundation for image-to-3D Gaussian Splatting (3DGS) generation, yet current methods struggle to preserve high-frequency visual details of input images due to two structural bottlenecks. First, they adopt discriminative 2D features optimized for semantic abstraction to construct sparse voxel latents, which suppress reconstructive cues and induce a representation bottleneck. Second, in the generation stage, standard diffusion transformers lack effective mechanisms to align dense 2D image tokens with sparse 3D voxel latents, resulting in a cross-modal correspondence bottleneck. To address these issues, we propose FLUX3D, a scalable image-to-3DGS framework that boosts both representation learning and cross-modal alignment during generation. We first revisit 2D feature selection for sparse-voxel-based 3D representation learning, propose Diffusion-Aligned Structured Latents (DA-SLAT) and couple it with a decoder-only architecture to improve 3DGS reconstruction fidelity. We also design a sparse-structure-aware diffusion framework, which integrates the Sparse-structure Multimodal Diffusion Transformer (SMDiT) and Modal-Aware Rotary Positional Embedding (MARoPE) to achieve geometry-agnostic 2D-3D alignment. Extensive benchmark experiments demonstrate that FLUX3D yields substantial improvements in appearance fidelity and significantly outperforms all state-of-the-art (SOTA) methods in generating high-quality 3DGS assets.",arxiv,preprint,,preprint,2026-06-23,,cs.CV; cs.AI,3.2599662604066246,diffusion,,http://arxiv.org/abs/2606.24874v1,https://arxiv.org/pdf/2606.24874v1,open,pdf/2026-06-25_27_FLUX3D_ High-Fidelity 3D Gaussian Generation with Diffusion-Aligned Sparse Representation.pdf,downloaded
28,SCAIR: Schema-Conditioned Agentic Iterative Reasoning for Enterprise Knowledge Graphs,Prateek Chaturvedi; Yuqicheng Zhu; Hongkuan Zhou; Dongzhuoran Zhou; Yunjie He; Steffen Staab; Fei Du; Jie Tang; Evgeny Kharlamov,"Knowledge Graph–based Retrieval-Augmented Generation (KG-RAG) enables natural language interaction with structured enterprise knowledge, yet existing agentic approaches that perform well on public benchmarks often fail to generalize to real-world enterprise Knowledge Graphs (KGs), which are dense, schema-driven, and operationally constrained. To address these limitations, we propose SCAIR (Schema-Conditioned Agentic Iterative Reasoning), a training-free framework that integrates structured planning with controlled iterative reasoning by injecting schema-conditioned structural priors and enforcing schema-aware traversal during multi-hop reasoning. Experiments on an enterprise-oriented benchmark constructed from a real-world Configuration Management DataBase (CMDB) demonstrate that SCAIR substantially improves performance over existing KG-RAG methods. Crucially, our study highlights that reliable enterprise graph reasoning cannot rely on generic agentic designs; instead, it must explicitly incorporate the target domain’s structural and operational constraints into the reasoning process. We demonstrate that by aligning agent design with business logic, substantial performance gains can be achieved without the need for costly model retraining.","Knowledge Graph–based Retrieval-Augmented Generation (KG-RAG) enables natural language interaction with structured enterprise knowledge, yet existing agentic approaches that perform well on public benchmarks often fail to generalize to real-world enterprise Knowledge Graphs (KGs), which are dense, schema-driven, and operationally constrained. To address these limitations, we propose SCAIR (Schema-Conditioned Agentic Iterative Reasoning), a training-free framework that integrates structured planning with controlled iterative reasoning by injecting schema-conditioned structural priors and enforcing schema-aware traversal during multi-hop reasoning. Experiments on an enterprise-oriented benchmark constructed from a real-world Configuration Management DataBase (CMDB) demonstrate that SCAIR substantially improves performance over existing KG-RAG methods. Crucially, our study highlights that reliable enterprise graph reasoning cannot rely on generic agentic designs; instead, it must explicitly incorporate the target domain’s structural and operational constraints into the reasoning process. We demonstrate that by aligning agent design with business logic, substantial performance gains can be achieved without the need for costly model retraining.",acl_anthology,conference,ACL,formally_published,2026-01-01,,,3.258424531995857,knowledge graph,,https://aclanthology.org/2026.acl-industry.76/,https://aclanthology.org/2026.acl-industry.76.pdf,open,pdf/2026-06-25_28_SCAIR_ Schema-Conditioned Agentic Iterative Reasoning for Enterprise Knowledge Graphs.pdf,downloaded
29,TeCES: Collaborative Geometric Knowledge Representation Framework under Evolving Fact Snapshots,Jiujiang Guo; Zhengliang Guo; Kai Wang; Meiyang Wang; Dehua Peng; Shaozu Yuan; Chengyin Hu; Shuan Ai; Yiwei Wei,"Existing knowledge graph completion research is gradually shifting from representing logical semantics of static facts to modeling evolving semantics of temporal facts, yet lacks collaborative modeling of both within a unified framework. To this end, we use concept of snapshots to decompose fact features into two complementary mechanisms: (a) intra-snapshot semantic coupling, where entities and relations exhibit snapshot-specific meanings through multidimensional interactions; (b) trans-snapshot evolutionary synergy, where relations between entities evolve across snapshots and manifest varying states. These snapshot mechanisms jointly reveal underlying logic of facts. To track them, we propose TeCES, a framework for high-fidelity modeling of evolving snapshots. TeCES embeds facts into a 2-grade geometric algebra (GA) system to capture complex semantics via multilevel structures. Temporal information is attached to each entity for mapping into snapshot spaces, while relations and timestamps are reconfigured into composite GA representations. Geometric products enable multidimensional interactions, revealing relation state changes over time. Lastly, the head entity at each snapshot combines with fused temporal-relational representation via geometric product to approximate the target tail entity at multiple levels. Overall, TeCES supports joint modeling of evolving snapshots within a lightweight GA system and significantly outperforms SOTA models on six benchmarks.","Existing knowledge graph completion research is gradually shifting from representing logical semantics of static facts to modeling evolving semantics of temporal facts, yet lacks collaborative modeling of both within a unified framework. To this end, we use concept of snapshots to decompose fact features into two complementary mechanisms: (a) intra-snapshot semantic coupling, where entities and relations exhibit snapshot-specific meanings through multidimensional interactions; (b) trans-snapshot evolutionary synergy, where relations between entities evolve across snapshots and manifest varying states. These snapshot mechanisms jointly reveal underlying logic of facts. To track them, we propose TeCES, a framework for high-fidelity modeling of evolving snapshots. TeCES embeds facts into a 2-grade geometric algebra (GA) system to capture complex semantics via multilevel structures. Temporal information is attached to each entity for mapping into snapshot spaces, while relations and timestamps are reconfigured into composite GA representations. Geometric products enable multidimensional interactions, revealing relation state changes over time. Lastly, the head entity at each snapshot combines with fused temporal-relational representation via geometric product to approximate the target tail entity at multiple levels. Overall, TeCES supports joint modeling of evolving snapshots within a lightweight GA system and significantly outperforms SOTA models on six benchmarks.",acl_anthology,conference,ACL,formally_published,2026-01-01,,,3.257743955336214,knowledge graph,,https://aclanthology.org/2026.acl-long.1181/,https://aclanthology.org/2026.acl-long.1181.pdf,open,pdf/2026-06-25_29_TeCES_ Collaborative Geometric Knowledge Representation Framework under Evolving Fact Snapshots.pdf,downloaded
30,Constructing Interpretable Features from Compositional Neuron Groups,Or David Shafran; Atticus Geiger; Mor Geva,"A central goal for mechanistic interpretability has been to identify the right units of analysis in large language models (LLMs) that causally explain their outputs. While early work focused on individual neurons, evidence that neurons often encode multiple concepts has motivated a shift toward analyzing directions in activation space. A key question is how to find directions that capture interpretable features in an unsupervised manner. Current methods rely on dictionary learning with sparse autoencoders (SAEs), commonly trained over residual stream activations to learn directions from scratch. However, SAEs often struggle in causal evaluations and lack intrinsic interpretability, as their learning is not explicitly tied to the computations of the model. Here, we tackle these limitations by directly decomposing MLP activations with semi-nonnegative matrix factorization (SNMF), such that the learned features are (a) sparse linear combinations of co-activated neurons, and (b) mapped to their activating inputs, making them directly interpretable. Experiments on Llama 3.1, Gemma 2 and GPT-2 show that SNMF derived features outperform SAEs and a strong supervised baseline (difference-in-means) on causal steering, while aligning with human-interpretable concepts. Further analysis reveals that specific neuron combinations are reused across semantically-related features, exposing a hierarchical structure in the MLP’s activation space. Together, these results position SNMF as a simple and effective tool for identifying interpretable features and dissecting concept representations in LLMs.","A central goal for mechanistic interpretability has been to identify the right units of analysis in large language models (LLMs) that causally explain their outputs. While early work focused on individual neurons, evidence that neurons often encode multiple concepts has motivated a shift toward analyzing directions in activation space. A key question is how to find directions that capture interpretable features in an unsupervised manner. Current methods rely on dictionary learning with sparse autoencoders (SAEs), commonly trained over residual stream activations to learn directions from scratch. However, SAEs often struggle in causal evaluations and lack intrinsic interpretability, as their learning is not explicitly tied to the computations of the model. Here, we tackle these limitations by directly decomposing MLP activations with semi-nonnegative matrix factorization (SNMF), such that the learned features are (a) sparse linear combinations of co-activated neurons, and (b) mapped to their activating inputs, making them directly interpretable. Experiments on Llama 3.1, Gemma 2 and GPT-2 show that SNMF derived features outperform SAEs and a strong supervised baseline (difference-in-means) on causal steering, while aligning with human-interpretable concepts. Further analysis reveals that specific neuron combinations are reused across semantically-related features, exposing a hierarchical structure in the MLP’s activation space. Together, these results position SNMF as a simple and effective tool for identifying interpretable features and dissecting concept representations in LLMs.",acl_anthology,conference,ACL,formally_published,2026-01-01,,,3.257581949777153,large language model,,https://aclanthology.org/2026.acl-long.1959/,https://aclanthology.org/2026.acl-long.1959.pdf,open,pdf/2026-06-25_30_Constructing Interpretable Features from Compositional Neuron Groups.pdf,downloaded
