index,title,authors,abstract,summary,source,venue_type,journal,publication_status,publication_date,doi,categories,score,matched_keywords,cited_by_count,article_url,pdf_url,open_access_status,local_pdf,pdf_download_status
25,Position-aware Automatic Circuit Discovery,Tal Haklay; Hadas Orgad; David Bau; Aaron Mueller; Yonatan Belinkov,"A widely used strategy to discover and understand language model mechanisms is circuit analysis. A circuit is a minimal subgraph of a model’s computation graph that executes a specific task. We identify a gap in existing circuit discovery methods: they assume circuits are position-invariant, treating model components as equally relevant across input positions. This limits their ability to capture cross-positional interactions or mechanisms that vary across positions. To address this gap, we propose two improvements to incorporate positionality into circuits, even on tasks containing variable-length examples. First, we extend edge attribution patching, a gradient-based method for circuit discovery, to differentiate between token positions. Second, we introduce the concept of a dataset schema, which defines token spans with similar semantics across examples, enabling position-aware circuit discovery in datasets with variable length examples. We additionally develop an automated pipeline for schema generation and application using large language models. Our approach enables fully automated discovery of position-sensitive circuits, yielding better trade-offs between circuit size and faithfulness compared to prior work.",本文提出一种“位置感知”的自动电路发现方法，通过区分不同 token 位置并引入数据集 schema 来自动识别跨位置、长度可变任务中的位置敏感电路，从而比以往方法在电路规模与忠实度之间取得更好平衡。,acl_anthology,conference,ACL,formally_published,2025-01-01,,,3.3445109097915737,large language model,,https://aclanthology.org/2025.acl-long.141/,https://aclanthology.org/2025.acl-long.141.pdf,open,pdf/2026-06-17_25_Position-aware Automatic Circuit Discovery.pdf,downloaded
26,Tree-KG: An Expandable Knowledge Graph Construction Framework for Knowledge-intensive Domains,Songjie Niu; Kaisen Yang; Rui Zhao; Yichao Liu; Zonglin Li; Hongning Wang; Wenguang Chen,"In knowledge-intensive domains like scientific research, effective decisions rely on organizing and retrieving intricate data. Knowledge graphs (KGs) help by structuring entities, relations, and contextual dependencies, but building KGs in such domains is challenging due to inherent complexity, manual effort, and rapid evolution. Inspired by how humans organize knowledge hierarchically, we propose Tree-KG, an expandable framework that combines structured domain texts with advanced semantic techniques. First, Tree-KG builds a tree-like graph from textbook structures using large language models (LLMs) and domain-specific entities, creating an explicit KG . Then, through iterative expansion with flexible, predefined operators, it uncovers hidden KG while preserving semantic coherence. Experiments demonstrate that Tree-KG consistently surpasses competing methods, achieving the highest F1 scores (12–16% above the second-best), with notable performance (F1 0.81) on the Text-Annotated dataset, highlighting its effectiveness in extracting high-quality information from source texts. Additionally, Tree-KG provides superior structural alignment, domain-specific extraction, and cost-efficiency, delivering robust results with reduced token usage and adaptable, resource-conscious deployment.",Tree-KG 通过利用教材式层级结构、领域实体与大语言模型先构建显式树状知识图谱，再用可扩展算子迭代挖掘隐含关系，从而在知识密集领域以更低成本实现更高质量、更高一致性的知识图谱构建，并在实验中显著优于现有方法。,acl_anthology,conference,ACL,formally_published,2025-01-01,,,3.3391554462160995,knowledge graph; large language model,,https://aclanthology.org/2025.acl-long.907/,https://aclanthology.org/2025.acl-long.907.pdf,open,pdf/2026-06-17_26_Tree-KG_ An Expandable Knowledge Graph Construction Framework for Knowledge-intensive Domains.pdf,downloaded
27,Self-supervised Quantized Representation for Seamlessly Integrating Knowledge Graphs with Large Language Models,Qika Lin; Tianzhe Zhao; Kai He; Zhen Peng; Fangzhi Xu; Ling Huang; Jingying Ma; Mengling Feng,"Due to the presence of the natural gap between Knowledge Graph (KG) structures and the natural language, the effective integration of holistic structural information of KGs with Large Language Models (LLMs) has emerged as a significant question. To this end, we propose a two-stage framework to learn and apply quantized codes for each entity, aiming for the seamless integration of KGs with LLMs. Firstly, a self-supervised quantized representation (SSQR) method is proposed to compress both KG structural and semantic knowledge into discrete codes (i.e., tokens) that align the format of language sentences. We further design KG instruction-following data by viewing these learned codes as features to directly input to LLMs, thereby achieving seamless integration. The experiment results demonstrate that SSQR outperforms existing unsupervised quantized methods, producing more distinguishable codes. Moreover, the fine-tuned LLaMA2 and LLaMA3.1 also have superior performance on KG link prediction and triple classification tasks, utilizing only 16 tokens per entity instead of thousands in conventional prompting methods.",该论文提出一种两阶段的自监督量化表示方法 SSQR，将知识图谱的结构与语义信息压缩为与自然语言 token 对齐的离散实体代码，并以此无缝输入大语言模型，在仅用每个实体 16 个 token 的情况下显著提升了链路预测和三元组分类性能。,acl_anthology,conference,ACL,formally_published,2025-01-01,,,3.337765140602577,knowledge graph; large language model,,https://aclanthology.org/2025.acl-long.667/,https://aclanthology.org/2025.acl-long.667.pdf,open,pdf/2026-06-17_27_Self-supervised Quantized Representation for Seamlessly Integrating Knowledge Graphs with Large Language Models.pdf,downloaded
28,HyperET: Efficient Training in Hyperbolic Space for Multi-modal Large Language Models,"Peng, Zelin; Xu, Zhengqin; Liu, Qingyang; Yang, Xiaokang; Shen, Wei","Multi-modal large language models (MLLMs) have emerged as a transformative approach for aligning visual and textual understanding. They typically require extremely high computational resources (e.g., thousands of GPUs) for training to achieve cross-modal alignment at multi-granularity levels. We argue that a key source of this inefficiency lies in the vision encoders they widely equip with, e.g., CLIP and SAM, which lack the alignment with language at multi-granularity levels. To address this issue, in this paper, we leverage hyperbolic space, which inherently models hierarchical levels and thus provides a principled framework for bridging the granularity gap between visual and textual modalities at an arbitrary granularity level. Concretely, we propose an efficient training paradigm for MLLMs, dubbed as \blg, which can optimize visual representations to align with their textual counterparts at an arbitrary granularity level through dynamic hyperbolic radius adjustment in hyperbolic space. \alg employs learnable matrices with M\""{o}bius multiplication operations, implemented via three effective configurations: diagonal scaling matrices, block-diagonal matrices, and banded matrices, providing a flexible yet efficient parametrization strategy. Comprehensive experiments across multiple MLLM benchmarks demonstrate that \alg consistently improves both existing pre-training and fine-tuning MLLMs clearly with less than 1\% additional parameters. Code is available at \url{https://github.com/godlin-sjtu/HyperET}.",HyperET 通过将多模态大语言模型的视觉—文本对齐迁移到可建模层次结构的双曲空间，并用动态半径调整与高效 Möbius 参数化在任意粒度上优化表示，从而以不到 1% 的额外参数显著提升 MLLM 预训练和微调效果并降低训练开销。,neurips,conference,NeurIPS 2025,formally_published,2026-04-23,,,3.3349264675201606,large language model,,https://proceedings.neurips.cc/paper_files/paper/2025/hash/0bcd8d153b8c548629eca53f4ebdeb42-Abstract-Conference.html,https://proceedings.neurips.cc/paper_files/paper/2025/file/0bcd8d153b8c548629eca53f4ebdeb42-Paper-Conference.pdf,open,pdf/2026-06-17_28_HyperET_ Efficient Training in Hyperbolic Space for Multi-modal Large Language Models.pdf,downloaded
29,RoFt-Mol: Benchmarking Robust Fine-tuning with Molecular Graph Foundation Models,"Liu, Shikun; Zou, Deyu; Shoghi, Nima; Fung, Victor; Liu, Kai; Li, Pan","In the era of foundation models, fine-tuning pre-trained models for specific downstream tasks has become crucial. This drives the need for robust fine-tuning methods to address challenges such as model overfitting and sparse labeling. Moleculargraph foundation models (MGFMs) face unique difficulties that complicate fine-tuning. These models are limited by smaller pre-training datasets and more severedata scarcity for downstream tasks, both of which require enhanced model generalization. Moreover, MGFMs must accommodate diverse objectives, including bothregression and classification tasks. To better understand and improve fine-tuningtechniques under these conditions, we classify eight fine-tuning methods into threemechanisms: weight-based, representation-based, and partial fine-tuning. Webenchmark these methods on downstream regression and classification tasks acrosssupervised and self-supervised pre-trained models in diverse labeling settings. Thisextensive evaluation provides valuable insights and informs the design of a refinedrobust fine-tuning method, ROFT-MOL. This approach combines the strengths ofsimple post-hoc weight interpolation with more complex weight ensemble fine-tuning methods, delivering improved performance across both task types whilemaintaining the ease of use inherent in post-hoc weight interpolation.",RoFt-Mol 系统基准评测了分子图基础模型在回归与分类任务、不同标注稀缺场景下的多种鲁棒微调方法，并提出结合后验权重插值与权重集成优势的简洁高效方法 ROFT-MOL，以提升模型泛化与微调稳定性。,neurips,conference,NeurIPS 2025,formally_published,2026-04-23,,,3.3335814618064568,foundation model,,https://proceedings.neurips.cc/paper_files/paper/2025/hash/013acf7d59f4333131fc8581e86148b1-Abstract-Datasets_and_Benchmarks_Track.html,https://proceedings.neurips.cc/paper_files/paper/2025/file/013acf7d59f4333131fc8581e86148b1-Paper-Datasets_and_Benchmarks_Track.pdf,open,pdf/2026-06-17_29_RoFt-Mol_ Benchmarking Robust Fine-tuning with Molecular Graph Foundation Models.pdf,downloaded
30,Half a Link can Be Enough to Predict a Whole Link: Understanding Generalization in Knowledge Graph Foundation Models,Cosimo Gregucci; Obaidah Theeb; Daniel Hernandez; Antonio Vergari; Steffen Staab,"Knowledge graph (KG) foundation models (KGFMs) are zero-shot generalizers: trained once, they can predict links on unseen graphs without retraining. However, understanding when and how they can robustly generalize across KGs is still an open question. In this paper, we shed some light on their generalization mechanisms highlighting how their performance on unseen KGs is not uniform when it comes to partially seen links, which we call half-links. In fact, we show that to predict a test triple $(h,r,t)$ it might suffice in practice to have observed the half-link $(h,r)$ or $(r,t)$ in the inference graph. This yields a taxonomy of four scenarios when combinations of these half-links are observed or not. In a rigorous stratified analysis over these scenarios, we reveal that SoTA KGFMs use seen half links for predictions, while unseen half-links pose different challenges. As such, our finer-grained taxonomy can be a diagnostic protocol for robust KGFM generalization and highlights where novel KGFMs can improve.","TL;DR：本文发现知识图谱基础模型在零样本链路预测中的泛化并不均匀，很多时候只要在推理图中见过测试三元组的一半信息（如 \((h,r)\) 或 \((r,t)\) 这样的“半链接”）就足以做出准确预测，因此作者提出基于半链接可见性的四类诊断框架，揭示现有模型较依赖已见半链接而在真正未见场景下仍存在明显泛化不足。",arxiv,preprint,,preprint,2026-06-16,,cs.LG,3.332592946790057,foundation model; knowledge graph,,http://arxiv.org/abs/2606.18001v1,https://arxiv.org/pdf/2606.18001v1,open,pdf/2026-06-17_30_Half a Link can Be Enough to Predict a Whole Link_ Understanding Generalization in Knowledge Graph Foundation Models.pdf,downloaded
